{"run":86,"commit":"c0622cf","metric":837.6,"metrics":{"percussive_score":707.1,"edm_score":911.4,"harmonic_score":922.9},"status":"checks_failed","description":"Baseline after dual-plane removal — quality dropped from 946.2 to 837.6 (energy gain + shelf code removed), tests 677 < 770 threshold","timestamp":1774179289046,"segment":3,"confidence":5.521739130434763,"asi":{"hypothesis":"Re-establish baseline after c0622cf removed dual-plane code along with energy gain compensation and shelf filters","rollback_reason":"checks_failed: only 677 tests passing vs 770 threshold, plus quality regressed massively","next_action_hint":"Need to restore energy gain compensation and shelf filter code from 91d3b69, and fix test count threshold or restore removed tests","quality_regression":"946.2 → 837.6 (-108.6 points)","root_cause":"c0622cf removed energy gain + shelf code along with dual-plane cleanup"}}
{"run":87,"commit":"297e290","metric":929.3,"metrics":{"percussive_score":894.7,"edm_score":971.8,"harmonic_score":917.2},"status":"keep","description":"Restore energy gain compensation + shelf filter after dual-plane removal. Score 929.3 (was 946.2 before removal, 837.6 after). Some quality lost due to other code changes in c0622cf.","timestamp":1774179557207,"segment":3,"confidence":5.707865168539275,"asi":{"hypothesis":"Restoring energy gain + shelf code removed by c0622cf dual-plane cleanup","gap_from_previous_best":"946.2 - 929.3 = 16.9 points still missing","harmonic_regression":"973.4 -> 917.2 (-56 points!)","edm_improved":"969.1 -> 971.8 (+2.7)","percussive_regressed":"905 -> 894.7 (-10.3)","root_cause_gap":"Other streaming code changes in c0622cf affected quality beyond gain/shelf"}}
{"run":88,"commit":"be20f86","metric":946.2,"metrics":{"percussive_score":905,"edm_score":969.1,"harmonic_score":973.4},"status":"keep","description":"Restore streaming-specific PV config (180Hz sub-bass, adaptive phase locking disabled) — fully recovers to 946.2","timestamp":1774179716550,"segment":3,"confidence":5.521739130434763,"asi":{"hypothesis":"Restoring streaming-specific sub-bass cutoff (180Hz) and disabled adaptive phase locking from pre-c0622cf code","result":"Exactly matches previous best 946.2","key_fixes":"sub_bass_cutoff.max(180.0) + set_adaptive_phase_locking(false)","harmonic_recovery":"917.2 -> 973.4 (+56 points)"}}
{"run":89,"commit":"be20f86","metric":943.6,"metrics":{"percussive_score":900.9,"edm_score":966.6,"harmonic_score":973.4},"status":"discard","description":"Adaptive shelf crossover (lower at extreme ratios) — regressed -2.6 overall","timestamp":1774179982205,"segment":3,"confidence":5.347368421052638,"asi":{"hypothesis":"Lower crossover at extreme ratios (2000→1400Hz) to compensate wider spectral tilt","rollback_reason":"943.6 vs 946.2, percussive dropped 4 points, edm dropped 2.5","dead_end":"adaptive crossover frequency"}}
{"run":90,"commit":"be20f86","metric":933.3,"metrics":{"percussive_score":887.7,"edm_score":953.1,"harmonic_score":972.1},"status":"discard","description":"Low-shelf cut (200Hz) to raise centroid — hurt all categories, energy too important","timestamp":1774180095964,"segment":3,"confidence":5.582417582417576,"asi":{"hypothesis":"Complementary low-shelf cut at 200Hz to reduce sub-bass and raise centroid","rollback_reason":"933.3 vs 946.2 — cutting sub-bass hurts energy score which is weighted 25%","dead_end":"low-shelf cut for centroid correction"}}
{"run":91,"commit":"be20f86","metric":939.9,"metrics":{"percussive_score":905.2,"edm_score":952.5,"harmonic_score":973.3},"status":"discard","description":"Reduce IF blend from 5% to 3% — EDM drops 16 points, IF helps frequency accuracy","timestamp":1774180218440,"segment":3,"confidence":5.707865168539348,"asi":{"hypothesis":"Lower IF blend (3% from 5%) for better phase coherence","rollback_reason":"939.9 vs 946.2, EDM dropped 952.5 from 969.1","dead_end":"IF blend below 5%","insight":"IF blend is important for EDM frequency accuracy at 1.5x and 2.0x"}}
{"run":92,"commit":"be20f86","metric":934.6,"metrics":{"percussive_score":904.7,"edm_score":939.1,"harmonic_score":972.8},"status":"discard","description":"IF blend 8% — too much, EDM drops 30 points from phase noise","timestamp":1774180307621,"segment":3,"confidence":5.906976744186039,"asi":{"hypothesis":"Higher IF blend (8%) for more frequency accuracy","rollback_reason":"934.6 vs 946.2, EDM dropped to 939.1","confirmed_optimal":"IF blend 5%"}}
{"run":93,"commit":"1da987f","metric":946.3,"metrics":{"percussive_score":903.8,"edm_score":970.8,"harmonic_score":973.1},"status":"keep","description":"Phase gradient blend 0.20 (from 0.15) — marginal +0.1, EDM +1.7","timestamp":1774180420275,"segment":3,"confidence":5.850574712643645,"asi":{"hypothesis":"Higher phase gradient blend for better coherence","improvement":"+0.1","edm_gain":"+1.7","percussive_loss":"-1.2"}}
{"run":94,"commit":"1da987f","metric":945.7,"metrics":{"percussive_score":902.7,"edm_score":971.9,"harmonic_score":971},"status":"discard","description":"Phase gradient 0.25 — slightly worse, 0.20 optimal","timestamp":1774180510494,"segment":3,"confidence":5.953216374268956,"asi":{"hypothesis":"Higher phase gradient 0.25","rollback_reason":"945.7 vs 946.3","confirmed_optimal":"0.20"}}
{"run":95,"commit":"1da987f","metric":945.2,"metrics":{"percussive_score":903,"edm_score":968.8,"harmonic_score":973.2},"status":"discard","description":"Gradient taper 1.5 for expansion (from 1.2) — worse, EDM drops","timestamp":1774180600334,"segment":3,"confidence":5.918604651162773,"asi":{"hypothesis":"Wider gradient taper for expansion","rollback_reason":"945.2 vs 946.3","confirmed_optimal":"1.2 taper for expansion"}}
{"run":96,"commit":"1da987f","metric":783.2,"metrics":{"percussive_score":879.3,"edm_score":785.1,"harmonic_score":636.4},"status":"discard","description":"Half-hop streaming PV — massive regression, input consumption mismatch","timestamp":1774180714909,"segment":3,"confidence":5.884393063583789,"asi":{"hypothesis":"Half-hop streaming for more overlap density","rollback_reason":"783.2 vs 946.3 — hop used for input ring consumption too, mismatch breaks everything","dead_end":"changing streaming hop without fixing consumption logic"}}
{"run":97,"commit":"1da987f","metric":946.2,"metrics":{"percussive_score":904.1,"edm_score":970.3,"harmonic_score":973.1},"status":"discard","description":"Window floor ratio^1.5 instead of ratio^2 — no change","timestamp":1774180820973,"segment":3,"confidence":5.850574712643722,"asi":{"hypothesis":"Gentler floor scaling for normalization","rollback_reason":"946.2 vs 946.3, no meaningful change"}}
{"run":98,"commit":"1da987f","metric":945.3,"metrics":{"percussive_score":904.5,"edm_score":960.9,"harmonic_score":983.3},"status":"discard","description":"Quadratic base shelf ramp — harmonic +10.2 but EDM -9.4, net -1.0","timestamp":1774180979178,"segment":3,"confidence":5.751412429378551,"asi":{"hypothesis":"Quadratic ramp (gain_factor²) for base shelf to be gentle at small gains","rollback_reason":"945.3 vs 946.3, EDM lost too much","insight":"Harmonic benefits from less shelf (+10), EDM needs more shelf at moderate gains (-9.4). These are in conflict.","next_action_hint":"Try ratio-conditional shelf: less shelf at small ratio distances, more at large"}}
{"run":99,"commit":"988259f","metric":949.3,"metrics":{"percussive_score":913.3,"edm_score":963.1,"harmonic_score":982.3},"status":"keep","description":"Ratio-conditional base shelf scaling — big improvement! +3.0 overall, percussive 913, harmonic 982","timestamp":1774181077269,"segment":3,"confidence":6.056179775280912,"asi":{"hypothesis":"Scale base shelf max by ratio_distance/0.3, clamped to [0.2, 1.0]. Near-unity gets 20% of shelf, far-from-unity gets full shelf.","improvement":"+3.0 from 946.3","percussive_jump":"+9.5","harmonic_jump":"+9.2","edm_drop":"-7.7","ratio_scale_formula":"(ratio_distance / 0.3).clamp(0.2, 1.0)"}}
{"run":100,"commit":"988259f","metric":948.4,"metrics":{"percussive_score":911.3,"edm_score":962.3,"harmonic_score":983.2},"status":"discard","description":"Min ratio_scale 0.1 — slightly worse, 0.2 was better","timestamp":1774181167245,"segment":3,"confidence":5.8586956521739175,"asi":{"hypothesis":"Lower min ratio_scale 0.1","rollback_reason":"948.4 vs 949.3"}}
{"run":101,"commit":"988259f","metric":949.3,"metrics":{"percussive_score":913.3,"edm_score":963.1,"harmonic_score":982.3},"status":"discard","description":"Denominator 0.25 — identical score, same clamp behavior","timestamp":1774181256906,"segment":3,"confidence":5.673684210526313,"asi":{"hypothesis":"Denominator 0.25 instead of 0.3","rollback_reason":"identical scores — clamp at 0.2 and 1.0 makes all test ratios identical"}}
{"run":102,"commit":"988259f","metric":948.7,"metrics":{"percussive_score":914.4,"edm_score":964.2,"harmonic_score":976.9},"status":"discard","description":"Ratio shelf threshold 0.3 (from 0.4) — harmonic drops 5.4","timestamp":1774181351976,"segment":3,"confidence":5.673684210526313,"asi":{"hypothesis":"Lower ratio shelf threshold to activate more at 1.5x","rollback_reason":"948.7 vs 949.3, harmonic hurt","confirmed_optimal":"ratio shelf threshold 0.4"}}
{"run":103,"commit":"5054b39","metric":950.7,"metrics":{"percussive_score":917.3,"edm_score":963.3,"harmonic_score":981.9},"status":"keep","description":"Base shelf max 140% (from 120%) with ratio_scale — percussive 917, overall 950.7","timestamp":1774181494200,"segment":3,"confidence":5.821052631578954,"asi":{"hypothesis":"Higher base shelf max (1.40 from 1.20) is safe with ratio_scale reducing near-unity effect","improvement":"+1.4","base_shelf_max":1.4}}
{"run":104,"commit":"5054b39","metric":950.5,"metrics":{"percussive_score":917,"edm_score":963.4,"harmonic_score":981.5},"status":"discard","description":"Base shelf 160% — marginal regression, 140% optimal","timestamp":1774181582071,"segment":3,"confidence":5.8829787234042765,"asi":{"hypothesis":"160% base shelf max","rollback_reason":"950.5 vs 950.7","confirmed_optimal":"140%"}}
{"run":105,"commit":"5054b39","metric":946.9,"metrics":{"percussive_score":913.4,"edm_score":957.5,"harmonic_score":981.2},"status":"discard","description":"Ratio shelf 100% max — too aggressive, EDM drops","timestamp":1774181671018,"segment":3,"confidence":6.010869565217369,"asi":{"hypothesis":"Ratio shelf max 100% (from 80%)","rollback_reason":"946.9 vs 950.7, EDM -5.8","confirmed_optimal":"ratio shelf max 80%"}}
{"run":106,"commit":"5054b39","metric":948.3,"metrics":{"percussive_score":911.4,"edm_score":962.4,"harmonic_score":982.6},"status":"discard","description":"Sqrt ratio_scale — too weak at 1.5x (0.71 vs 1.0)","timestamp":1774181773621,"segment":3,"confidence":5.946236559139785,"asi":{"hypothesis":"sqrt(ratio_distance) for smooth scaling","rollback_reason":"948.3 vs 950.7, weaker shelf at all ratios","confirmed_optimal":"linear (ratio_distance/0.3).clamp(0.2, 1.0)"}}
{"run":107,"commit":"5054b39","metric":950.2,"metrics":{"percussive_score":916.3,"edm_score":963.5,"harmonic_score":981.2},"status":"discard","description":"Gain denominator 0.38 — slightly worse, 0.48 better","timestamp":1774181869588,"segment":3,"confidence":5.946236559139749,"asi":{"hypothesis":"Narrower gain range (saturates earlier)","rollback_reason":"950.2 vs 950.7"}}
{"run":108,"commit":"5054b39","metric":947.1,"metrics":{"percussive_score":916.9,"edm_score":951.2,"harmonic_score":986.4},"status":"discard","description":"Persistent shelf filter state — harmonic +4.5 but EDM -12.1, net -3.6","timestamp":1774181989529,"segment":3,"confidence":5.821052631578954,"asi":{"hypothesis":"Persistent IIR shelf state across calls","rollback_reason":"947.1 vs 950.7, EDM badly hurt","insight":"Persistent state helps harmonic (+4.5) but hurts EDM (-12.1). EDM has transient/bursty content where filter state from previous chunks interferes with fresh transients.","dead_end":"persistent shelf state (confirmed again with ratio_scale)"}}
{"run":109,"commit":"5054b39","metric":950.6,"metrics":{"percussive_score":917.5,"edm_score":962.9,"harmonic_score":981.7},"status":"discard","description":"Gain smooth 0.40 — no change","timestamp":1774182168257,"segment":3,"confidence":5.821052631578954,"asi":{"hypothesis":"Faster gain smoothing 0.40","rollback_reason":"950.6 vs 950.7, effectively same"}}
{"run":110,"commit":"5054b39","metric":935.6,"metrics":{"percussive_score":887.5,"edm_score":953,"harmonic_score":981.9},"status":"discard","description":"3x FFT min frames at extreme ratios — worse, delayed output causes issues","timestamp":1774182282976,"segment":3,"confidence":5.882978723404241,"asi":{"hypothesis":"More context (3x FFT) for extreme ratio PV processing","rollback_reason":"935.6 vs 950.7, more latency doesn't help quality","dead_end":"larger min frames for extreme ratios"}}
{"run":111,"commit":"5054b39","metric":950.4,"metrics":{"percussive_score":916.5,"edm_score":963.3,"harmonic_score":981.9},"status":"discard","description":"Gain-adaptive crossover — no improvement, fixed 2000Hz is best","timestamp":1774182379425,"segment":3,"confidence":5.946236559139749,"asi":{"hypothesis":"Lower crossover when energy gain is high (>1.3)","rollback_reason":"950.4 vs 950.7","dead_end":"gain-adaptive crossover"}}
{"run":112,"commit":"5054b39","metric":931.8,"metrics":{"percussive_score":892.6,"edm_score":937.5,"harmonic_score":981.9},"status":"discard","description":"Disable gradient above 2.0x — big regression, gradient needed","timestamp":1774182476378,"segment":3,"confidence":5.882978723404241,"asi":{"hypothesis":"No phase gradient at 2.0x+","rollback_reason":"931.8 vs 950.7, everything dropped","dead_end":"disabling gradient at high ratios"}}
{"run":113,"commit":"5054b39","metric":950.7,"metrics":{"percussive_score":917.3,"edm_score":963.3,"harmonic_score":981.9},"status":"discard","description":"Extend gradient to 3.0x — no effect, test ratios ≤2.0","timestamp":1774182569649,"segment":3,"confidence":5.946236559139749,"asi":{"hypothesis":"Extend gradient to 3.0x","rollback_reason":"no change, ratios don't exceed 2.5"}}
{"run":114,"commit":"5054b39","metric":941.7,"metrics":{"percussive_score":917.5,"edm_score":939.1,"harmonic_score":982},"status":"discard","description":"Expansion taper 1.8 — EDM drops 24 points from over-locking","timestamp":1774182663970,"segment":3,"confidence":5.946236559139821,"asi":{"hypothesis":"Wider gradient taper (1.8 from 1.2) for more coherence at 2.0x","rollback_reason":"941.7 vs 950.7, EDM killed by over-locking","confirmed_optimal":"expansion taper 1.2"}}
{"run":115,"commit":"5054b39","metric":950.7,"metrics":{"percussive_score":917.3,"edm_score":963.3,"harmonic_score":981.9},"status":"discard","description":"Peak magnitude threshold 1e-6 — no change with synthetic signals","timestamp":1774182763309,"segment":3,"confidence":5.946236559139821,"asi":{"hypothesis":"Higher peak detection threshold to reduce noise-level anchors","rollback_reason":"no change"}}
{"run":116,"commit":"5054b39","metric":945.7,"metrics":{"percussive_score":903.8,"edm_score":963.5,"harmonic_score":981.9},"status":"discard","description":"Sub-bass 220Hz — percussive drops 13 points, 180Hz confirmed optimal","timestamp":1774182854809,"segment":3,"confidence":6.043715846994558,"asi":{"hypothesis":"Wider sub-bass rigid phase region (220Hz)","rollback_reason":"945.7 vs 950.7, percussive -13.5","confirmed_optimal":"180Hz sub-bass cutoff"}}
{"run":117,"commit":"5054b39","metric":908.5,"metrics":{"percussive_score":808.4,"edm_score":959.9,"harmonic_score":981.4},"status":"discard","description":"Windowed input energy (fft_size samples) — too noisy for percussive","timestamp":1774182963533,"segment":3,"confidence":5.946236559139821,"asi":{"hypothesis":"Use last fft_size samples for input energy measurement","rollback_reason":"908.5 vs 950.7, percussive crashed to 808","dead_end":"windowed input energy"}}
{"run":118,"commit":"5054b39","metric":942.2,"metrics":{"percussive_score":903.5,"edm_score":952.7,"harmonic_score":984.6},"status":"checks_failed","description":"Mid-frequency boost at 500Hz — worse overall, format fail","timestamp":1774183132489,"segment":3,"confidence":6.043715846994558,"asi":{"hypothesis":"Parametric mid-boost at 500Hz for centroid correction","rollback_reason":"942.2 vs 950.7, plus format check failed","dead_end":"mid-frequency parametric boost"}}
{"run":119,"commit":"5054b39","metric":949.7,"metrics":{"percussive_score":915,"edm_score":962.8,"harmonic_score":982.3},"status":"discard","description":"Asymmetric gain smooth (0.40/0.25) — slightly worse","timestamp":1774183234638,"segment":3,"confidence":6.144444444444452,"asi":{"hypothesis":"Asymmetric gain smoothing: fast release 0.40, slow attack 0.25","rollback_reason":"949.7 vs 950.7"}}
{"run":120,"commit":"5054b39","metric":948.9,"metrics":{"percussive_score":915.6,"edm_score":960.3,"harmonic_score":981.8},"status":"discard","description":"Base shelf 130% + ratio shelf 90% — worse, original 140/80 better","timestamp":1774183388090,"segment":3,"confidence":6.248587570621501,"asi":{"hypothesis":"Reduce base shelf, increase ratio shelf","rollback_reason":"948.9 vs 950.7"}}
{"run":121,"commit":"5054b39","metric":950.7,"metrics":{"percussive_score":917.4,"edm_score":963.3,"harmonic_score":982},"status":"discard","description":"EMA alpha 0.06 — identical to 0.05","timestamp":1774183499937,"segment":3,"confidence":6.284090909090868,"asi":{"hypothesis":"Slightly faster EMA alpha 0.06","rollback_reason":"identical score"}}
{"run":122,"commit":"5054b39","metric":950.7,"metrics":{"percussive_score":917.3,"edm_score":963.3,"harmonic_score":981.9},"status":"discard","description":"Gain-first then shelf — identical (linear filter + constant gain is order-independent)","timestamp":1774183664015,"segment":3,"confidence":6.356321839080476,"asi":{"hypothesis":"Apply gain before shelf instead of combined","rollback_reason":"identical score — gain*filter = filter*gain for linear filters"}}
{"run":123,"commit":"5054b39","metric":950.8,"metrics":{"percussive_score":917.4,"edm_score":963.3,"harmonic_score":982},"status":"discard","description":"Measured spectral tilt correction — marginal +0.1, not reliably better","timestamp":1774183832868,"segment":3,"confidence":6.284090909090868,"asi":{"hypothesis":"Measure input/output HF ratio and use as tilt_factor to modulate shelf","rollback_reason":"950.8 vs 950.7, within noise","insight":"The static shelf formula already does a good job approximating needed tilt correction. Adaptive measurement adds complexity without benefit.","next_action_hint":"Try using the tilt measurement more aggressively or at a different crossover frequency"}}
{"run":124,"commit":"5054b39","metric":720.5,"metrics":{"percussive_score":703.9,"edm_score":749.2,"harmonic_score":702.2},"status":"discard","description":"Input EMA instant seeding — massive overshoot, gain explodes on first output","timestamp":1774183963227,"segment":3,"confidence":6.213483146067399,"asi":{"hypothesis":"Seed input EMA on first call to avoid cold start","rollback_reason":"720.5 — input EMA jumps high while output EMA is still 0, creating enormous gain ratio","dead_end":"one-sided EMA seeding"}}
{"run":125,"commit":"5054b39","metric":950.3,"metrics":{"percussive_score":917.3,"edm_score":963.4,"harmonic_score":980.2},"status":"discard","description":"Minimum 3% shelf always — harmonic regresses, no net gain","timestamp":1774184069365,"segment":3,"confidence":6.284090909090868,"asi":{"hypothesis":"Minimum 3% shelf to correct inherent PV HF loss","rollback_reason":"950.3 vs 950.7, harmonic -1.7","dead_end":"minimum shelf floor"}}
{"run":126,"commit":"5054b39","metric":950,"metrics":{"percussive_score":917.4,"edm_score":964.5,"harmonic_score":977.1},"status":"discard","description":"Kaiser(6.0) window for streaming PV — harmonic drops, EDM gains slightly","timestamp":1774184190672,"segment":3,"confidence":6.320000000000007,"asi":{"hypothesis":"Kaiser window (beta=6) for better sidelobe rejection","rollback_reason":"950.0 vs 950.7, harmonic -4.8","insight":"Kaiser's wider main lobe hurts harmonic frequency resolution"}}
{"run":127,"commit":"5054b39","metric":942.6,"metrics":{"percussive_score":896.1,"edm_score":962.8,"harmonic_score":981.9},"status":"discard","description":"Flatness-modulated gradient — percussive drops 21 points, gradient needed even for noisy content","timestamp":1774184389036,"segment":3,"confidence":6.356321839080517,"asi":{"hypothesis":"Modulate phase gradient by spectral flatness - more for harmonic, less for noisy","rollback_reason":"942.6 vs 950.7, percussive -21 points","insight":"Percussive content benefits from gradient coherence too — reducing gradient for noise-like frames doesn't help","dead_end":"flatness-adaptive gradient"}}
{"run":128,"commit":"5054b39","metric":947.7,"metrics":{"percussive_score":910.5,"edm_score":963.1,"harmonic_score":980.4},"status":"discard","description":"Warmup fast gain smoothing — flawed detection triggers at near-unity too","timestamp":1774184493797,"segment":3,"confidence":6.58333333333327,"asi":{"hypothesis":"Faster gain smoothing during warmup (gain near 1.0)","rollback_reason":"947.7 vs 950.7, warmup condition also matches near-unity steady state","dead_end":"warmup-conditional gain smoothing"}}
{"run":129,"commit":"5054b39","metric":937.3,"metrics":{"percussive_score":884.7,"edm_score":963.7,"harmonic_score":976.4},"status":"discard","description":"Split gain (70% uniform + 30% HF) — percussive crashes, over-corrects HF","timestamp":1774184599752,"segment":3,"confidence":6.505882352941184,"asi":{"hypothesis":"Redirect part of gain correction to HF shelf boost","rollback_reason":"937.3 vs 950.7, uniform gain reduction hurts overall energy","dead_end":"split gain into uniform + HF"}}
