{"run":130,"commit":"5054b39","metric":950.4,"metrics":{"percussive_score":917,"edm_score":962.8,"harmonic_score":981.8},"status":"discard","description":"Three-pole shelf at 1800Hz — no improvement over two-pole at 2000Hz","timestamp":1774184706127,"segment":3,"confidence":6.505882352941184,"asi":{"hypothesis":"3-pole shelf at 1800Hz for steeper transition","rollback_reason":"950.4 vs 950.7","confirmed_optimal":"two-pole shelf at 2000Hz"}}
{"run":131,"commit":"5054b39","metric":950.3,"metrics":{"percussive_score":916.7,"edm_score":962.7,"harmonic_score":981.9},"status":"discard","description":"Streaming magnitude pre-emphasis (freq domain) — overlaps with time-domain shelf, no benefit","timestamp":1774184875035,"segment":3,"confidence":6.505882352941184,"asi":{"hypothesis":"Boost HF magnitudes before IFFT in streaming PV, proportional to ratio","rollback_reason":"950.3 vs 950.7, pre-emphasis + shelf overcorrect","dead_end":"frequency-domain magnitude pre-emphasis","insight":"Time-domain shelf and freq-domain mag boost address the same issue and don't stack well"}}
{"run":132,"commit":"5054b39","metric":921.1,"metrics":{"percussive_score":862.8,"edm_score":936.1,"harmonic_score":986.2},"status":"discard","description":"Freq-domain pre-emphasis replacing time-domain shelf — much worse, shelf is essential","timestamp":1774185031753,"segment":3,"confidence":6.467836257309941,"asi":{"hypothesis":"Replace time-domain shelf with freq-domain magnitude pre-emphasis","rollback_reason":"921.1 vs 950.7, pre-emphasis is far inferior to shelf","insight":"Time-domain shelf applies consistently to all overlapped output; freq-domain pre-emphasis only affects magnitudes before OLA but can't correct the phase interference that causes HF loss","dead_end":"replacing shelf with magnitude pre-emphasis"}}
{"run":133,"commit":"5054b39","metric":950.1,"metrics":{"percussive_score":915.9,"edm_score":962.8,"harmonic_score":982.4},"status":"discard","description":"Gain power 0.45 (from 0.5=sqrt) — slightly under-corrects","timestamp":1774185145747,"segment":3,"confidence":6.505882352941184,"asi":{"hypothesis":"Less aggressive gain correction with power 0.45","rollback_reason":"950.1 vs 950.7","confirmed_optimal":"sqrt (0.5 power)"}}
{"run":134,"commit":"5054b39","metric":950.1,"metrics":{"percussive_score":915.6,"edm_score":963.2,"harmonic_score":982.3},"status":"discard","description":"Gain denominator 0.55 — slightly worse, 0.48 confirmed optimal","timestamp":1774185302010,"segment":3,"confidence":6.505882352941184,"asi":{"hypothesis":"Wider gain range with denominator 0.55","rollback_reason":"950.1 vs 950.7","confirmed_optimal":"gain denominator 0.48"}}
{"run":135,"commit":"5054b39","metric":950.3,"metrics":{"percussive_score":918,"edm_score":964,"harmonic_score":978.1},"status":"discard","description":"Mid-range ratio correction (1.3-1.7x) — helps percussive/EDM but hurts harmonic at 1.5x","timestamp":1774185430618,"segment":3,"confidence":6.505882352941184,"asi":{"hypothesis":"Subtle mid-range shelf boost for ratios 1.3-1.7","rollback_reason":"950.3 vs 950.7, harmonic -3.8 at 1.5x","insight":"Harmonic content at 1.5x doesn't need extra shelf but shares the same ratio range as EDM/percussive"}}
{"run":136,"commit":"5054b39","metric":950.7,"metrics":{"percussive_score":917.6,"edm_score":963,"harmonic_score":982},"status":"discard","description":"Gain smooth 0.35 + denominator 0.50 — identical overall, different subcategory mix","timestamp":1774185542762,"segment":3,"confidence":6.4302325581395685,"asi":{"hypothesis":"Combine gain_smooth=0.35 and denominator=0.50","rollback_reason":"identical overall 950.7, subcategories shift but net zero"}}
{"run":137,"commit":"5054b39","metric":946.5,"metrics":{"percussive_score":904.5,"edm_score":963.4,"harmonic_score":984.4},"status":"discard","description":"Band-balance feedback shelf correction — over-corrects percussive (-13)","timestamp":1774185730257,"segment":3,"confidence":6.356321839080517,"asi":{"hypothesis":"Track input/output lo/hi band ratio and use as shelf correction factor","rollback_reason":"946.5 vs 950.7, percussive over-corrected by band feedback","insight":"Band balance feedback creates instability — the output measurement is pre-gain so the correction double-counts","dead_end":"band-balance feedback for shelf modulation"}}
{"run":138,"commit":"5054b39","metric":950.7,"metrics":{"percussive_score":917.3,"edm_score":963.3,"harmonic_score":981.9},"status":"discard","description":"Verification run — confirmed baseline at 950.7 (deterministic across 3 runs)","timestamp":1774185815998,"segment":3,"confidence":6.248587570621461,"asi":{"hypothesis":"Verify current best is stable","rollback_reason":"verification run, no changes to keep","result":"950.7 confirmed stable, all 3 runs identical"}}
{"run":139,"commit":"7de95a4","metric":951.6,"metrics":{"percussive_score":919.5,"edm_score":963,"harmonic_score":982.6},"status":"keep","description":"Fast EMA warmup (alpha=0.20 for first 10 calls) — percussive 919.5, overall 951.6 (+0.9)","timestamp":1774185990077,"segment":3,"confidence":6.314606741572974,"asi":{"hypothesis":"Use alpha=0.20 for first 10 energy tracking calls to converge faster, then 0.05 for stability","improvement":"+0.9 from 950.7","percussive_gain":"+2.2","harmonic_gain":"+0.7","edm_loss":"-0.3","warmup_calls":10,"warmup_alpha":0.2}}
{"run":140,"commit":"7de95a4","metric":946.8,"metrics":{"percussive_score":907.3,"edm_score":963,"harmonic_score":981.9},"status":"discard","description":"Warmup 15 calls — too much, percussive overshoots","timestamp":1774186101987,"segment":3,"confidence":6.244444444444489,"asi":{"hypothesis":"Longer warmup (15 calls)","rollback_reason":"946.8 vs 951.6, percussive -12","confirmed_optimal":"10 calls warmup"}}
{"run":141,"commit":"57ab92a","metric":951.8,"metrics":{"percussive_score":921.4,"edm_score":962.2,"harmonic_score":982},"status":"keep","description":"Warmup 5 calls — percussive 921.4, overall 951.8 (+0.2)","timestamp":1774186274299,"segment":3,"confidence":6.130434782608739,"asi":{"hypothesis":"Shorter warmup (5 calls) converges faster without overshoot","improvement":"+0.2","warmup_calls":5}}
{"run":142,"commit":"57ab92a","metric":944.3,"metrics":{"percussive_score":904.3,"edm_score":963.4,"harmonic_score":975.8},"status":"discard","description":"Warmup 3 calls — too short, harmonic drops","timestamp":1774186364114,"segment":3,"confidence":6.0645161290322855,"asi":{"hypothesis":"3-call warmup","rollback_reason":"944.3 vs 951.8","confirmed_optimal":"5 calls warmup"}}
{"run":143,"commit":"57ab92a","metric":950,"metrics":{"percussive_score":916.4,"edm_score":962,"harmonic_score":982.4},"status":"discard","description":"Warmup alpha 0.30 — too aggressive, percussive drops","timestamp":1774186454963,"segment":3,"confidence":5.936842105263156,"asi":{"hypothesis":"Higher warmup alpha 0.30","rollback_reason":"950.0 vs 951.8","confirmed_optimal":"warmup alpha 0.20"}}
{"run":144,"commit":"0f374be","metric":951.9,"metrics":{"percussive_score":921.5,"edm_score":962.3,"harmonic_score":982},"status":"keep","description":"Warmup alpha 0.15 — marginal +0.1, overall 951.9","timestamp":1774186541463,"segment":3,"confidence":6.010638297872355,"asi":{"hypothesis":"Gentler warmup alpha 0.15","improvement":"+0.1","warmup_alpha":0.15}}
{"run":145,"commit":"0f374be","metric":951.8,"metrics":{"percussive_score":920.8,"edm_score":962.6,"harmonic_score":982.1},"status":"discard","description":"Warmup alpha 0.12 — marginal regression, 0.15 optimal","timestamp":1774186646874,"segment":3,"confidence":6.075268817204331,"asi":{"hypothesis":"Even gentler warmup alpha 0.12","rollback_reason":"951.8 vs 951.9","confirmed_optimal":"warmup alpha 0.15"}}
{"run":146,"commit":"0f374be","metric":950.6,"metrics":{"percussive_score":919.7,"edm_score":961.4,"harmonic_score":980.9},"status":"discard","description":"Fast gain smooth during warmup (0.50) — overshoots, worse","timestamp":1774186759041,"segment":3,"confidence":6.208791208791193,"asi":{"hypothesis":"Faster gain smooth (0.50) during warmup too","rollback_reason":"950.6 vs 951.9, gain smooth warmup overshoots","confirmed_optimal":"fixed gain_smooth=0.30"}}
{"run":147,"commit":"0f374be","metric":945.1,"metrics":{"percussive_score":905.4,"edm_score":959.5,"harmonic_score":983.2},"status":"discard","description":"Dampened shelf during warmup — under-corrects, worse","timestamp":1774186859279,"segment":3,"confidence":6.277777777777778,"asi":{"hypothesis":"50% shelf dampening during warmup","rollback_reason":"945.1 vs 951.9","dead_end":"shelf dampening during warmup"}}
{"run":148,"commit":"0f374be","metric":939.3,"metrics":{"percussive_score":921.5,"edm_score":943.1,"harmonic_score":960.1},"status":"discard","description":"Gain pre-seeding based on ratio — overshoots for EDM/harmonic","timestamp":1774186962468,"segment":3,"confidence":6.208791208791271,"asi":{"hypothesis":"Pre-seed energy_gain based on stretch ratio prediction","rollback_reason":"939.3 vs 951.9, predicted gain doesn't match actual PV behavior","dead_end":"gain pre-seeding from ratio"}}
{"run":149,"commit":"0f374be","metric":951.2,"metrics":{"percussive_score":921.2,"edm_score":959.9,"harmonic_score":983.3},"status":"discard","description":"Smoothstep gain_factor — EDM drops, linear is better","timestamp":1774187096062,"segment":3,"confidence":6.277777777777778,"asi":{"hypothesis":"Smoothstep curve for gain_factor in base shelf","rollback_reason":"951.2 vs 951.9, EDM -2.4","confirmed_optimal":"linear gain_factor"}}
{"run":150,"commit":"0f374be","metric":945.4,"metrics":{"percussive_score":903.7,"edm_score":962.8,"harmonic_score":982},"status":"discard","description":"Ratio-adaptive warmup calls (5/8) — 2.0x warmup too long","timestamp":1774187224654,"segment":3,"confidence":6.531791907514511,"asi":{"hypothesis":"More warmup calls for extreme ratios (8 vs 5)","rollback_reason":"945.4 vs 951.9, percussive -17.8 at 2.0x","confirmed_optimal":"5 warmup calls for all ratios"}}
{"run":151,"commit":"0f374be","metric":951.9,"metrics":{"percussive_score":921.5,"edm_score":962,"harmonic_score":982.5},"status":"discard","description":"Decayed persistent shelf state (10%) — identical to no persistence","timestamp":1774187602140,"segment":3,"confidence":6.7261904761904034,"asi":{"hypothesis":"Carry 10% of shelf filter state to next call for continuity","rollback_reason":"identical to current best 951.9, 10% barely affects output","dead_end":"decayed persistent shelf state (any level: 10% no effect, 30% hurts EDM)"}}
{"run":152,"commit":"0f374be","metric":932.1,"metrics":{"percussive_score":911.9,"edm_score":950.2,"harmonic_score":935.3},"status":"discard","description":"Per-window envelope correction — harmonic crashes, also allocates in hot path","timestamp":1774187729182,"segment":3,"confidence":6.494252873563269,"asi":{"hypothesis":"Match output envelope to time-stretched input envelope per 256-sample window","rollback_reason":"932.1 vs 951.9, harmonic -47 pts. Envelope correction disrupts smooth PV output for tonal content. Also violates RT safety with Vec allocations.","dead_end":"per-window envelope matching"}}
{"run":153,"commit":"0f374be","metric":951.4,"metrics":{"percussive_score":920.2,"edm_score":962.3,"harmonic_score":982},"status":"discard","description":"Dual-band shelf (2000Hz + 500Hz mid) — marginal, mid doesn't target the right range","timestamp":1774187850363,"segment":3,"confidence":6.647058823529412,"asi":{"hypothesis":"Add gentle mid-range shelf at 500Hz for mid-frequency restoration","rollback_reason":"951.4 vs 951.9, didn't improve EDM centroid","insight":"EDM centroid drops from 646→407Hz. The loss is centered around 300-600Hz, but boosting above 500Hz doesn't target the right frequencies. The issue is sub-bass being over-represented rather than mid being under-represented."}}
{"run":154,"commit":"0f374be","metric":951.5,"metrics":{"percussive_score":920.3,"edm_score":961.8,"harmonic_score":982.6},"status":"discard","description":"ratio_scale (d/0.5).clamp(0.15,1.0) — slightly worse","timestamp":1774187984819,"segment":3,"confidence":6.608187134502959,"asi":{"hypothesis":"Wider ratio_scale transition (d/0.5) with lower min (0.15)","rollback_reason":"951.5 vs 951.9","confirmed_optimal":"(d/0.3).clamp(0.2, 1.0)"}}
{"run":155,"commit":"1585c57","metric":952.8,"metrics":{"percussive_score":924.1,"edm_score":962.1,"harmonic_score":982},"status":"keep","description":"Distance-limited gradient propagation (fade beyond 8 bins) — percussive 924, overall 952.8 (+0.9)","timestamp":1774188101210,"segment":3,"confidence":6.674418604651231,"asi":{"hypothesis":"Attenuate phase gradient blend for bins far from their anchor peak. Bins >8 bins from peak fade linearly to 0 over 24 bins.","improvement":"+0.9","percussive_gain":"+2.6","insight":"Distant bins locked to far peaks creates phase artifacts. Independent phase evolution is better for bins between spectral peaks."}}
{"run":156,"commit":"1585c57","metric":950.8,"metrics":{"percussive_score":918.8,"edm_score":962,"harmonic_score":982},"status":"discard","description":"Gradient fade start at 4 bins — too aggressive, percussive drops","timestamp":1774188202513,"segment":3,"confidence":6.674418604651231,"asi":{"hypothesis":"Start gradient fade at 4 bins instead of 8","rollback_reason":"950.8 vs 952.8, too little gradient for nearby bins"}}
{"run":157,"commit":"1585c57","metric":951.9,"metrics":{"percussive_score":921.7,"edm_score":962.2,"harmonic_score":982},"status":"discard","description":"Gradient fade start at 12 bins — too permissive, 8 bins optimal","timestamp":1774188296462,"segment":3,"confidence":6.674418604651231,"asi":{"hypothesis":"Wider gradient zone (12 bins)","rollback_reason":"951.9 vs 952.8","confirmed_optimal":"8 bins start"}}
{"run":158,"commit":"1585c57","metric":952.7,"metrics":{"percussive_score":922.9,"edm_score":962.9,"harmonic_score":982},"status":"discard","description":"Fade length 16 bins — slightly worse, 24 optimal","timestamp":1774188395002,"segment":3,"confidence":6.752941176470586,"asi":{"hypothesis":"Shorter fade (16 bins vs 24)","rollback_reason":"952.7 vs 952.8","confirmed_optimal":"24 bins fade length"}}
{"run":159,"commit":"1585c57","metric":936.3,"metrics":{"percussive_score":879.7,"edm_score":962.3,"harmonic_score":982},"status":"discard","description":"Fade length 32 bins — way too slow, percussive drops 44 points","timestamp":1774188492128,"segment":3,"confidence":6.674418604651231,"asi":{"hypothesis":"Longer fade (32 bins)","rollback_reason":"936.3 vs 952.8, percussive crushed by over-locking","confirmed_optimal":"24 bins fade"}}
{"run":160,"commit":"1585c57","metric":952.1,"metrics":{"percussive_score":922.1,"edm_score":962.1,"harmonic_score":982},"status":"discard","description":"Fade length 20 bins — slightly worse, 24 confirmed optimal","timestamp":1774188588037,"segment":3,"confidence":6.752941176470586,"asi":{"hypothesis":"20 bins fade length","rollback_reason":"952.1 vs 952.8","confirmed_optimal":"8 start / 24 fade"}}
{"run":161,"commit":"1585c57","metric":951.6,"metrics":{"percussive_score":920.6,"edm_score":962.4,"harmonic_score":982},"status":"discard","description":"Quadratic distance fade — too much gradient at moderate distances","timestamp":1774188687822,"segment":3,"confidence":6.752941176470586,"asi":{"hypothesis":"Quadratic (1-t²) distance fade for smoother rolloff","rollback_reason":"951.6 vs 952.8, linear fade better","confirmed_optimal":"linear distance fade"}}
{"run":162,"commit":"1585c57","metric":948,"metrics":{"percussive_score":924.1,"edm_score":949.3,"harmonic_score":981.8},"status":"discard","description":"Magnitude-weighted gradient — EDM drops 13 points, reduces coherence for harmonics","timestamp":1774188792720,"segment":3,"confidence":6.833333333333303,"asi":{"hypothesis":"Weight gradient blend by bin magnitude relative to anchor peak","rollback_reason":"948.0 vs 952.8, EDM -12.8. Reducing gradient for low-mag bins hurts harmonic coherence in EDM.","dead_end":"magnitude-weighted gradient"}}
{"run":163,"commit":"1585c57","metric":952.6,"metrics":{"percussive_score":923.1,"edm_score":962.4,"harmonic_score":982},"status":"discard","description":"Ratio-conditional distance fade with variable speed — slightly worse","timestamp":1774188907736,"segment":3,"confidence":6.833333333333349,"asi":{"hypothesis":"Only apply distance fade at ratio_distance>0.2, with faster fade at >0.8","rollback_reason":"952.6 vs 952.8","confirmed_optimal":"unconditional distance fade, uniform 8/24"}}
{"run":164,"commit":"bf2eef1","metric":952.9,"metrics":{"percussive_score":924.2,"edm_score":962.3,"harmonic_score":982},"status":"keep","description":"IF blend 6% (from 5%) — works better with distance-limited gradient, +0.1","timestamp":1774189029819,"segment":3,"confidence":6.886227544910161,"asi":{"hypothesis":"6% IF blend synergizes with distance-limited gradient — distant bins now get IF instead of stale gradient","improvement":"+0.1","if_blend":0.06}}
{"run":165,"commit":"bf2eef1","metric":950.4,"metrics":{"percussive_score":924.6,"edm_score":955.2,"harmonic_score":982.1},"status":"discard","description":"IF blend 7% — EDM drops 7 points, 6% optimal with distance fade","timestamp":1774189122192,"segment":3,"confidence":6.927710843373437,"asi":{"hypothesis":"7% IF blend","rollback_reason":"950.4 vs 952.9, EDM -7.1","confirmed_optimal":"6% IF blend with distance-limited gradient"}}
{"run":166,"commit":"bf2eef1","metric":940.6,"metrics":{"percussive_score":924.8,"edm_score":929.3,"harmonic_score":981.3},"status":"discard","description":"Gradient blend 0.25 with distance fade — EDM crashes, over-locking nearby bins","timestamp":1774189226565,"segment":3,"confidence":6.927710843373484,"asi":{"hypothesis":"Higher base gradient (0.25) compensated by distance fade","rollback_reason":"940.6 vs 952.9, EDM -33. Over-locking nearby bins ruins EDM quality.","confirmed_optimal":"gradient blend 0.20"}}
{"run":167,"commit":"bf2eef1","metric":936.9,"metrics":{"percussive_score":898.1,"edm_score":945.5,"harmonic_score":982},"status":"discard","description":"Expansion taper 1.0 — gradient gone at 2.0x, percussive crashes","timestamp":1774189355438,"segment":3,"confidence":6.927710843373532,"asi":{"hypothesis":"Faster gradient taper (1.0) for expansion","rollback_reason":"936.9 vs 952.9, gradient at 2.0x is essential","confirmed_optimal":"expansion taper 1.2"}}
{"run":168,"commit":"bf2eef1","metric":945.3,"metrics":{"percussive_score":912.9,"edm_score":961.6,"harmonic_score":969.4},"status":"discard","description":"Smooth alpha decay (0.15→0.05 over 8 calls) — harmonic crashes, hard cutoff is better","timestamp":1774189528338,"segment":3,"confidence":7.012195121951229,"asi":{"hypothesis":"Linear alpha decay from 0.15 to 0.05 over 8 calls","rollback_reason":"945.3 vs 952.9, keeps alpha too high too long","confirmed_optimal":"hard cutoff at 5 calls"}}
{"run":169,"commit":"bf2eef1","metric":952.5,"metrics":{"percussive_score":922.9,"edm_score":962.4,"harmonic_score":982},"status":"discard","description":"Sub-bass 190Hz — slightly worse, 180Hz confirmed","timestamp":1774189630797,"segment":3,"confidence":7.012195121951181,"asi":{"hypothesis":"Sub-bass cutoff 190Hz","rollback_reason":"952.5 vs 952.9","confirmed_optimal":"180Hz"}}
{"run":170,"commit":"f238f39","metric":953.1,"metrics":{"percussive_score":924.6,"edm_score":962.3,"harmonic_score":982},"status":"keep","description":"Distance-adaptive IF blend (more IF for distant bins) — percussive 924.6, overall 953.1 (+0.2)","timestamp":1774189748614,"segment":3,"confidence":7.123456790123442,"asi":{"hypothesis":"Bins far from peaks get more IF blend (up to 2x base, capped at 15%). Synergizes with distance-limited gradient.","improvement":"+0.2","percussive_gain":"+0.4","insight":"Distance-adaptive IF + distance-limited gradient = distant bins get independent tracking (IF) instead of stale gradient locking"}}
{"run":171,"commit":"f238f39","metric":953,"metrics":{"percussive_score":924.4,"edm_score":962.4,"harmonic_score":982},"status":"discard","description":"IF distance start 6 bins — marginally worse, 4 optimal","timestamp":1774189845324,"segment":3,"confidence":7.212500000000006,"asi":{"hypothesis":"IF distance threshold 6 bins","rollback_reason":"953.0 vs 953.1","confirmed_optimal":"4 bins"}}
{"run":172,"commit":"f238f39","metric":953.1,"metrics":{"percussive_score":924.6,"edm_score":962.3,"harmonic_score":982},"status":"discard","description":"IF cap 0.12 — identical (max actual blend is 0.12 anyway)","timestamp":1774189943465,"segment":3,"confidence":7.25786163522009,"asi":{"hypothesis":"Lower IF cap 0.12","rollback_reason":"identical, max actual is 0.06*2=0.12 which is under 0.15"}}
{"run":173,"commit":"0b51b91","metric":953.2,"metrics":{"percussive_score":924.9,"edm_score":962.3,"harmonic_score":982},"status":"keep","description":"Stronger distance-adaptive IF (3x max over 12 bins) — percussive 924.9, overall 953.2 (+0.1)","timestamp":1774190048010,"segment":3,"confidence":7.410256410256355,"asi":{"hypothesis":"Increase max IF scale to 3x (from 2x), faster ramp (12 bins from 16)","improvement":"+0.1","if_max_scale":3,"if_ramp_bins":12}}
{"run":174,"commit":"0aabcd8","metric":953.2,"metrics":{"percussive_score":925,"edm_score":962.3,"harmonic_score":982},"status":"keep","description":"IF dist 4x max over 10 bins — percussive 925.0, overall 953.2 (same but better percussive)","timestamp":1774190150258,"segment":3,"confidence":7.605263157894609,"asi":{"hypothesis":"Even stronger IF scaling (4x max, 10-bin ramp)","improvement":"0, but percussive +0.1","if_max_scale":4,"if_ramp_bins":10}}
