{"run":245,"commit":"e479be4","metric":954.1,"metrics":{"percussive_score":926.3,"edm_score":963.3,"harmonic_score":982},"status":"discard","description":"Increase unified-onset weight to 0.45 — ties overall, percussive +0.1 but no primary gain","timestamp":1774247092722,"segment":3,"confidence":10.298245614035013,"asi":{"hypothesis":"The low-frequency onset-rise term may still be underweighted relative to spectral flux","rollback_reason":"Primary unchanged at 954.1 despite percussive improving to 926.3","next_action_hint":"Unified onset model looks real; future work should change its shape/selectivity rather than just scalar weight","insight":"Kick-aware onset energy continues to help percussive, but simple scalar boosts are now hitting diminishing returns"}}
{"run":246,"commit":"e479be4","metric":954,"metrics":{"percussive_score":926,"edm_score":963.3,"harmonic_score":982},"status":"discard","description":"Gate onset-energy boost by PV-flux transient confidence — loses the unified-onset gain","timestamp":1774247234876,"segment":3,"confidence":10.482142857142822,"asi":{"hypothesis":"Require a real PV-flux transient before RMS-rise onset energy can boost helper blend, reducing false positives","rollback_reason":"954.0 vs 954.1. The low-frequency onset cue adds value even when PV flux is modest, so gating it away loses signal.","next_action_hint":"Keep the unified onset term broad; next step should shape it toward low-frequency/kick cues rather than gate it by PV flux","insight":"Kick-like onsets are exactly the cases where PV flux may under-report, so flux-gating the energy cue is counterproductive"}}
{"run":247,"commit":"e479be4","metric":954.1,"metrics":{"percussive_score":926.2,"edm_score":963.3,"harmonic_score":982},"status":"discard","description":"Bias unified-onset energy boost toward low-band-heavy flux frames — identical to current best","timestamp":1774247344892,"segment":3,"confidence":10.67272727272728,"asi":{"hypothesis":"Kick-like onsets should benefit most from the RMS-rise helper, so scale that helper boost by low-band flux share","rollback_reason":"No measurable gain over the simpler unified onset model","next_action_hint":"If staying in unified-onset family, try a more distinct low-frequency onset measurement rather than reweighting existing PV flux bands","insight":"Low-band selectivity is not harmful, but reusing PV band shares doesn’t add information beyond the already-helpful broad onset cue"}}
{"run":248,"commit":"e479be4","metric":954.1,"metrics":{"percussive_score":926.2,"edm_score":963.3,"harmonic_score":982},"status":"checks_failed","description":"Kick-aware low-passed onset cue — tied best metric but failed fmt check due to line wrapping","timestamp":1774247534778,"segment":3,"confidence":10.77064220183478,"asi":{"hypothesis":"Augment the unified onset model with a low-passed RMS-rise cue so kick-like low-frequency onsets can boost the helper blend more directly","rollback_reason":"Formatting check failed, so cannot keep despite valid benchmark tie","next_action_hint":"Re-apply with rustfmt-clean formatting if pursuing this variant further","error_detail":"cargo fmt --check failed only; lib tests passed","learned":"Low-passed onset cue ties the best metric immediately, so the idea is plausible enough to retry in formatted form"}}
{"run":249,"commit":"e479be4","metric":954.1,"metrics":{"percussive_score":926.3,"edm_score":963.3,"harmonic_score":982},"status":"checks_failed","description":"Stronger kick-aware low-passed onset cue — tied best with percussive 926.3, but failed fmt check","timestamp":1774247697023,"segment":3,"confidence":10.870370370370425,"asi":{"hypothesis":"Use the max of full-band RMS-rise and low-passed RMS-rise to better catch kick onsets, with slightly stronger onset weighting","rollback_reason":"Formatting check failed, so cannot keep despite benchmark tie","next_action_hint":"Re-apply in rustfmt-clean form if continuing this onset-family refinement","error_detail":"cargo fmt --check failed only; lib tests passed","learned":"Low-passed onset cue continues to help percussive, but still hasn’t moved the primary beyond 954.1"}}
{"run":250,"commit":"e479be4","metric":954.1,"metrics":{"percussive_score":926.3,"edm_score":963.3,"harmonic_score":982},"status":"discard","description":"Rustfmt-clean kick-aware low-passed onset cue — ties best overall, percussive 926.3 but no primary gain","timestamp":1774247893608,"segment":3,"confidence":11.18095238095239,"asi":{"hypothesis":"Use the max of full-band RMS-rise and low-passed RMS-rise to better catch kick-like onsets in the unified onset model","rollback_reason":"Primary unchanged at 954.1 despite percussive +0.1","next_action_hint":"If continuing the unified-onset path, use shape/selectivity changes that can convert the percussive gain into a primary improvement, not just more weight","learned":"Kick-aware low-passed onset cue is reproducibly helpful for percussive but still below the threshold for an overall improvement"}}
{"run":251,"commit":"e479be4","metric":954.1,"metrics":{"percussive_score":926.2,"edm_score":963.3,"harmonic_score":982},"status":"discard","description":"Additive kick-aware onset fusion — ties current best, no gain over simpler unified onset model","timestamp":1774248052255,"segment":3,"confidence":11.509803921568842,"asi":{"hypothesis":"Use broad RMS-rise onset plus an additive low-passed onset bonus, rather than max fusion, to preserve general onset sensitivity while helping kicks","rollback_reason":"No measurable gain over the current kept unified onset model","next_action_hint":"The unified-onset family is real but local fusions are plateauing; next meaningful step is likely a broader streaming hybrid overlay or attack-copy redesign","insight":"Low-frequency onset cues help, but simple local fusion formulas are not enough to move beyond 954.1"}}
{"run":252,"commit":"e479be4","metric":954.1,"metrics":{"percussive_score":926.2,"edm_score":963.3,"harmonic_score":982},"status":"discard","description":"Stateful transient attack-copy handoff (96-sample stronger helper window) — ties current best","timestamp":1774248261858,"segment":3,"confidence":11.740000000000009,"asi":{"hypothesis":"Arm a short cross-callback attack-copy window on strong onsets so the helper path briefly dominates before handing back to normal PV+helper blending","rollback_reason":"No measurable gain over the simpler unified-onset helper blend","next_action_hint":"If pursuing broader redesigns, this suggests the next step must be a more explicit aligned overlay/handoff rather than just temporarily stronger helper gain","insight":"A tiny stateful handoff window is safe and non-destructive, but not enough by itself to surpass 954.1"}}
{"run":253,"commit":"e479be4","metric":954.1,"metrics":{"percussive_score":926.2,"edm_score":963.3,"harmonic_score":982},"status":"discard","description":"Longer milder stateful attack-copy handoff (160 samples, 13% floor) — ties current best","timestamp":1774248458845,"segment":3,"confidence":11.740000000000009,"asi":{"hypothesis":"The stateful handoff idea may want longer duration and lower helper dominance than the first 96-sample/16% version","rollback_reason":"No measurable gain over the current best unified-onset helper blend","next_action_hint":"Micro-handoffs appear safe but plateau; the next real redesign would need explicit aligned overlay state, not just boosted helper windows","insight":"Stateful attack-copy windows are not harmful, but local gain-floor variants are not enough to move the ceiling"}}
{"run":254,"commit":"e479be4","metric":954.1,"metrics":{"percussive_score":926.2,"edm_score":963.3,"harmonic_score":982},"status":"discard","description":"Explicit attack-copy/decay handoff ramp (64-sample 25%→adaptive blend) — ties current best","timestamp":1774248627127,"segment":3,"confidence":11.85858585858603,"asi":{"hypothesis":"Use a short onset ramp where the resampled helper dominates more strongly for the first attack samples, then hand off to the normal adaptive PV+helper blend","rollback_reason":"No measurable gain over the simpler unified-onset helper blend","next_action_hint":"A true overlay probably needs separate alignment/state rather than just stronger helper mixing for a short ramp","insight":"Explicit attack-copy ramp is safe and plausible, but local onset ramps still plateau at 954.1"}}
