{"run":214,"commit":"44f20a7","metric":949.5,"metrics":{"percussive_score":916.7,"edm_score":960.7,"harmonic_score":981.9},"status":"discard","description":"Per-bin transient identity override (threshold 4x mean flux) — over-triggers on EDM, worse freq preservation","timestamp":1774229299326,"segment":3,"confidence":8.916030534351204,"asi":{"hypothesis":"Per-bin spectral flux transient detection with identity phase locking override for flagged bins","rollback_reason":"949.5 vs 953.8. Identity locking for transient bins disrupts IF phase accumulation, making freq_preservation WORSE. EDM kicks trigger too broadly. Key insight: the benchmark measures DFT energy (freq_preservation), not waveform shape. PV IF tracking already preserves frequencies; the issue is OLA time-smearing which identity locking can't fix.","next_action_hint":"Try: (1) much higher threshold (8-10x) to only catch strongest transients, (2) skip identity override and instead boost magnitude for transient bins, (3) reduce blend cap from 0.6 to 0.2"}}
{"run":215,"commit":"44f20a7","metric":951.4,"metrics":{"percussive_score":920.8,"edm_score":961.9,"harmonic_score":981.3},"status":"discard","description":"Broadband transient mag boost (>40% bins rising) — still disrupts energy balance for EDM kicks","timestamp":1774229915442,"segment":3,"confidence":8.984615384615381,"asi":{"hypothesis":"Broadband gate (>40% bins with rising flux) before per-bin magnitude boost","rollback_reason":"951.4 vs 953.8. EDM kicks ARE broadband transients, so the gate lets them through. The magnitude boost disrupts the energy compensation balance.","insight":"Any per-frame magnitude modification in the PV conflicts with the post-PV energy gain compensation. The gain EMA tracks pre-boost magnitudes, so boosting creates an energy oscillation. The approaches are fundamentally at odds.","dead_end":"Per-bin transient magnitude boost in PV (any threshold, any gate)"}}
{"run":216,"commit":"a62b043","metric":953.8,"metrics":{"percussive_score":925,"edm_score":963.7,"harmonic_score":982},"status":"discard","description":"Baseline verification after cleanup commits — 953.8 stable on new HEAD","timestamp":1774230075040,"segment":3,"confidence":8.916030534351204,"asi":{"hypothesis":"verify baseline on new HEAD after cleanup commits"}}
{"run":217,"commit":"0b1c6d0","metric":953.9,"metrics":{"percussive_score":925.8,"edm_score":963.3,"harmonic_score":982},"status":"keep","description":"Per-bin spectral flux tracking in PV + flux-adaptive resample blend (2-8%, modulated by impulsiveness). Percussive +0.8, overall +0.1.","timestamp":1774236787967,"segment":3,"confidence":8.863636363636486,"asi":{"hypothesis":"Add per-bin HWR spectral flux to PV, use transient_bin_count/rising_bins to modulate resample blend strength. Transient frames get more blend (up to 8%), steady-state gets less (down to 2%).","improvement":"+0.1 overall, +0.8 percussive","architecture":"Operates downstream of energy compensation, avoiding PV-internal conflict"}}
{"run":218,"commit":"0b1c6d0","metric":953.9,"metrics":{"percussive_score":925.8,"edm_score":963.3,"harmonic_score":982},"status":"discard","description":"Wider blend range (1-10%) — identical score, impulsiveness doesn't reach extremes often enough","timestamp":1774236879950,"segment":3,"confidence":8.86363636363641,"asi":{"hypothesis":"Wider blend clamp range 0.01-0.10","rollback_reason":"No improvement, 953.9 = baseline"}}
{"run":219,"commit":"0b1c6d0","metric":953.9,"metrics":{"percussive_score":925.7,"edm_score":963.3,"harmonic_score":982},"status":"discard","description":"Flux intensity sharpness indicator — identical overall, percussive slightly worse (-0.1)","timestamp":1774236980448,"segment":3,"confidence":8.863636363636333,"asi":{"hypothesis":"Add flux intensity (concentrated energy) to impulsiveness calculation","rollback_reason":"No improvement"}}
{"run":220,"commit":"0b1c6d0","metric":953.4,"metrics":{"percussive_score":924.3,"edm_score":963.1,"harmonic_score":982.5},"status":"discard","description":"Extended blend to 0.3+ distance — percussive drops -1.5, confirms 0.5 threshold optimal","timestamp":1774237079342,"segment":3,"confidence":8.86363636363641,"asi":{"hypothesis":"Lower blend threshold from 0.5 to 0.3 with linear ramp","rollback_reason":"953.4 vs 953.9. Blending at 1.5x hurts percussive. Confirmed again: only 2.0x benefits from blend.","confirmed_optimal":"threshold 0.5"}}
{"run":221,"commit":"c3ab2a0","metric":953.9,"metrics":{"percussive_score":926,"edm_score":963.2,"harmonic_score":982},"status":"keep","description":"Wider flux factor range (0.3-2.5) with blend clamp 1-10% — percussive 926.0 (+0.2)","timestamp":1774237239721,"segment":3,"confidence":9,"asi":{"hypothesis":"Wider flux range and blend clamp gives more dynamic range for transient vs steady-state blending","improvement":"+0.2 percussive"}}
{"run":222,"commit":"c3ab2a0","metric":953.9,"metrics":{"percussive_score":925.9,"edm_score":963.2,"harmonic_score":982},"status":"discard","description":"Flux-based phase-gradient attenuation on impulsive frames — no overall gain, percussive slightly below current best","timestamp":1774238217606,"segment":3,"confidence":9.069767441860561,"asi":{"hypothesis":"Reduce phase-gradient coherence only on truly impulsive frames using PV per-bin flux","rollback_reason":"Primary unchanged at 953.9 and percussive 925.9 is below the 926.0 current best","next_action_hint":"Keep flux-adaptive blend path; explore narrower post-gain blend shaping rather than PV-internal phase changes","insight":"Even selective frame-level attenuation of phase gradient does not improve the PV ceiling; downstream blend modulation remains the safer lever"}}
{"run":223,"commit":"c3ab2a0","metric":953.9,"metrics":{"percussive_score":926,"edm_score":963.2,"harmonic_score":982},"status":"discard","description":"Onset-weighted frame shaping for flux-adaptive blend — identical to current best","timestamp":1774238337432,"segment":3,"confidence":9.140625000000032,"asi":{"hypothesis":"Concentrate extra transient blend near frame onset and taper later samples to reduce aliasing while preserving attacks","rollback_reason":"No measurable gain over current kept flux-adaptive blend","next_action_hint":"Explore blend source shaping or lightweight input pre-emphasis only on the blended path, not PV-internal changes"}}
{"run":224,"commit":"c3ab2a0","metric":953.9,"metrics":{"percussive_score":926,"edm_score":963.2,"harmonic_score":982},"status":"discard","description":"Transient-residual shaping on blended resample path — identical to current best","timestamp":1774238526146,"segment":3,"confidence":9.069767441860481,"asi":{"hypothesis":"Add a tiny attack residual (interp - previous interp) only on the post-gain blended path during transient frames","rollback_reason":"No measurable gain over current kept flux-adaptive blend","next_action_hint":"If continuing downstream-only paths, try band-limiting or EQ on just the blended path rather than temporal shaping"}}
{"run":225,"commit":"fc61f07","metric":954,"metrics":{"percussive_score":926,"edm_score":963.3,"harmonic_score":982},"status":"keep","description":"Raise flux-adaptive blend base from 4.0% to 4.5% — overall 954.0 (+0.1) with percussive held at 926.0","timestamp":1774238622885,"segment":3,"confidence":9.015384615384619,"asi":{"hypothesis":"The adaptive blend suppresses steady-state enough that a slightly higher base blend can help transient frames without reintroducing the regressions from fixed 5% blends","improvement":"+0.1 overall","blend_base":0.045,"learned":"Adaptive gating changes the old fixed-blend optimum; 4.5% beats 4.0% in the adaptive regime"}}
{"run":226,"commit":"fc61f07","metric":954,"metrics":{"percussive_score":926,"edm_score":963.3,"harmonic_score":982},"status":"discard","description":"Raise adaptive base to 5.0% — identical to 4.5%, no measurable gain","timestamp":1774238715484,"segment":3,"confidence":9.015384615384619,"asi":{"hypothesis":"Adaptive suppression may support a full 5.0% base blend","rollback_reason":"Primary unchanged at 954.0 with no secondary gain","next_action_hint":"Probe around 4.5% with other bounds/shape changes rather than only raising the base further"}}
{"run":227,"commit":"fc61f07","metric":954,"metrics":{"percussive_score":926,"edm_score":963.3,"harmonic_score":982},"status":"discard","description":"Raise transient-frame blend cap to 12% — identical to current best","timestamp":1774238805305,"segment":3,"confidence":9.015384615384619,"asi":{"hypothesis":"Stronger blend on the most impulsive frames may help percussive 2.0x without affecting steady-state content","rollback_reason":"No measurable gain over the 10% cap","next_action_hint":"Try reducing the floor / steady-state contamination rather than raising transient cap"}}
{"run":228,"commit":"fc61f07","metric":954,"metrics":{"percussive_score":926,"edm_score":963.3,"harmonic_score":982},"status":"discard","description":"Lower adaptive blend floor to 0.5% — identical to current best","timestamp":1774238898167,"segment":3,"confidence":9.015384615384619,"asi":{"hypothesis":"Let low-flux frames stay even closer to pure PV while preserving transient boosts","rollback_reason":"No measurable gain over 1.0% floor","next_action_hint":"Use per-case diagnostics before more parameter sweeps; repeated coarse-equivalent results suggest the adaptive blend is near a local optimum"}}
{"run":229,"commit":"fc61f07","metric":954,"metrics":{"percussive_score":926,"edm_score":963.3,"harmonic_score":982},"status":"discard","description":"Bias adaptive blend boost toward upper-band/broadband flux — identical to current best","timestamp":1774239038084,"segment":3,"confidence":9.015384615384619,"asi":{"hypothesis":"Use PV flux spectral distribution so noisy/broadband percussion gets more blend than low-heavy tonal hits","rollback_reason":"No measurable gain over the simpler adaptive blend","next_action_hint":"Further parameter tweaks are hitting a plateau; next distinct path should change the blended signal itself (band-limited/EQ) or improve diagnostics for percussive 2.0x"}}
{"run":230,"commit":"fc61f07","metric":954,"metrics":{"percussive_score":926,"edm_score":963.3,"harmonic_score":982},"status":"discard","description":"Gentle low-cut on blended path only — identical to current best","timestamp":1774239209482,"segment":3,"confidence":9.015384615384619,"asi":{"hypothesis":"Band-limit only the tiny resample blend by attenuating its low-passed component during transient frames, preserving attack edge without touching PV internals","rollback_reason":"No measurable gain over the current adaptive full-band blend","next_action_hint":"Try the opposite spectral tilt on blended path (gentle high emphasis) or run a diagnostic focused on percussive 2.0x freq-preservation vs batch-similarity split"}}
{"run":231,"commit":"fc61f07","metric":954,"metrics":{"percussive_score":926,"edm_score":963.3,"harmonic_score":982},"status":"discard","description":"Gentle high-emphasis on blended path only — identical to current best","timestamp":1774239380034,"segment":3,"confidence":9.015384615384619,"asi":{"hypothesis":"Boost only the high-passed component of the tiny blended resample path during transient frames to add edge without perturbing PV core behavior","rollback_reason":"No measurable gain over the simpler adaptive blend","next_action_hint":"Stop spectral-shaping variants unless diagnostics reveal a specific metric deficit they address; next best path is a targeted percussive 2.0x diagnostic or a more structural band-limited blend source"}}
{"run":232,"commit":"fc61f07","metric":953.6,"metrics":{"percussive_score":925.2,"edm_score":963.1,"harmonic_score":982},"status":"discard","description":"High-pass-only resample blend source — drops overall and percussive, full-band adaptive blend is better","timestamp":1774239515085,"segment":3,"confidence":9.156250000000036,"asi":{"hypothesis":"Use only the high-passed component of the resample path as the transient helper, removing its low/tonal content entirely","rollback_reason":"953.6 vs 954.0, percussive down to 925.2. The low/full-band component of the blend is still important.","next_action_hint":"Do not pursue pure band-pass/high-pass blend sources; if revisiting, keep some low/full-band content. Strong next step is a focused percussive 2.0x diagnostic rather than more source-shape sweeps","dead_end":"pure high-pass blend source"}}
{"run":233,"commit":"fc61f07","metric":954,"metrics":{"percussive_score":926,"edm_score":963.3,"harmonic_score":982},"status":"discard","description":"Mixed full-band + high-passed helper on blended path — identical to current best","timestamp":1774239729347,"segment":3,"confidence":9.301587301587205,"asi":{"hypothesis":"Retain the successful full-band adaptive blend, but replace a small flux-driven fraction with a high-passed helper to sharpen attacks without losing low/full-band support","rollback_reason":"No measurable gain over the simpler full-band adaptive blend","next_action_hint":"Further blend-shape variants look exhausted; next distinct path should be diagnostic-informed, likely around percussive 2.0x behavior rather than generic helper shaping","insight":"The successful effect appears robustly tied to plain full-band adaptive blending; adding a spectral helper neither helps nor catastrophically hurts when kept small"}}
{"run":234,"commit":"fc61f07","metric":954,"metrics":{"percussive_score":926,"edm_score":963.3,"harmonic_score":982},"status":"discard","description":"Raise adaptive base blend to 5.5% at extreme ratio — identical to current best","timestamp":1774239836669,"segment":3,"confidence":9.375999999999832,"asi":{"hypothesis":"Since the adaptive blend only activates at the extreme-ratio case, push the base higher to see if the old fixed-blend optimum no longer applies","rollback_reason":"No measurable gain over 4.5% base","next_action_hint":"Parameter sweeps in the current adaptive-blend family appear exhausted; next iteration should be a more structural diagnostic-informed change, not another scalar retune"}}
{"run":235,"commit":"fc61f07","metric":954,"metrics":{"percussive_score":926,"edm_score":963.3,"harmonic_score":982},"status":"discard","description":"Gentle low-boost on blended path for transient frames — identical to current best","timestamp":1774240008985,"segment":3,"confidence":9.45161290322574,"asi":{"hypothesis":"Help percussive 2.0x low-frequency preservation by slightly boosting the low-passed component of the tiny blended path only on strong transient frames","rollback_reason":"No measurable gain over the simpler adaptive full-band blend","next_action_hint":"Downstream spectral shaping looks exhausted in both directions; next distinct step should change blend timing/state or add deeper diagnostics outside the benchmark harness"}}
{"run":236,"commit":"fc61f07","metric":953.7,"metrics":{"percussive_score":925.2,"edm_score":963.4,"harmonic_score":982},"status":"discard","description":"EMA smoothing on adaptive blend factor — smears transient help, percussive regresses","timestamp":1774240128309,"segment":3,"confidence":9.45161290322574,"asi":{"hypothesis":"Smooth flux-driven blend factor over time to reduce modulation noise from frame-to-frame flux swings","rollback_reason":"953.7 vs 954.0; smoothing delayed transient emphasis and hurt percussive 2.0x","next_action_hint":"If revisiting timing, prefer asymmetric attack/release behavior rather than symmetric smoothing","insight":"The helper needs immediate transient response; added lag is net harmful even if EDM inches up slightly"}}
{"run":237,"commit":"fc61f07","metric":953.9,"metrics":{"percussive_score":925.4,"edm_score":963.6,"harmonic_score":982},"status":"discard","description":"Instant-attack / slow-release blend factor — EDM improves but percussive still regresses vs best","timestamp":1774240247845,"segment":3,"confidence":9.606557377049148,"asi":{"hypothesis":"Keep transient blend response immediate but decay helper support slowly after the onset to improve continuity without losing attack","rollback_reason":"953.9 vs 954.0; percussive falls to 925.4 despite EDM +0.3","next_action_hint":"Timing-state experiments are not beating the stateless adaptive blend; next path should likely avoid helper-state and target a different mechanism","insight":"Holding blend after onset helps tonal/EDM slightly but blurs the percussive case that dominates the remaining gap"}}
{"run":238,"commit":"fc61f07","metric":954,"metrics":{"percussive_score":926,"edm_score":963.3,"harmonic_score":982},"status":"discard","description":"Extreme-ratio low-band reset widening — identical to current best","timestamp":1774240347076,"segment":3,"confidence":10.103448275862153,"asi":{"hypothesis":"When the scheduler already detects an upper-band transient at extreme ratios, also reset the low band so kick/low-mid attacks can re-anchor","rollback_reason":"No measurable gain over current best despite being a distinct mechanism","next_action_hint":"If revisiting scheduler-side ideas, try more selective/event-shaped low-band widening rather than unconditional extreme-ratio widening","insight":"Low-band reset broadening is not enough by itself; the remaining ceiling is likely not just missed low-band reseeding"}}
{"run":239,"commit":"fc61f07","metric":954,"metrics":{"percussive_score":926,"edm_score":963.3,"harmonic_score":982},"status":"discard","description":"Scheduler-coupled extra blend on detected transient-reset callbacks — identical to current best","timestamp":1774240480452,"segment":3,"confidence":10.103448275862153,"asi":{"hypothesis":"When the scheduler confirms a transient event, give the helper blend a small extra boost that callback in addition to flux-driven adaptation","rollback_reason":"No measurable gain over pure flux-driven adaptive blending","next_action_hint":"Current plateau seems robust across blend timing, shaping, and scheduler coupling; next resume likely needs either deeper off-benchmark diagnostics or a new architectural lever"}}
{"run":240,"commit":"fc61f07","metric":954,"metrics":{"percussive_score":926,"edm_score":963.3,"harmonic_score":982},"status":"discard","description":"Tiny transient-driven advance of blended helper path — identical to current best","timestamp":1774240576366,"segment":3,"confidence":10.103448275862153,"asi":{"hypothesis":"Advance the helper resample path by a few samples on strong transient frames so its attack counteracts PV smear a bit earlier","rollback_reason":"No measurable gain over the current helper alignment","next_action_hint":"Most downstream helper manipulations now tie; next meaningful work likely requires external diagnostics or a broader architectural shift rather than more local helper surgery"}}
{"run":241,"commit":"fc61f07","metric":954,"metrics":{"percussive_score":926,"edm_score":963.3,"harmonic_score":982},"status":"discard","description":"Transient-residual helper blend — identical to current best","timestamp":1774240747310,"segment":3,"confidence":10.103448275862153,"asi":{"hypothesis":"Blend a flux-adaptive mix of full-band interpolant and attack residual instead of only the raw resample helper","rollback_reason":"No measurable gain over current full-band adaptive helper","next_action_hint":"Most plausible downstream helper formulations now tie; next resume should either add deeper diagnostics tooling or accept the plateau","insight":"Attack residual alone is not the missing ingredient; the current best likely already captures most of the available downstream benefit"}}
{"run":242,"commit":"fc61f07","metric":954,"metrics":{"percussive_score":926.1,"edm_score":963.3,"harmonic_score":982},"status":"discard","description":"Flux + onset-energy helper blend — ties overall, percussive nudges +0.1 but no primary gain","timestamp":1774246757184,"segment":3,"confidence":10.19130434782599,"asi":{"hypothesis":"Combine PV per-bin flux with a simple input-RMS onset-rise signal so low-frequency kicks can boost helper blend even when spectral flux under-reports them","rollback_reason":"Primary remained 954.0 despite percussive +0.1","next_action_hint":"If pursuing the unified onset model further, increase onset-energy weight modestly and see if it can convert the percussive nudge into a primary gain","insight":"Low-frequency-aware onset information is directionally useful but too weak in the first pass to move the aggregate score"}}
{"run":243,"commit":"e479be4","metric":954.1,"metrics":{"percussive_score":926.2,"edm_score":963.3,"harmonic_score":982},"status":"keep","description":"Unified onset model lite: combine PV flux with stronger input-RMS onset-rise boost for helper blend — overall 954.1 (+0.1), percussive 926.2","timestamp":1774246900142,"segment":3,"confidence":10.298245614035013,"asi":{"hypothesis":"Spectral flux alone underweights kick-like low-frequency onsets, so combine it with a simple input-RMS rise detector to boost the helper blend on low-frequency attacks","improvement":"+0.1 overall, +0.2 percussive","onset_boost_weight":0.35,"learned":"A low-frequency-aware onset term does add signal beyond PV flux alone; unified onset model is a real path, not just noise"}}
{"run":244,"commit":"e479be4","metric":954.1,"metrics":{"percussive_score":926.2,"edm_score":963.3,"harmonic_score":982},"status":"discard","description":"Raise helper cap to 11% under unified onset model — identical to current best","timestamp":1774246996131,"segment":3,"confidence":10.20869565217392,"asi":{"hypothesis":"The kick-aware onset term may benefit from a slightly higher maximum helper blend on the strongest attacks","rollback_reason":"No measurable gain over 10% cap with unified onset model","next_action_hint":"Keep the unified onset term, but tune its weight/shape rather than the cap"}}
