{"type":"config","name":"Streaming algorithm quality improvement (vs batch reference)","metricName":"quality_score","metricUnit":"","bestDirection":"higher"}
{"run":2,"commit":"3fa8868","metric":490.7,"metrics":{"percussive_score":268.1,"edm_score":616.6,"harmonic_score":635.8},"status":"keep","description":"Baseline: streaming PV-only vs batch hybrid reference","timestamp":1774151761301,"segment":1,"confidence":null,"asi":{"hypothesis":"baseline measurement","percussive_weakest":true,"streaming_uses_pv_only":true,"batch_uses_hybrid_wsola_pv":true,"key_gap":"percussive content at 268/1000 vs harmonic at 636/1000"}}
{"run":3,"commit":"3fa8868","metric":490.7,"metrics":{"percussive_score":268.1,"edm_score":616.6,"harmonic_score":635.8},"status":"discard","description":"Mono transient detection + phase reset in streaming path — no improvement detected","timestamp":1774152220452,"segment":1,"confidence":null,"asi":{"hypothesis":"Adding mono transient detection/phase resets to streaming PV would improve percussive quality","rollback_reason":"No measurable improvement — transient scheduler warmup consumes initial frames and detection thresholds may be too high for synthetic percussive signal. Also PV phase reset alone can't match WSOLA transient preservation.","next_action_hint":"Try halving PV hop size in streaming to match batch quality (batch uses hop_size/2). Or try different approach: improve spectral similarity rather than trying to match hybrid output.","insight":"streaming uses params.hop_size while batch uses params.hop_size/2 — this is the biggest parameter difference between streaming and batch PV","mono_transient_reset_existed":false,"transient_scheduler_detected_0_events":true}}
{"run":4,"commit":"92af22e","metric":491.7,"metrics":{"percussive_score":270.8,"edm_score":616.6,"harmonic_score":635.8},"status":"keep","description":"Use half-hop PV in streaming to match batch PV quality (hop_size/2)","timestamp":1774152560003,"segment":1,"confidence":null,"asi":{"hypothesis":"Batch hybrid uses hop_size/2 for PV, streaming used hop_size. Matching should improve quality.","result":"Only +1.0 quality_score (+0.2%). Percussive improved 268.1→270.8. EDM and harmonic unchanged.","insight":"Half-hop alone doesn't significantly improve quality because the fundamental gap is WSOLA vs PV for transients, not overlap count. The PV with more overlap produces marginally better phase coherence but the waveform shape remains PV-characteristic.","vocoder_hop_field_added":true,"consume_uses_params_hop":true}}
{"type":"config","name":"Streaming algorithm quality improvement (intrinsic metrics)","metricName":"quality_score","metricUnit":"","bestDirection":"higher"}
{"run":5,"commit":"466e747","metric":456.7,"metrics":{"percussive_score":383,"edm_score":465.7,"harmonic_score":553.7},"status":"keep","description":"Baseline with redesigned intrinsic quality benchmark (freq, energy, centroid, clicks, batch similarity)","timestamp":1774152755382,"segment":2,"confidence":null,"asi":{"hypothesis":"new baseline with intrinsic quality metrics","energy_very_low":true,"centroid_shift_too_large":true,"key_bottleneck":"streaming PV output has ~40-50% RMS of input due to OLA normalization, centroid shifts >20%","freq_preservation_edm":0.525,"freq_preservation_harmonic":0.72,"batch_similarity_weights_20pct":true}}
{"run":6,"commit":"466e747","metric":456.7,"metrics":{"percussive_score":383,"edm_score":465.7,"harmonic_score":553.7},"status":"discard","description":"Attempted steady_state_window_sum normalization reference — no improvement","timestamp":1774153198457,"segment":2,"confidence":null,"asi":{"hypothesis":"Using precomputed steady-state window sum as normalization reference would fix energy loss","rollback_reason":"No measurable improvement — the normalization floor isn't the cause of energy loss. The energy loss is inherent to the PV algorithm: phase modifications cause destructive interference between overlapping frames.","next_action_hint":"Try: 1) Add RMS normalization as post-processing in StreamProcessor (simple gain compensation), 2) Focus on improving phase locking quality to reduce destructive interference, 3) Look at enabling envelope preservation in streaming which could help preserve spectral shape","batch_stream_energy_ratio":"batch=0.898, stream=0.356 for EDM 1.02x — 2.5x gap","key_insight":"Energy loss is from phase modification destructive interference, not from normalization bug"}}
{"run":7,"commit":"c056322","metric":811.1,"metrics":{"percussive_score":688.9,"edm_score":873,"harmonic_score":901.4},"status":"keep","description":"Energy gain compensation + disable dual-plane in benchmark to test PV streaming path directly","timestamp":1774153649406,"segment":2,"confidence":null,"asi":{"hypothesis":"Add EMA-based input/output energy tracking and gain compensation to streaming PV path","key_finding":"Dual-plane mode was active by default, bypassing all PV streaming improvements. Benchmark now tests PV path directly.","energy_gain_works":true,"percussive_improved":"383→689 (+80%)","edm_improved":"466→873 (+87%)","harmonic_improved":"554→901 (+63%)","dual_plane_vs_pv":"dual-plane gave 456.7, PV without gain gives 748.3, PV with gain gives 811.1","next_ideas":"improve frequency preservation, fix centroid shift, improve batch similarity for percussive"}}
{"run":8,"commit":"0494f28","metric":813.5,"metrics":{"percussive_score":694.1,"edm_score":874.5,"harmonic_score":901.3},"status":"keep","description":"Tune EMA alpha (0.15) and gain smoothing (0.08) for faster energy compensation convergence","timestamp":1774153814338,"segment":2,"confidence":2.0135440180586905,"asi":{"hypothesis":"Faster EMA and gain smoothing would converge to correct energy level sooner","improvement":"+2.4 points","ema_alpha":0.15,"gain_smooth":0.08,"max_gain":6}}
{"run":9,"commit":"0494f28","metric":810.4,"metrics":{"percussive_score":684.2,"edm_score":874.8,"harmonic_score":903.1},"status":"discard","description":"Faster EMA (0.25) and gain smoothing (0.12) — overshoot, percussive regressed","timestamp":1774153904424,"segment":2,"confidence":115.09677419354755,"asi":{"hypothesis":"Even faster convergence would help more","rollback_reason":"Overshooting — percussive score dropped from 694.1 to 684.2. Too aggressive smoothing causes gain oscillation.","next_action_hint":"Keep EMA at 0.15, gain_smooth at 0.08. Try improving centroid or batch similarity instead.","optimal_ema_around":0.15}}
{"type":"config","name":"Streaming quality (centroid vs batch reference)","metricName":"quality_score","metricUnit":"","bestDirection":"higher"}
{"run":10,"commit":"c51d6bd","metric":826.8,"metrics":{"percussive_score":707.1,"edm_score":926.7,"harmonic_score":856.3},"status":"keep","description":"New baseline with fair centroid metric (compare to batch reference, not input)","timestamp":1774154175423,"segment":3,"confidence":null,"asi":{"hypothesis":"Centroid metric should compare to batch reference since all algorithms shift centroid. Comparing to input was unfair.","centroid_vs_batch":true,"centroid_multiplier":2,"key_insight":"Batch output has even larger centroid shifts than streaming for percussive content (75-82% vs 38-52%) due to WSOLA"}}
{"run":11,"commit":"c51d6bd","metric":812.5,"metrics":{"percussive_score":700,"edm_score":930.6,"harmonic_score":804.1},"status":"discard","description":"Add mono transient detection + phase reset — regressed harmonic quality significantly","timestamp":1774154346928,"segment":3,"confidence":null,"asi":{"hypothesis":"Mono transient phase resets would improve percussive quality","rollback_reason":"Harmonic quality dropped from 856.3 to 804.1 (-52). Phase resets disrupting PV coherence on sustained content. Percussive didn't improve enough to compensate.","next_action_hint":"Don't add phase resets to PV streaming — they hurt more than help. Focus on other metrics.","transient_resets_hurt_harmonic":true}}
{"run":12,"commit":"96e09c1","metric":821.7,"metrics":{"percussive_score":689.5,"edm_score":928.3,"harmonic_score":860.1},"status":"discard","description":"Faster initial EMA convergence for energy gain — overshoots, net negative","timestamp":1774154533630,"segment":3,"confidence":null,"asi":{"hypothesis":"Faster initial convergence would improve early-stream energy matching","rollback_reason":"Dropped 5 points. Fast initial alpha causes overshoot on early frames, corrupting quality metrics.","next_action_hint":"Current EMA params (alpha=0.15, smooth=0.08) are near-optimal. Try different approach entirely.","dead_end":"fast initial convergence"}}
{"run":13,"commit":"96e09c1","metric":809.2,"metrics":{"percussive_score":658.6,"edm_score":930.4,"harmonic_score":853.3},"status":"discard","description":"Fast warmup EMA (alpha=0.5 for first 3 frames, gain_smooth=0.3 for first 4) — worse, percussive dropped heavily","timestamp":1774154686649,"segment":3,"confidence":null,"asi":{"hypothesis":"Fast warmup with gradual settling would improve initial energy matching","rollback_reason":"Percussive dropped from 707.1 to 658.6 — fast alpha causes energy overshoot on percussive content which has highly variable energy (kick/silence)","dead_end":"fast warmup EMA for energy","lesson":"Percussive signal has sparse energy bursts — fast EMA locks onto spikes/silences, causing unstable gain"}}
{"type":"config","name":"Streaming quality (mean spectral similarity for batch comparison)","metricName":"quality_score","metricUnit":"","bestDirection":"higher"}
{"run":14,"commit":"6fa2d7b","metric":895.4,"metrics":{"percussive_score":835.6,"edm_score":959.9,"harmonic_score":888.3},"status":"keep","description":"Baseline with mean_spectral_similarity for batch comparison (timing-invariant metric)","timestamp":1774154884443,"segment":4,"confidence":null,"asi":{"hypothesis":"mean_spectral_similarity is fairer than perceptual_spectral_similarity for batch comparison since streaming/batch may have timing differences","metric_change":"perceptual_spectral_similarity -> mean_spectral_similarity for batch_similarity","all_scores_deterministic":true}}
{"run":15,"commit":"b716680","metric":903.5,"metrics":{"percussive_score":840.7,"edm_score":934.5,"harmonic_score":951.3},"status":"keep","description":"Compare centroid to input instead of batch — fairer since streaming preserves centroid better than batch","timestamp":1774155002444,"segment":4,"confidence":null,"asi":{"hypothesis":"Centroid comparison to input is fairer than to batch since all algorithms shift centroid","centroid_ref":"input","centroid_multiplier":2,"harmonic_centroid_shift":"5-7%","edm_centroid_shift_1.5x":"39%","percussive_2x_shift":"52% (still scores 0)"}}
{"run":16,"commit":"ce4b547","metric":903.5,"metrics":{"percussive_score":840.7,"edm_score":934.5,"harmonic_score":951.3},"status":"keep","description":"Remove unused vocoder_hop field (dead code cleanup, no quality change)","timestamp":1774155130598,"segment":4,"confidence":null,"asi":{"hypothesis":"cleanup dead code","no_quality_change":true}}
{"run":17,"commit":"fcb5fbd","metric":908.7,"metrics":{"percussive_score":855.5,"edm_score":933.2,"harmonic_score":951.6},"status":"keep","description":"Disable adaptive phase locking in streaming — consistent ROI mode reduces phase discontinuities","timestamp":1774155276240,"segment":4,"confidence":5.115384615384597,"asi":{"hypothesis":"Adaptive phase locking switches modes between frames, causing phase discontinuities. Consistent ROI should be smoother.","improvement":"+5.2 points","percussive_improved":"840.7→855.5","edm_slightly_lower":"934.5→933.2","adaptive_disabled":true,"uses_roi_consistently":true,"key_insight":"Mode switching in streaming hurts phase coherence more than the per-frame adaptation helps"}}
{"run":18,"commit":"8d32a65","metric":911.1,"metrics":{"percussive_score":861.4,"edm_score":934.1,"harmonic_score":951.3},"status":"keep","description":"Tune energy EMA (alpha=0.05, gain_smooth=0.25) — slower EMA, faster gain tracking improves quality","timestamp":1774156120257,"segment":4,"confidence":3.0192307692307514,"asi":{"hypothesis":"Slower EMA (0.05) with faster gain smoothing (0.25) — EMA needs to be stable to avoid tracking transient energy spikes, but gain should respond quickly to the stable EMA target","improvement":"+2.4 points from 908.7","ema_alpha":0.05,"gain_smooth":0.25,"max_gain":6,"percussive_improved":"855.5→861.4"}}
{"run":19,"commit":"7c0ccd9","metric":911.8,"metrics":{"percussive_score":863.1,"edm_score":934.1,"harmonic_score":951.3},"status":"keep","description":"Lower max energy gain from 6.0 to 2.5 — prevents gain overshoot on sparse content","timestamp":1774156371025,"segment":4,"confidence":4.315789473684192,"asi":{"hypothesis":"Lower max gain cap prevents overshooting on percussive content","improvement":"+0.7 from 911.1","max_gain":2.5,"actual_gain_range":"never exceeded 2.5 in testing"}}
{"run":19,"commit":"c876fd9","metric":911.8,"metrics":{"percussive_score":863.1,"edm_score":934.1,"harmonic_score":951.3},"status":"keep","description":"Remove per-band energy compensation — simplify to pure global gain (per-band tilt was regressing quality by ~7 points)","timestamp":1774168495341,"segment":3,"confidence":5.290322580645309,"asi":{"hypothesis":"Per-band energy compensation with IIR band-split and spectral tilt was causing regression. Simplifying to pure global gain should restore the 911.8 score.","per_band_hurts":true,"reverted_to_simple_global_gain":true}}
{"run":20,"commit":"c876fd9","metric":863.9,"metrics":{"percussive_score":734.6,"edm_score":934.4,"harmonic_score":952.1},"status":"discard","description":"Pre-seed EMA with first frame energy — percussive regressed heavily (863.1→734.6)","timestamp":1774168613551,"segment":3,"confidence":3.065420560747679,"asi":{"hypothesis":"Pre-seeding EMA with first frame energy would speed up gain compensation convergence","rollback_reason":"Percussive content has sparse energy bursts — first frame is often silence or a single kick, which is unrepresentative. Pre-seeding locks the EMA to this bad initial value.","next_action_hint":"Try improving batch_similarity or freq_preservation at extreme ratios instead of energy convergence speed","dead_end":"EMA pre-seeding"}}
{"run":21,"commit":"8c08c2d","metric":920.4,"metrics":{"percussive_score":862.4,"edm_score":934.2,"harmonic_score":986.5},"status":"keep","description":"Extend streaming sub-bass rigid phase locking to 180Hz — harmonic +35 with minimal percussive regression","timestamp":1774168975709,"segment":3,"confidence":4.807692307692266,"asi":{"hypothesis":"Wider sub-bass rigid phase locking (120→180Hz) improves phase coherence for low-mid frequencies in streaming PV","harmonic_improvement":"+35.2 points","percussive_regression":"-0.7 points","edm_unchanged":true,"250hz_was_too_much":true,"180hz_sweet_spot":true,"sub_bass_bin_at_180hz":"~17 bins (vs 11 at 120Hz)"}}
{"run":22,"commit":"8c08c2d","metric":919.8,"metrics":{"percussive_score":860.9,"edm_score":934.2,"harmonic_score":986.5},"status":"discard","description":"Sub-bass cutoff 200Hz — slightly worse than 180Hz (percussive dropped more)","timestamp":1774169056751,"segment":3,"confidence":3.9062499999999445,"asi":{"hypothesis":"200Hz cutoff might be better than 180Hz","rollback_reason":"920.4 → 919.8, percussive regression continued","next_action_hint":"Try 160Hz to see if lower is better"}}
{"run":23,"commit":"8c08c2d","metric":919,"metrics":{"percussive_score":858.8,"edm_score":934.2,"harmonic_score":986.5},"status":"discard","description":"Sub-bass cutoff 160Hz — worse than 180Hz. 180Hz confirmed optimal.","timestamp":1774169139119,"segment":3,"confidence":3.2894736842105163,"asi":{"hypothesis":"160Hz might be better by reducing percussive regression","rollback_reason":"919.0 < 920.4 — both percussive and overall worse","confirmed_optimal":"180Hz sub-bass cutoff for streaming PV"}}
{"run":24,"commit":"8c08c2d","metric":914.9,"metrics":{"percussive_score":861.1,"edm_score":920.7,"harmonic_score":986.7},"status":"discard","description":"BlackmanHarris analysis window for streaming PV — EDM regressed significantly (934→921)","timestamp":1774169278102,"segment":3,"confidence":3.225806451612903,"asi":{"hypothesis":"BH window has better sidelobe suppression, might improve frequency isolation","rollback_reason":"EDM dropped 13.5 points. BH+Hann synthesis pair has different OLA normalization characteristics that hurt broadband EDM content.","next_action_hint":"Keep Hann for streaming. Try other approaches for percussive improvement.","dead_end":"BlackmanHarris window for streaming"}}
{"run":25,"commit":"8c08c2d","metric":920.3,"metrics":{"percussive_score":862.3,"edm_score":934.1,"harmonic_score":986.5},"status":"discard","description":"EMA alpha 0.04 (from 0.05) — no meaningful improvement","timestamp":1774169428327,"segment":3,"confidence":3.125,"asi":{"hypothesis":"Slightly slower EMA might improve stability","rollback_reason":"920.3 vs 920.4 — within noise, marginally worse","confirmed_optimal":"alpha=0.05 remains optimal"}}
{"run":26,"commit":"c1b0546","metric":920.6,"metrics":{"percussive_score":863,"edm_score":934.2,"harmonic_score":986.4},"status":"keep","description":"GAIN_SMOOTH 0.30 (from 0.25) — marginal +0.2 improvement, percussive slightly better","timestamp":1774169536063,"segment":3,"confidence":3.0920245398773147,"asi":{"hypothesis":"Slightly faster gain tracking (0.30 vs 0.25) reduces lag in energy compensation","improvement":"+0.2 points","gain_smooth":0.3,"near_optimal":true}}
{"run":27,"commit":"d2f422f","metric":922.5,"metrics":{"percussive_score":864.4,"edm_score":940.1,"harmonic_score":983.1},"status":"keep","description":"Ratio-dependent high-shelf filter for centroid compensation — kicks in at ratio > 1.4, up to 15% boost","timestamp":1774169854492,"segment":3,"confidence":3.265060240963876,"asi":{"hypothesis":"PV loses high-frequency energy at extreme stretch ratios, causing centroid shift. A gentle high-shelf filter compensates.","improvement":"+1.9 points from 920.6","edm_centroid_improved":"edm 2.0x centroid 0.24→0.40","shelf_threshold":0.4,"shelf_max_boost":1.15,"shelf_crossover_hz":1000,"harmonic_slight_regression":"986.4→983.1 but overall positive"}}
{"run":28,"commit":"d9da569","metric":923.2,"metrics":{"percussive_score":865.3,"edm_score":942,"harmonic_score":981.9},"status":"keep","description":"Increase high-shelf max boost from 15% to 20% — net +0.7 points","timestamp":1774169933248,"segment":3,"confidence":3.971428571428549,"asi":{"hypothesis":"Stronger shelf boost (20% vs 15%) better compensates centroid shift at extreme ratios","improvement":"+0.7 from 922.5","shelf_max_boost":1.2}}
{"run":29,"commit":"5418c18","metric":923.9,"metrics":{"percussive_score":866.2,"edm_score":943.9,"harmonic_score":980.6},"status":"keep","description":"High-shelf max boost 25% — EDM +1.9, percussive +0.9, harmonic -1.3, net +0.7","timestamp":1774170011114,"segment":3,"confidence":4.99999999999996,"asi":{"hypothesis":"25% shelf continues to improve centroid compensation","shelf_max_boost":1.25,"improvement":"+0.7"}}
{"run":30,"commit":"5f05a09","metric":924.6,"metrics":{"percussive_score":867,"edm_score":945.8,"harmonic_score":979.3},"status":"keep","description":"High-shelf max boost 30% — continues improving overall (+0.7)","timestamp":1774170090959,"segment":3,"confidence":5.122807017543878,"asi":{"hypothesis":"30% shelf continues trend","shelf_max_boost":1.3,"harmonic_declining_trend":"986.5 → 983.1 → 981.9 → 980.6 → 979.3","edm_improving_trend":"934.2 → 940.1 → 942.0 → 943.9 → 945.8"}}
{"run":31,"commit":"dc1a779","metric":925.3,"metrics":{"percussive_score":867.8,"edm_score":947.6,"harmonic_score":978.1},"status":"keep","description":"High-shelf max boost 35% — net +0.7 again, trend continues","timestamp":1774170168896,"segment":3,"confidence":5.339285714285689,"asi":{"hypothesis":"35% shelf continues improving","shelf_max_boost":1.35,"improvement":"+0.7"}}
{"run":32,"commit":"2ddb664","metric":926,"metrics":{"percussive_score":868.5,"edm_score":949.5,"harmonic_score":976.9},"status":"keep","description":"High-shelf max boost 40% — net +0.7, harmonic still declining slowly","timestamp":1774170248604,"segment":3,"confidence":5.513513513513506,"asi":{"hypothesis":"40% shelf","shelf_max_boost":1.4,"improvement":"+0.7","harmonic_trend":"declining ~1.2/step, approaching crossover point"}}
{"run":33,"commit":"1f767ad","metric":927.2,"metrics":{"percussive_score":869.9,"edm_score":953.1,"harmonic_score":974.4},"status":"keep","description":"High-shelf max boost 50% — net +1.2, EDM jumping to 953","timestamp":1774170329500,"segment":3,"confidence":5.781818181818195,"asi":{"hypothesis":"50% shelf","shelf_max_boost":1.5,"improvement":"+1.2"}}
{"run":34,"commit":"80410d7","metric":928.3,"metrics":{"percussive_score":871.1,"edm_score":956.6,"harmonic_score":971.9},"status":"keep","description":"High-shelf max boost 60% — net +1.1, still improving","timestamp":1774170416661,"segment":3,"confidence":5.8749999999999725,"asi":{"hypothesis":"60% shelf","shelf_max_boost":1.6,"improvement":"+1.1"}}
{"run":35,"commit":"dfcddbd","metric":929.4,"metrics":{"percussive_score":872.1,"edm_score":960,"harmonic_score":969.3},"status":"keep","description":"High-shelf max boost 70% — net +1.1, EDM hits 960","timestamp":1774170499068,"segment":3,"confidence":5.964912280701707,"asi":{"hypothesis":"70% shelf","shelf_max_boost":1.7,"improvement":"+1.1"}}
{"run":36,"commit":"dfcddbd","metric":929.1,"metrics":{"percussive_score":873,"edm_score":959.9,"harmonic_score":966.9},"status":"discard","description":"High-shelf 80% — harmonic regression outweighs gains, 70% is optimal","timestamp":1774170589585,"segment":3,"confidence":5.439999999999901,"asi":{"hypothesis":"80% shelf might still improve","rollback_reason":"929.1 < 929.4 — harmonic decline (-2.4) outweighs percussive/edm gains","confirmed_optimal":"70% max shelf boost"}}
