{"run":37,"commit":"e664ba1","metric":930.3,"metrics":{"percussive_score":874,"edm_score":958.6,"harmonic_score":972.2},"status":"keep","description":"Raise shelf crossover to 2000Hz — more targeted HF boost, harmonic recovers, overall +0.9","timestamp":1774170721622,"segment":3,"confidence":5.132352941176416,"asi":{"hypothesis":"Higher crossover frequency makes the shelf more targeted to the region that actually loses energy","improvement":"+0.9 from 929.4","shelf_crossover_hz":2000,"harmonic_recovered":"969.3→972.2"}}
{"run":38,"commit":"e664ba1","metric":929,"metrics":{"percussive_score":872.8,"edm_score":954.8,"harmonic_score":974.8},"status":"discard","description":"Shelf crossover 3000Hz — too narrow, EDM regressed. 2000Hz confirmed optimal.","timestamp":1774170800840,"segment":3,"confidence":4.813793103448273,"asi":{"hypothesis":"3000Hz crossover would be even more targeted","rollback_reason":"930.3→929.0, EDM -3.8 — too narrow misses the mid frequencies that need boost","confirmed_optimal":"2000Hz crossover"}}
{"run":39,"commit":"e664ba1","metric":929,"metrics":{"percussive_score":875.6,"edm_score":960.5,"harmonic_score":961.7},"status":"discard","description":"Shelf threshold 0.3 — harmonic regresses more, net negative","timestamp":1774170885812,"segment":3,"confidence":4.53246753246757,"asi":{"hypothesis":"Lower threshold applies shelf sooner","rollback_reason":"929.0 vs 930.3, harmonic dropped to 961.7","confirmed_optimal":"threshold 0.4"}}
{"run":40,"commit":"38e73ac","metric":930.7,"metrics":{"percussive_score":875.3,"edm_score":958.6,"harmonic_score":972.2},"status":"keep","description":"Increase max energy gain from 2.5 to 3.0 — percussive improves, overall +0.4","timestamp":1774171037077,"segment":3,"confidence":4.971830985915487,"asi":{"hypothesis":"Higher gain cap allows better energy compensation at extreme ratios where PV loses more energy","max_gain":3,"improvement":"+0.4"}}
{"run":41,"commit":"38e73ac","metric":930.6,"metrics":{"percussive_score":875,"edm_score":958.6,"harmonic_score":972.2},"status":"discard","description":"Max gain 3.5 — no improvement over 3.0","timestamp":1774171117613,"segment":3,"confidence":5.430769230769242,"asi":{"hypothesis":"Higher gain cap","rollback_reason":"930.6 vs 930.7, gain isn't actually reaching 3.0 in most cases","confirmed_optimal":"max_gain 3.0"}}
{"run":42,"commit":"38e73ac","metric":930.3,"metrics":{"percussive_score":874,"edm_score":958.5,"harmonic_score":972.3},"status":"discard","description":"Sub-bass 200Hz with shelf — still worse than 180Hz even with shelf","timestamp":1774171244623,"segment":3,"confidence":5.693548387096795,"asi":{"hypothesis":"Sub-bass 200Hz might work better now with shelf compensating","rollback_reason":"930.3 vs 930.7, percussive still regresses at 200Hz","confirmed_optimal":"180Hz sub-bass cutoff"}}
{"run":43,"commit":"38e73ac","metric":927.9,"metrics":{"percussive_score":869.7,"edm_score":956.4,"harmonic_score":972.2},"status":"discard","description":"Identity phase locking — worse than ROI even with shelf/sub-bass improvements","timestamp":1774171330293,"segment":3,"confidence":6.086206896551784,"asi":{"hypothesis":"Identity might work better now with shelf","rollback_reason":"927.9 vs 930.7, ROI still better","confirmed_optimal":"ROI phase locking"}}
{"run":44,"commit":"38e73ac","metric":930.7,"metrics":{"percussive_score":875.3,"edm_score":958.6,"harmonic_score":972.2},"status":"discard","description":"Disable envelope preservation in streaming PV — zero effect, confirmed no-op","timestamp":1774171461949,"segment":3,"confidence":6.418181818181764,"asi":{"hypothesis":"Envelope preservation might be slightly hurting with new improvements","rollback_reason":"Exactly same score 930.7, truly zero impact","confirmed":"envelope preservation has no effect on streaming quality"}}
{"run":45,"commit":"0438106","metric":933.8,"metrics":{"percussive_score":874.6,"edm_score":959.4,"harmonic_score":984},"status":"keep","description":"Quadratic shelf curve (t²) with 80% max boost — less effect at moderate ratios, stronger at extreme. Big improvement!","timestamp":1774171571473,"segment":3,"confidence":7.384615384615316,"asi":{"hypothesis":"Quadratic curve reduces shelf effect at harmonic 1.5x while increasing it at 2.0x. Better tradeoff.","improvement":"+3.1 from 930.7","shelf_curve":"quadratic (t²)","shelf_max_boost":1.8,"harmonic_recovered":"972.2→984.0 (+11.8)","key_insight":"Quadratic onset prevents over-boosting at moderate ratios where harmonic content is most sensitive"}}
{"run":46,"commit":"0438106","metric":933.4,"metrics":{"percussive_score":875.8,"edm_score":957.5,"harmonic_score":983.7},"status":"discard","description":"Shelf 90% max boost — slightly worse, 80% is optimal with quadratic curve","timestamp":1774171656261,"segment":3,"confidence":7.384615384615397,"asi":{"hypothesis":"90% might be better","rollback_reason":"933.4 vs 933.8, EDM dropped 2 points","confirmed_optimal":"80% max boost with quadratic"}}
{"run":47,"commit":"0438106","metric":933,"metrics":{"percussive_score":876.5,"edm_score":954.1,"harmonic_score":986.2},"status":"discard","description":"Cubic shelf curve (t³) with 100% max — harmonic great but EDM regresses, net -0.8","timestamp":1774171738711,"segment":3,"confidence":6.857142857142826,"asi":{"hypothesis":"Cubic curve with higher max boost for extreme ratios only","rollback_reason":"933.0 vs 933.8, EDM dropped 5 points","confirmed_optimal":"quadratic (t²) with 80% max"}}
{"run":48,"commit":"0438106","metric":930.5,"metrics":{"percussive_score":874.3,"edm_score":949.1,"harmonic_score":986.8},"status":"discard","description":"Persistent shelf filter state — worse, per-chunk reset is better","timestamp":1774171902823,"segment":3,"confidence":7.177570093458062,"asi":{"hypothesis":"Persisting shelf filter state would reduce warmup artifacts","rollback_reason":"930.5 vs 933.8 — persistent state from previous chunk contaminates current chunk","dead_end":"persistent shelf state"}}
{"run":49,"commit":"0438106","metric":933.4,"metrics":{"percussive_score":875,"edm_score":959.8,"harmonic_score":981.5},"status":"discard","description":"Shelf threshold 0.35 with quadratic — harmonic regresses, 0.4 confirmed optimal","timestamp":1774171991934,"segment":3,"confidence":7.384615384615316,"asi":{"hypothesis":"Lower threshold would help EDM 1.5x centroid","rollback_reason":"933.4 vs 933.8, harmonic -2.5","confirmed_optimal":"threshold 0.4 with quadratic 80%"}}
{"run":50,"commit":"3607c13","metric":934.4,"metrics":{"percussive_score":876.4,"edm_score":961.1,"harmonic_score":981.2},"status":"keep","description":"Two-tier shelf: 3% base correction when gain>1.05 + quadratic ratio shelf. All types improve.","timestamp":1774172238685,"segment":3,"confidence":7.722772277227619,"asi":{"hypothesis":"PV has inherent spectral tilt even at moderate ratios. A small base shelf compensates.","improvement":"+0.6 from 933.8","base_shelf":1.03,"base_threshold":"energy_gain > 1.05","edm_improved":"959.4→961.1","percussive_improved":"874.6→876.4"}}
{"run":51,"commit":"01555dd","metric":934.8,"metrics":{"percussive_score":877.7,"edm_score":962.4,"harmonic_score":979.2},"status":"keep","description":"Base shelf 5% (from 3%) — percussive +1.3, EDM +1.3, harmonic -2.0, net +0.4","timestamp":1774172334066,"segment":3,"confidence":7.2962962962963225,"asi":{"hypothesis":"Stronger base shelf better compensates inherent PV tilt","base_shelf":1.05,"improvement":"+0.4"}}
{"run":52,"commit":"f195b7e","metric":935.3,"metrics":{"percussive_score":878.8,"edm_score":963.7,"harmonic_score":977.2},"status":"keep","description":"Base shelf 7% — continues improving. Harmonic declining slowly.","timestamp":1774172416073,"segment":3,"confidence":6.540983606557349,"asi":{"hypothesis":"7% base shelf","base_shelf":1.07,"improvement":"+0.5"}}
{"run":53,"commit":"5e0f7b1","metric":935.9,"metrics":{"percussive_score":880.5,"edm_score":965.8,"harmonic_score":974.2},"status":"keep","description":"Base shelf 10% — percussive breaks 880, EDM at 966, harmonic 974","timestamp":1774172494767,"segment":3,"confidence":6.532258064516201,"asi":{"hypothesis":"10% base shelf","base_shelf":1.1,"improvement":"+0.6"}}
{"run":54,"commit":"06b1698","metric":936.4,"metrics":{"percussive_score":881.7,"edm_score":967.2,"harmonic_score":972.2},"status":"keep","description":"Base shelf 12% — net +0.5, trend continuing","timestamp":1774172573356,"segment":3,"confidence":7.008547008546981,"asi":{"hypothesis":"12% base shelf","base_shelf":1.12,"improvement":"+0.5"}}
{"run":55,"commit":"7966284","metric":937.1,"metrics":{"percussive_score":883.4,"edm_score":969.3,"harmonic_score":969.2},"status":"keep","description":"Base shelf 15% — percussive 883, EDM 969, harmonic declining to 969","timestamp":1774172652055,"segment":3,"confidence":7.58181818181819,"asi":{"hypothesis":"15% base shelf","base_shelf":1.15,"improvement":"+0.7","harmonic_edm_converging":"both around 969"}}
{"run":56,"commit":"1ed3da6","metric":937.7,"metrics":{"percussive_score":885,"edm_score":971.4,"harmonic_score":966.2},"status":"keep","description":"Base shelf 18% — percussive 885, EDM 971, harmonic 966","timestamp":1774172732537,"segment":3,"confidence":7.486725663716856,"asi":{"hypothesis":"18% base shelf","base_shelf":1.18,"improvement":"+0.6"}}
{"run":57,"commit":"1ed3da6","metric":936.9,"metrics":{"percussive_score":887.1,"edm_score":969.9,"harmonic_score":962.3},"status":"discard","description":"Base shelf 22% — harmonic regression outweighs percussive gain. 18% is optimal.","timestamp":1774172817726,"segment":3,"confidence":7.293103448275931,"asi":{"hypothesis":"22% base shelf","rollback_reason":"936.9 vs 937.7, harmonic -3.9, EDM -1.5","confirmed_optimal":"18% base shelf"}}
{"run":58,"commit":"1f6a9e6","metric":937.8,"metrics":{"percussive_score":885.1,"edm_score":959.9,"harmonic_score":983.8},"status":"keep","description":"Gain-proportional base shelf (scale 0.45, max 18%) — harmonic recovers to 984 while maintaining gains","timestamp":1774173030513,"segment":3,"confidence":7.126050420168077,"asi":{"hypothesis":"Base shelf proportional to energy gain prevents over-boosting on harmonic content with low gain","improvement":"+0.1 from 937.7 with much better harmonic (966→984)","gain_scale":0.45,"base_shelf_max":0.18,"harmonic_recovered":true,"key_insight":"Harmonic at near-unity has low energy_gain (~1.1), so proportional base shelf is nearly zero. EDM/percussive at same ratio has higher gain so gets more shelf."}}
{"run":59,"commit":"1f6a9e6","metric":937.8,"metrics":{"percussive_score":885.1,"edm_score":960,"harmonic_score":983.6},"status":"discard","description":"Gain scale 0.35 — same score, 0.45 is fine","timestamp":1774173109304,"segment":3,"confidence":7.310344827586261,"asi":{"hypothesis":"Faster gain scaling","rollback_reason":"Same score, no improvement"}}
{"run":60,"commit":"9a93873","metric":939.2,"metrics":{"percussive_score":888.8,"edm_score":960.1,"harmonic_score":983.6},"status":"keep","description":"Gain-proportional base shelf max 25% — percussive jumps to 889, harmonic preserved at 984","timestamp":1774173189787,"segment":3,"confidence":7.239669421487669,"asi":{"hypothesis":"Higher max with gain-proportional scaling lets percussive benefit more without hurting harmonic","base_shelf_max":0.25,"improvement":"+1.4 from 937.8","percussive_improvement":"885→889"}}
{"run":61,"commit":"b81f2da","metric":940.2,"metrics":{"percussive_score":891.4,"edm_score":960.2,"harmonic_score":983.5},"status":"keep","description":"Base shelf max 30% — percussive 891, breaking 940 overall!","timestamp":1774173269736,"segment":3,"confidence":7.111111111111173,"asi":{"hypothesis":"30% max base shelf","base_shelf_max":0.3,"improvement":"+1.0"}}
{"run":62,"commit":"95b43e5","metric":940.7,"metrics":{"percussive_score":892.6,"edm_score":960.4,"harmonic_score":983.4},"status":"keep","description":"Base shelf max 35% — percussive 893, harmonic stable at 983","timestamp":1774173347521,"segment":3,"confidence":7.0781250000000355,"asi":{"hypothesis":"35% max","base_shelf_max":0.35,"improvement":"+0.5"}}
{"run":63,"commit":"982bdf5","metric":941.1,"metrics":{"percussive_score":893.4,"edm_score":960.6,"harmonic_score":983.3},"status":"keep","description":"Base shelf max 40% — 941.1 overall, percussive 893","timestamp":1774173427908,"segment":3,"confidence":6.924242424242407,"asi":{"hypothesis":"40% max","base_shelf_max":0.4,"improvement":"+0.4"}}
{"run":64,"commit":"ba68871","metric":941.7,"metrics":{"percussive_score":895,"edm_score":960.9,"harmonic_score":983.1},"status":"keep","description":"Base shelf max 50% — percussive breaks 895, overall 941.7","timestamp":1774173506132,"segment":3,"confidence":6.910447761194051,"asi":{"hypothesis":"50% max","base_shelf_max":0.5,"improvement":"+0.6"}}
{"run":65,"commit":"b6ed1ee","metric":942.3,"metrics":{"percussive_score":896.4,"edm_score":961.2,"harmonic_score":983},"status":"keep","description":"Base shelf max 60% — 942.3 overall, percussive 896","timestamp":1774173584463,"segment":3,"confidence":6.797101449275382,"asi":{"hypothesis":"60% max","base_shelf_max":0.6,"improvement":"+0.6"}}
{"run":66,"commit":"9f135f1","metric":942.9,"metrics":{"percussive_score":897.7,"edm_score":961.5,"harmonic_score":982.8},"status":"keep","description":"Base shelf max 70% — percussive 898, overall 942.9","timestamp":1774173663299,"segment":3,"confidence":6.9343065693431,"asi":{"hypothesis":"70% max","base_shelf_max":0.7,"improvement":"+0.6"}}
{"run":67,"commit":"fd5fc46","metric":943.4,"metrics":{"percussive_score":898.8,"edm_score":961.9,"harmonic_score":982.6},"status":"keep","description":"Base shelf max 80% — percussive 899, overall 943.4","timestamp":1774173742577,"segment":3,"confidence":7.058823529411694,"asi":{"hypothesis":"80% max","base_shelf_max":0.8,"improvement":"+0.5"}}
{"run":68,"commit":"cd5e3c2","metric":944.3,"metrics":{"percussive_score":900.7,"edm_score":962.5,"harmonic_score":982.2},"status":"keep","description":"Base shelf max 100% — percussive breaks 900! Overall 944.3","timestamp":1774173822368,"segment":3,"confidence":7.035971223021591,"asi":{"hypothesis":"100% max base shelf","base_shelf_max":1,"improvement":"+0.9"}}
{"run":69,"commit":"0e46e5e","metric":944.9,"metrics":{"percussive_score":902.1,"edm_score":963.2,"harmonic_score":981.8},"status":"keep","description":"Base shelf max 120% — 944.9 overall, percussive 902","timestamp":1774173900807,"segment":3,"confidence":6.971830985915583,"asi":{"hypothesis":"120% max","base_shelf_max":1.2,"improvement":"+0.6"}}
{"run":70,"commit":"0e46e5e","metric":944.6,"metrics":{"percussive_score":900.5,"edm_score":964.3,"harmonic_score":981.2},"status":"discard","description":"Base shelf max 150% — diminishing returns, 120% is optimal","timestamp":1774173980858,"segment":3,"confidence":6.827586206896552,"asi":{"hypothesis":"150% max","rollback_reason":"944.6 vs 944.9, percussive dropped","confirmed_optimal":"120% max base shelf with gain scaling 0.45"}}
{"run":71,"commit":"0e46e5e","metric":821.9,"metrics":{"percussive_score":664.1,"edm_score":873.1,"harmonic_score":981.8},"status":"discard","description":"Shelf energy compensation — over-reduces gain, massive regression","timestamp":1774174120702,"segment":3,"confidence":6.689189189189107,"asi":{"hypothesis":"Compensate gain for shelf energy addition","rollback_reason":"821.9 vs 944.9, the 50/50 low/high energy model is wrong — it over-compensates","dead_end":"gain reduction for shelf energy"}}
{"run":72,"commit":"0e46e5e","metric":930.7,"metrics":{"percussive_score":866.3,"edm_score":961.7,"harmonic_score":980.7},"status":"discard","description":"Shelf crossover 1000Hz — much worse, too aggressive mid-range boosting. 2000Hz confirmed.","timestamp":1774174233188,"segment":3,"confidence":6.827586206896552,"asi":{"hypothesis":"Lower crossover to boost wider frequency range","rollback_reason":"930.7 vs 944.9, percussive dropped 36 points","confirmed_optimal":"2000Hz crossover"}}
{"run":73,"commit":"0e46e5e","metric":941.7,"metrics":{"percussive_score":894.1,"edm_score":963.1,"harmonic_score":981.3},"status":"discard","description":"Shelf crossover 1500Hz — still worse than 2000Hz","timestamp":1774174312458,"segment":3,"confidence":6.780821917808262,"asi":{"hypothesis":"1500Hz crossover middle ground","rollback_reason":"941.7 vs 944.9","confirmed_optimal":"2000Hz crossover"}}
{"run":74,"commit":"0e46e5e","metric":941.9,"metrics":{"percussive_score":893.9,"edm_score":963.2,"harmonic_score":981.8},"status":"discard","description":"Cap total shelf at 2.5 — hurts more than helps","timestamp":1774174414701,"segment":3,"confidence":6.827586206896552,"asi":{"hypothesis":"Cap combined shelf to prevent energy over-boost","rollback_reason":"941.9 vs 944.9, capping prevents beneficial shelf at extreme ratios"}}
{"run":75,"commit":"0e46e5e","metric":921.8,"metrics":{"percussive_score":854.2,"edm_score":949.2,"harmonic_score":982},"status":"discard","description":"15% shelf energy correction — still over-corrects, percussive drops 48 points","timestamp":1774174542684,"segment":3,"confidence":6.780821917808262,"asi":{"hypothesis":"Light gain correction for shelf energy addition","rollback_reason":"921.8 vs 944.9, 15% high-frequency energy estimate too high","dead_end":"shelf energy correction at 15%"}}
{"run":76,"commit":"0e46e5e","metric":943.9,"metrics":{"percussive_score":899.7,"edm_score":962.5,"harmonic_score":982.3},"status":"discard","description":"Gain scale 0.55 — slightly worse than 0.45","timestamp":1774174627474,"segment":3,"confidence":6.780821917808262,"asi":{"hypothesis":"Slower base shelf ramp might help","rollback_reason":"943.9 vs 944.9"}}
{"run":77,"commit":"0e46e5e","metric":932.1,"metrics":{"percussive_score":891.4,"edm_score":938.2,"harmonic_score":984.2},"status":"discard","description":"Disable ratio shelf — EDM drops 24 points, ratio shelf still essential","timestamp":1774174711961,"segment":3,"confidence":6.875000000000065,"asi":{"hypothesis":"Base shelf might make ratio shelf redundant","rollback_reason":"932.1 vs 944.9, EDM needs ratio-dependent boost at 2.0x"}}
{"run":78,"commit":"6439946","metric":945.8,"metrics":{"percussive_score":905,"edm_score":962.6,"harmonic_score":981.8},"status":"keep","description":"Two-pole cascaded shelf filter — steeper transition, percussive breaks 905! +0.9 overall","timestamp":1774174804739,"segment":3,"confidence":6.904109589041136,"asi":{"hypothesis":"Two-pole shelf has steeper transition, reducing energy spillover to mid-range. Uses sqrt(shelf) per stage for same total boost.","improvement":"+0.9 from 944.9","percussive_905":true,"filter_order":2}}
{"run":79,"commit":"6439946","metric":945.8,"metrics":{"percussive_score":905.3,"edm_score":962.3,"harmonic_score":981.8},"status":"discard","description":"Three-pole shelf — same score as two-pole, no improvement","timestamp":1774174891999,"segment":3,"confidence":6.719999999999997,"asi":{"hypothesis":"Three-pole might be better","rollback_reason":"945.8 = 945.8, same","confirmed_optimal":"two-pole shelf"}}
{"run":80,"commit":"6439946","metric":944.9,"metrics":{"percussive_score":904.7,"edm_score":960.1,"harmonic_score":982.3},"status":"discard","description":"Two-pole shelf at 2500Hz — slightly worse, 2000Hz optimal with two-pole too","timestamp":1774174976169,"segment":3,"confidence":6.420382165605074,"asi":{"hypothesis":"Higher crossover with steeper filter","rollback_reason":"944.9 vs 945.8"}}
{"run":81,"commit":"91d3b69","metric":946.2,"metrics":{"percussive_score":905,"edm_score":969.1,"harmonic_score":973.4},"status":"keep","description":"Base shelf threshold 1.02 (from 1.05) — EDM +6.5, harmonic -8.4, net +0.4","timestamp":1774175065431,"segment":3,"confidence":6.195121951219486,"asi":{"hypothesis":"Lower gain threshold activates base shelf for more cases including EDM 1.02","improvement":"+0.4","base_threshold":1.02,"edm_big_jump":"962.6→969.1","harmonic_regression":"981.8→973.4"}}
{"run":82,"commit":"91d3b69","metric":944.9,"metrics":{"percussive_score":901.7,"edm_score":967.7,"harmonic_score":975.4},"status":"discard","description":"Gain scale 0.58 with threshold 1.02 — worse overall","timestamp":1774175155219,"segment":3,"confidence":6.083832335329333,"asi":{"hypothesis":"Slower ramp with lower threshold","rollback_reason":"944.9 vs 946.2"}}
{"run":83,"commit":"91d3b69","metric":943.3,"metrics":{"percussive_score":902.3,"edm_score":963.8,"harmonic_score":974.1},"status":"discard","description":"Ratio shelf 60% (from 80%) — EDM drops, still need full ratio shelf","timestamp":1774175243036,"segment":3,"confidence":5.976470588235302,"asi":{"hypothesis":"Reduce ratio shelf with stronger base shelf","rollback_reason":"943.3 vs 946.2"}}
{"run":84,"commit":"91d3b69","metric":946.1,"metrics":{"percussive_score":905,"edm_score":966.8,"harmonic_score":976.5},"status":"discard","description":"Threshold 1.03 — marginally worse than 1.02","timestamp":1774175369012,"segment":3,"confidence":5.740112994350276,"asi":{"hypothesis":"1.03 might be a better balance","rollback_reason":"946.1 vs 946.2, slightly worse"}}
{"run":85,"commit":"91d3b69","metric":897.9,"metrics":{"percussive_score":879.6,"edm_score":897.3,"harmonic_score":926.4},"status":"discard","description":"DC blocker — destroys harmonic and EDM quality, dead end","timestamp":1774175456621,"segment":3,"confidence":5.707865168539275,"asi":{"hypothesis":"DC blocker removes PV sub-audio artifacts","rollback_reason":"897.9 vs 946.2, ruins low-frequency content","dead_end":"DC blocker in streaming output"}}
