{"run":175,"commit":"0aabcd8","metric":953.2,"metrics":{"percussive_score":924.9,"edm_score":962.3,"harmonic_score":982},"status":"discard","description":"IF 5x max — no improvement, percussive marginal regression","timestamp":1774190248750,"segment":3,"confidence":7.810810810810724,"asi":{"hypothesis":"5x max IF scale","rollback_reason":"identical overall, percussive slightly worse","confirmed_optimal":"4x max over 10 bins"}}
{"run":176,"commit":"0aabcd8","metric":953,"metrics":{"percussive_score":924.8,"edm_score":961.9,"harmonic_score":982},"status":"discard","description":"Ratio-adaptive gain power (0.52 at extreme) — marginal regression","timestamp":1774190432898,"segment":3,"confidence":7.810810810810784,"asi":{"hypothesis":"More aggressive gain (power 0.52) at extreme ratios","rollback_reason":"953.0 vs 953.2","confirmed_optimal":"sqrt (0.50) for all ratios"}}
{"run":177,"commit":"0aabcd8","metric":953.1,"metrics":{"percussive_score":924.7,"edm_score":962.3,"harmonic_score":982},"status":"discard","description":"Ratio-adaptive gradient start (8/10) — no improvement","timestamp":1774190536636,"segment":3,"confidence":7.810810810810844,"asi":{"hypothesis":"Wider gradient zone at extreme ratios (10 vs 8 bins)","rollback_reason":"953.1 vs 953.2","confirmed_optimal":"fixed 8 bins"}}
{"run":178,"commit":"0aabcd8","metric":952.2,"metrics":{"percussive_score":922.2,"edm_score":962.3,"harmonic_score":982},"status":"discard","description":"Transient upward expansion (15% boost for peaks >2x RMS) — hurts overall balance","timestamp":1774190793352,"segment":3,"confidence":7.9178082191781405,"asi":{"hypothesis":"Boost samples above 2x RMS by up to 15% to restore transient peaks","rollback_reason":"952.2 vs 953.2, percussive -2.8. Disrupts energy balance and batch similarity.","dead_end":"time-domain transient expansion"}}
{"run":179,"commit":"0aabcd8","metric":952.7,"metrics":{"percussive_score":924.1,"edm_score":961.7,"harmonic_score":982.1},"status":"discard","description":"Window floor ratio^1.5 + higher min 0.01 — slightly worse","timestamp":1774190991055,"segment":3,"confidence":7.917808219178018,"asi":{"hypothesis":"Gentler normalization floor at extreme ratios (ratio^1.5 instead of ratio^2, min 0.01)","rollback_reason":"952.7 vs 953.2","confirmed_optimal":"ratio^2 floor with 0.005 min"}}
{"run":180,"commit":"0aabcd8","metric":944.9,"metrics":{"percussive_score":915.8,"edm_score":949.6,"harmonic_score":981.3},"status":"discard","description":"Half-hop PV with fixed consumption — still worse, more overlap = more cancellation","timestamp":1774191246417,"segment":3,"confidence":7.810810810810784,"asi":{"hypothesis":"Use hop/2 for PV with properly matched ring buffer consumption","rollback_reason":"944.9 vs 953.2. Half-hop creates more synthesis frames with more phase cancellation, not less.","dead_end":"half-hop streaming PV (any configuration)","insight":"More overlap is NOT better for PV quality — it increases phase interference opportunities"}}
{"run":181,"commit":"0aabcd8","metric":931.7,"metrics":{"percussive_score":869.3,"edm_score":964.4,"harmonic_score":976.3},"status":"discard","description":"Dual EMA seeding (input + output) — first values don't correspond, percussive crashes","timestamp":1774191521822,"segment":3,"confidence":7.917808219178018,"asi":{"hypothesis":"Seed both input and output EMAs on first call to eliminate cold-start gain spike","rollback_reason":"931.7 vs 953.2. First input energy (full ring buffer) doesn't correspond to first output energy (PV output), so seeded ratio is wrong.","dead_end":"EMA seeding of any kind"}}
{"run":182,"commit":"0aabcd8","metric":953.2,"metrics":{"percussive_score":925,"edm_score":962.3,"harmonic_score":982},"status":"discard","description":"Transient sharpening (input blend at peaks) — zero effect, timing mismatch","timestamp":1774191808649,"segment":3,"confidence":7.758389261744928,"asi":{"hypothesis":"Blend 25% of resampled input at transient peak positions into PV output","rollback_reason":"zero effect — input/output timing doesn't align precisely enough, and spectral metrics aren't sensitive to individual sample modifications","dead_end":"sample-level transient blending"}}
{"run":183,"commit":"0aabcd8","metric":951.1,"metrics":{"percussive_score":923.9,"edm_score":957.7,"harmonic_score":982},"status":"discard","description":"Parabolic IF for near-peak bins — wrong estimates for non-peaks, EDM drops","timestamp":1774191929388,"segment":3,"confidence":7.706666666666676,"asi":{"hypothesis":"Apply parabolic interpolation to bins adjacent to peaks","rollback_reason":"951.1 vs 953.2, EDM -4.6. Parabolic fit assumes local maximum which is wrong for shoulder bins.","dead_end":"parabolic IF for non-peak bins"}}
{"run":184,"commit":"0aabcd8","metric":947.9,"metrics":{"percussive_score":925,"edm_score":960.1,"harmonic_score":963.8},"status":"discard","description":"Onset-triggered attack boost — harmonic falsely triggers (-18), onset detector too crude","timestamp":1774192120222,"segment":3,"confidence":7.972413793103458,"asi":{"hypothesis":"Detect onsets via peak/EMA ratio and boost PV output at onset positions","rollback_reason":"947.9 vs 953.2, harmonic -18.2 from false onset triggers","dead_end":"simple peak-based onset detection for streaming transient boost","insight":"Reliable onset detection requires spectral analysis (HFC/flux), not just energy peaks. Energy peaks trigger on harmonic modulation too."}}
{"run":185,"commit":"0aabcd8","metric":953.2,"metrics":{"percussive_score":925,"edm_score":962.3,"harmonic_score":982},"status":"discard","description":"Final verification — stable at 953.2 after 172 experiments. PV-only ceiling confirmed.","timestamp":1774192210814,"segment":3,"confidence":7.917808219178018,"asi":{"hypothesis":"Verify final state","rollback_reason":"verification only","final_score":953.2,"total_experiments":172,"journey":"490 → 953.2 (+463 points)","ceiling_reason":"Remaining 47 points are fundamental PV limitations: transient smearing (perc 2.0x) and sub-bass dominance (EDM centroid)"}}
{"run":186,"commit":"795279c","metric":953.5,"metrics":{"percussive_score":924.5,"edm_score":963.5,"harmonic_score":982},"status":"keep","description":"5% time-domain resample blend at ratio>1.5 — EDM +1.2, overall 953.5 (+0.3)","timestamp":1774192372445,"segment":3,"confidence":7.958904109588969,"asi":{"hypothesis":"Blend 5% linearly-resampled input into PV output at extreme ratios (>1.5). Resampling preserves transient shape and mid-frequency energy that PV loses.","improvement":"+0.3","edm_gain":"+1.2","percussive_loss":"-0.5","blend_amount":0.05,"ratio_threshold":0.5}}
{"run":187,"commit":"795279c","metric":951.7,"metrics":{"percussive_score":922.5,"edm_score":960.6,"harmonic_score":982},"status":"discard","description":"8% resample blend — too much aliasing, percussive and EDM drop","timestamp":1774192472581,"segment":3,"confidence":7.958904109588969,"asi":{"hypothesis":"Stronger blend (8%)","rollback_reason":"951.7 vs 953.5, aliasing from linear resampling hurts quality"}}
{"run":188,"commit":"3fe0e62","metric":953.8,"metrics":{"percussive_score":925.4,"edm_score":963.5,"harmonic_score":982},"status":"keep","description":"3% resample blend — percussive 925.4, overall 953.8 (+0.3)","timestamp":1774192573007,"segment":3,"confidence":8.000000000000046,"asi":{"hypothesis":"3% blend is sweet spot — less aliasing than 5% while preserving transient shape","improvement":"+0.3","blend_amount":0.03}}
{"run":189,"commit":"3fe0e62","metric":953.8,"metrics":{"percussive_score":925.6,"edm_score":963.2,"harmonic_score":982},"status":"discard","description":"2% blend — identical overall, percussive slightly better but EDM slightly worse","timestamp":1774192673053,"segment":3,"confidence":8.111111111111185,"asi":{"hypothesis":"2% blend","rollback_reason":"identical 953.8, 3% has better EDM","confirmed_optimal":"3% blend"}}
{"run":190,"commit":"3fe0e62","metric":952.5,"metrics":{"percussive_score":923.1,"edm_score":963.2,"harmonic_score":980.9},"status":"discard","description":"Blend threshold 0.3 — triggers on 1.5x cases, hurts harmonic/percussive","timestamp":1774192771265,"segment":3,"confidence":8.225352112676093,"asi":{"hypothesis":"Lower blend threshold to 0.3","rollback_reason":"952.5 vs 953.8, blend at 1.5x hurts quality","confirmed_optimal":"threshold 0.5"}}
{"run":191,"commit":"3fe0e62","metric":953.5,"metrics":{"percussive_score":924.5,"edm_score":963.5,"harmonic_score":982},"status":"discard","description":"Ratio-proportional blend (0-5%) — 5% at 2.0x too much, flat 3% better","timestamp":1774192873706,"segment":3,"confidence":8.225352112676028,"asi":{"hypothesis":"Scale blend linearly with ratio distance","rollback_reason":"953.5 vs 953.8, fixed 3% is better","confirmed_optimal":"fixed 3% blend at distance > 0.5"}}
{"run":192,"commit":"3fe0e62","metric":953.4,"metrics":{"percussive_score":924,"edm_score":963.4,"harmonic_score":982.3},"status":"discard","description":"Blend for all ratios (1-3%) — near-unity blend hurts, >0.5 threshold optimal","timestamp":1774192977675,"segment":3,"confidence":8.225352112676028,"asi":{"hypothesis":"Apply blend to all ratios with 1-3% scaling","rollback_reason":"953.4 vs 953.8, blending at near-unity adds aliasing without benefit","confirmed_optimal":"threshold 0.5, flat 3%"}}
{"run":193,"commit":"f14d81a","metric":953.8,"metrics":{"percussive_score":925.3,"edm_score":963.5,"harmonic_score":982},"status":"keep","description":"Cubic interpolation for resample blend — identical score but better interpolation quality","timestamp":1774193086285,"segment":3,"confidence":8.225352112676028,"asi":{"hypothesis":"Catmull-Rom cubic interpolation instead of linear for the resample blend","improvement":"0 (same score), but technically better interpolation quality","interpolation":"cubic"}}
{"run":194,"commit":"f14d81a","metric":952.6,"metrics":{"percussive_score":923,"edm_score":963.2,"harmonic_score":980.9},"status":"discard","description":"Blend threshold 0.4 — 1.5x blend hurts harmonic and percussive","timestamp":1774193241805,"segment":3,"confidence":8.167832167832191,"asi":{"hypothesis":"Lower threshold to 0.4 (activates at 1.5x)","rollback_reason":"952.6 vs 953.8, 1.5x doesn't benefit from resample blend","confirmed_optimal":"threshold 0.5 (only 2.0x)"}}
{"run":195,"commit":"797d936","metric":953.8,"metrics":{"percussive_score":925,"edm_score":963.7,"harmonic_score":982},"status":"keep","description":"4% resample blend — same overall 953.8 but better EDM (963.7 vs 963.5)","timestamp":1774193381722,"segment":3,"confidence":8.111111111111185,"asi":{"hypothesis":"4% blend slightly better balance than 3%","improvement":"0 overall, EDM +0.2","blend_amount":0.04}}
{"run":196,"commit":"797d936","metric":952.3,"metrics":{"percussive_score":922.2,"edm_score":962.7,"harmonic_score":981.9},"status":"discard","description":"Scaled blend (2-6% based on ratio) — too much at 2.0x, hurts at 1.5x","timestamp":1774193640685,"segment":3,"confidence":8.111111111111121,"asi":{"hypothesis":"Ratio-proportional blend starting at 0.45 distance, 2% to 6%","rollback_reason":"952.3 vs 953.8, blending at 1.5x and 6% at 2.0x both degrade","confirmed_optimal":"flat 4% at distance > 0.5 only"}}
{"run":197,"commit":"797d936","metric":945.6,"metrics":{"percussive_score":923.2,"edm_score":963.7,"harmonic_score":951.9},"status":"discard","description":"Ratio-adaptive sub-bass (120Hz at near-unity) — harmonic crashes -30","timestamp":1774193776027,"segment":3,"confidence":8.111111111111185,"asi":{"hypothesis":"Narrower sub-bass rigid region (120Hz) at near-unity ratios to reduce centroid shift","rollback_reason":"945.6 vs 953.8, harmonic -30 from phase incoherence in 120-180Hz region","dead_end":"ratio-adaptive sub-bass cutoff"}}
{"run":198,"commit":"797d936","metric":951.5,"metrics":{"percussive_score":921.6,"edm_score":963,"harmonic_score":979.2},"status":"discard","description":"Include 1.5x in resample blend (>= 0.5) — harmonic and percussive regress at 1.5x","timestamp":1774193883362,"segment":3,"confidence":8.111111111111057,"asi":{"hypothesis":"Include 1.5x ratio in resample blend","rollback_reason":"951.5 vs 953.8, 1.5x linear resampling too aliased","confirmed_optimal":"strict > 0.5 (only 2.0x)"}}
{"run":199,"commit":"797d936","metric":951.8,"metrics":{"percussive_score":922.1,"edm_score":961.4,"harmonic_score":982},"status":"discard","description":"Spectral flux-modulated gradient — reduces gradient for transients, hurts both EDM and percussive","timestamp":1774194147611,"segment":3,"confidence":8.225352112676028,"asi":{"hypothesis":"Compute per-frame spectral flux, reduce gradient blend for transient frames (high flux)","rollback_reason":"951.8 vs 953.8. Gradient is beneficial even for transient frames — it provides coherence that improves quality regardless of content type.","dead_end":"flux-modulated gradient","insight":"Phase gradient coherence helps ALL content types including transients. Reducing it never helps."}}
{"run":200,"commit":"797d936","metric":953.5,"metrics":{"percussive_score":925.3,"edm_score":962.8,"harmonic_score":982.1},"status":"discard","description":"Flux-boosted IF blend on transient frames — EDM drops from IF noise on kicks","timestamp":1774194300332,"segment":3,"confidence":8.225352112676159,"asi":{"hypothesis":"Increase IF blend on high-flux (transient) frames for better frequency tracking","rollback_reason":"953.5 vs 953.8, EDM -0.9 from extra IF noise on kick/hat frames","dead_end":"flux-adaptive IF blend","insight":"Spectral flux detects all spectral changes including desired ones (kicks, hats). Can't distinguish good from bad transients."}}
{"run":201,"commit":"797d936","metric":953.7,"metrics":{"percussive_score":925,"edm_score":963.6,"harmonic_score":982},"status":"discard","description":"Anti-aliased resample blend (LP at sr/2/ratio) — marginal regression, LP removes useful HF","timestamp":1774194472235,"segment":3,"confidence":8.225352112676159,"asi":{"hypothesis":"Add anti-aliasing LP filter to resampled signal before blending","rollback_reason":"953.7 vs 953.8, LP removes useful HF content. The unfiltered cubic resampling has slight aliasing but it adds beneficial spectral energy.","confirmed_optimal":"no anti-aliasing filter on the blend"}}
{"run":202,"commit":"44f20a7","metric":953.8,"metrics":{"percussive_score":925,"edm_score":963.7,"harmonic_score":982},"status":"keep","description":"Remove unused resample_scratch buffer — cleanup, same score","timestamp":1774194680756,"segment":3,"confidence":8.167832167832191,"asi":{"hypothesis":"Remove unused allocation","improvement":"0, code cleanup only"}}
{"run":203,"commit":"44f20a7","metric":953.7,"metrics":{"percussive_score":924.9,"edm_score":963.7,"harmonic_score":982},"status":"discard","description":"IF cap 0.15 — slightly worse, 0.20 confirmed","timestamp":1774194789638,"segment":3,"confidence":8.111111111111057,"asi":{"hypothesis":"Lower IF cap to 0.15","rollback_reason":"953.7 vs 953.8","confirmed_optimal":"IF cap 0.20"}}
{"run":204,"commit":"44f20a7","metric":940.9,"metrics":{"percussive_score":890.5,"edm_score":963.8,"harmonic_score":982},"status":"discard","description":"Sub-bass 200Hz re-test with distance-adaptive — still crushes percussive (-34)","timestamp":1774194978051,"segment":3,"confidence":8.167832167832191,"asi":{"hypothesis":"Re-test 200Hz sub-bass with distance-adaptive changes","rollback_reason":"940.9 vs 953.8, percussive -34. Distance-adaptive doesn't help — the 180-200Hz range needs IF not rigid locking.","confirmed_optimal":"180Hz sub-bass cutoff (definitive)"}}
{"run":205,"commit":"44f20a7","metric":949,"metrics":{"percussive_score":925.7,"edm_score":959.6,"harmonic_score":967.8},"status":"discard","description":"Gain pre-seeding 1.10 at non-unity — harmonic drops 14 from unwanted early shelf","timestamp":1774195155458,"segment":3,"confidence":8.34285714285714,"asi":{"hypothesis":"Pre-seed energy_gain to 1.10 at ratios>1.1 so shelf activates from first frame, fixing startup centroid","rollback_reason":"949 vs 953.8, harmonic -14.2. Pre-seeded gain applies unwanted shelf to harmonic content at 1.5x.","dead_end":"gain pre-seeding (any form)","insight":"Centroid measurement uses first 20 frames, but gain pre-seeding can't distinguish harmonic from EDM at the same ratio"}}
{"run":206,"commit":"44f20a7","metric":952.4,"metrics":{"percussive_score":923.7,"edm_score":961.7,"harmonic_score":981.4},"status":"discard","description":"3% sub-bass reduction at extreme ratios — energy loss outweighs centroid gain","timestamp":1774195306967,"segment":3,"confidence":8.283687943262395,"asi":{"hypothesis":"Gentle sub-bass cut (3% max below 150Hz) to raise centroid","rollback_reason":"952.4 vs 953.8. Energy metric (25% weight) hurts more than centroid (10% weight) benefits.","dead_end":"sub-bass reduction for centroid correction (any amount)","insight":"Energy-weighted metric makes centroid optimization via sub-bass cut always net-negative"}}
{"run":207,"commit":"44f20a7","metric":953.8,"metrics":{"percussive_score":925,"edm_score":963.7,"harmonic_score":982},"status":"discard","description":"Final baseline confirmation — 953.8 stable. 194 experiments complete. PV-only ceiling reached.","timestamp":1774195440320,"segment":3,"confidence":8.225352112676028,"asi":{"hypothesis":"baseline verification","rollback_reason":"verification only","final_score":953.8,"total_experiments":194,"improvement_from_start":"+464 points (490 → 953.8)","sessions":7,"ceiling_reason":"PV transient smearing (30% freq weight) and sub-bass dominance (centroid 10% < energy 25%) create mathematical ceiling"}}
{"run":208,"commit":"44f20a7","metric":952.1,"metrics":{"percussive_score":924.9,"edm_score":959.3,"harmonic_score":982},"status":"discard","description":"Resample blend before gain — output energy tracking skewed by blended input, gain under-corrects","timestamp":1774195710788,"segment":3,"confidence":8.342857142857072,"asi":{"hypothesis":"Move resample blend before energy tracking and gain, so gain applies to blended signal","rollback_reason":"952.1 vs 953.8. Blended input raises output_energy_ema, causing gain to under-compensate the PV portion.","confirmed_optimal":"blend AFTER gain+shelf"}}
{"run":209,"commit":"44f20a7","metric":947.7,"metrics":{"percussive_score":908.5,"edm_score":963.7,"harmonic_score":982.5},"status":"discard","description":"Warmup 7 calls — percussive overshoots, 5 confirmed optimal","timestamp":1774195857742,"segment":3,"confidence":8.463768115942054,"asi":{"hypothesis":"7-call warmup","rollback_reason":"947.7 vs 953.8, percussive -16.5","confirmed_optimal":"5 calls definitive"}}
{"run":210,"commit":"44f20a7","metric":949.1,"metrics":{"percussive_score":921.4,"edm_score":954.9,"harmonic_score":982},"status":"discard","description":"WSOLA 6% blend — temporal misalignment between WSOLA and PV output. WSOLA starts from buffer start, PV from current window.","timestamp":1774196159712,"segment":3,"confidence":8.651851851851848,"asi":{"hypothesis":"Run WSOLA on input buffer and blend 6% into PV output","rollback_reason":"949.1 vs 953.8. WSOLA output starts from ring buffer start, PV output corresponds to current processing window. Temporal misalignment creates spectral artifacts.","insight":"WSOLA streaming requires tracking the correspondence between input position and output position across calls, which is complex and stateful. Simple first-N-samples approach doesn't work.","next_action_hint":"Would need to skip WSOLA output to match PV's consumed input offset, like skip = consumed_total * ratio"}}
{"run":211,"commit":"44f20a7","metric":951.8,"metrics":{"percussive_score":924.2,"edm_score":959.3,"harmonic_score":982},"status":"discard","description":"WSOLA 3% blend — still hurts EDM (-4.4). WSOLA degrades tonal content, needs content-adaptive blending.","timestamp":1774196364126,"segment":3,"confidence":8.848484848484814,"asi":{"hypothesis":"3% WSOLA blend at extreme ratios (properly aligned from buffer start)","rollback_reason":"951.8 vs 953.8. WSOLA introduces spectral artifacts on tonal content (EDM's 300Hz lead, 60Hz bass). Uniform blend hurts tonal quality.","insight":"WSOLA helps transients but hurts tonal. Content-adaptive blending would be needed but is computationally expensive in RT path. The simple cubic resample blend at 4% is better because it preserves spectral content more faithfully than WSOLA segment stitching.","dead_end":"uniform WSOLA blend for streaming"}}
{"run":212,"commit":"44f20a7","metric":953.8,"metrics":{"percussive_score":925,"edm_score":963.7,"harmonic_score":982},"status":"discard","description":"Confirmed 953.8 with original resample blend after WSOLA revert. 199 experiments total.","timestamp":1774196463970,"segment":3,"confidence":8.848484848484967,"asi":{"hypothesis":"baseline verification after WSOLA experiments","rollback_reason":"verification only","total_experiments":199,"final_finding":"4% cubic resample blend outperforms WSOLA blend — simpler is better"}}
{"run":213,"commit":"44f20a7","metric":953.8,"metrics":{"percussive_score":925,"edm_score":963.7,"harmonic_score":982},"status":"discard","description":"Baseline verification — 953.8 confirmed stable, 200+ experiments complete","timestamp":1774196570462,"segment":3,"confidence":8.848484848484967,"asi":{"hypothesis":"verify baseline at session start"}}
