{"type":"config","name":"Streaming engine audio quality (Keylock profile)","metricName":"quality","metricUnit":"","bestDirection":"higher"}
{"run":1,"commit":"2f8b595","metric":81.871,"metrics":{"spec_sim":0.9814,"transient_f1":0.6074,"pitch_p95_cents":0.43,"pitch_max_cents":0.53,"identity_corr":0.5049,"clicks_per_m":0,"underruns":0,"realtime_x":89.7},"status":"keep","description":"Baseline: streaming Keylock engine quality benchmark (real music 40s slow/fast/identity/ride + sine ride). quality=81.87","timestamp":1785757781064,"segment":0,"confidence":null,"asi":{"hypothesis":"baseline","biggest_levers":"transient_f1 fast render 0.489 (smearing on speedup); identity_corr 0.505 at rate 1.0 (keylock chain not transparent)","determinism":"benchmark fully deterministic, noise floor ~0","pitch":"already excellent (0.43c p95)"}}
{"run":2,"commit":"740415f","metric":95.339,"metrics":{"spec_sim":0.957,"transient_f1":0.9188,"pitch_p95_cents":0.43,"pitch_max_cents":0.53,"identity_corr":0.9909,"clicks_per_m":0,"underruns":0,"realtime_x":85.1},"status":"keep","description":"Harness calibration (not a DSP change): compensate reported pipeline latency in transient F1, phase-blind identity metric (LR8 allpass), add hard ±14-16% ratios. New effective baseline 95.34.","timestamp":1785758012946,"segment":0,"confidence":null,"asi":{"hypothesis":"harness had latency bias + phase-sensitive identity metric","finding":"transient_f1 0.61->0.92 purely from latency compensation; identity xcorr 0.50 was allpass phase, spectral sim is 0.991","new_baseline":95.339,"levers":"spec_sim slow2 (-16%) = 0.916 worst; transient_f1 ~0.92 all rates"}}
{"run":3,"commit":"adea1bb","metric":95.405,"metrics":{"spec_sim":0.957,"transient_f1":0.921,"pitch_p95_cents":0.43,"pitch_max_cents":0.53,"identity_corr":0.9909,"clicks_per_m":0,"underruns":0,"realtime_x":85.2},"status":"keep","description":"SOLA TRANSIENT_POSTPONE_RATIO 3.0→1.8: postpone splices near weaker energy bursts. transient_f1 0.9188→0.9210, tiny but real (deterministic bench).","timestamp":1785758211012,"segment":0,"confidence":205.0606060605984,"asi":{"hypothesis":"more conservative online transient postpone protects more attacks","result":"+0.066 quality via transient_f1 +0.0022; small because postpone only delays, doesn't relocate splices","next":"try shorter/longer XFADE, DRIFT_TRIGGER, or outgoing-span energy check"}}
{"run":4,"commit":"adea1bb","metric":94.762,"metrics":{"spec_sim":0.9556,"transient_f1":0.9187,"pitch_p95_cents":0.71,"pitch_max_cents":1.13,"identity_corr":0.9909,"clicks_per_m":0,"underruns":0,"realtime_x":58.2},"status":"discard","description":"DRIFT_TRIGGER 192→128 + HARD 320→256: more frequent smaller splices. Worse everywhere: spec −0.0014, transient −0.0023, pitch p95 0.43→0.71c.","timestamp":1785758323021,"segment":0,"confidence":42.096423017107284,"asi":{"hypothesis":"smaller more frequent splices reduce per-splice damage","rollback_reason":"quality 95.41→94.76; more splices = more fades = more pitch wobble and more attack smears","next_action_hint":"try the opposite: LARGER drift trigger (fewer splices), e.g. 256/384"}}
{"run":5,"commit":"adea1bb","metric":94.634,"metrics":{"spec_sim":0.9575,"transient_f1":0.9024,"pitch_p95_cents":0.55,"pitch_max_cents":1.1,"identity_corr":0.9909,"clicks_per_m":0,"underruns":0,"realtime_x":85.6},"status":"discard","description":"DRIFT_TRIGGER 192→256 + HARD 320→448: fewer larger splices. Also worse: transient_f1 0.921→0.902, pitch 0.43→0.55c. 192/320 is a local optimum.","timestamp":1785758827944,"segment":0,"confidence":23.455805892547744,"asi":{"hypothesis":"fewer larger splices = less total fade damage","rollback_reason":"quality 95.41→94.63; larger jumps skip/repeat more audio per splice, hurting transients (0.921→0.902)","learning":"DRIFT/HARD trigger 192/320 is locally optimal in both directions; stop tuning it","next_action_hint":"focus on splice PLACEMENT (online onset detection feeding OnsetEvents) instead of splice frequency"}}
{"run":6,"commit":"adea1bb","metric":95.07,"metrics":{"spec_sim":0.9568,"transient_f1":0.91,"pitch_p95_cents":0.43,"pitch_max_cents":0.53,"identity_corr":0.9909,"clicks_per_m":0,"underruns":0,"realtime_x":78.3},"status":"discard","description":"Online onset detection at SOLA ingest (RMS jump 2.5x, refractory 46ms) feeding both splice protection and masked-window placement. transient_f1 0.921→0.910 — worse.","timestamp":1785759031100,"segment":0,"confidence":38.39432624113486,"asi":{"hypothesis":"online attack detection at ingest (~13ms lookahead) protects transients from splice fades","rollback_reason":"quality 95.41→95.07, transient_f1 0.921→0.910","suspect":"masked-window opportunistic splices now fire 17-46ms AFTER each detected kick — inside the kick body/decay — smearing it; or postponed splices get forced at HARD_TRIGGER in worse spots","next_action_hint":"retry with online onsets used for span PROTECTION only (not masked-window placement)"}}
{"run":7,"commit":"adea1bb","metric":95.216,"metrics":{"spec_sim":0.9566,"transient_f1":0.9152,"pitch_p95_cents":0.43,"pitch_max_cents":0.53,"identity_corr":0.9909,"clicks_per_m":0,"underruns":0,"realtime_x":83.7},"status":"discard","description":"Online onset detection, protection-only variant (no masked-window use). Still worse than baseline: transient_f1 0.921→0.915.","timestamp":1785759181409,"segment":0,"confidence":43.9415584415595,"asi":{"hypothesis":"online onsets for fade-span protection only","rollback_reason":"quality 95.41→95.22; transient_f1 still down 0.921→0.915","learning":"onset protection postpones splices past DRIFT_TRIGGER; the forced splices at HARD_TRIGGER are then LARGER jumps, which experiment #4/#5 showed hurt more than fade-through-transient does. The existing energy-postpone (1.8x) already covers the useful cases","next_action_hint":"stop onset-protection direction; attack transient smearing differently — e.g. splice landing refinement, or XFADE shape/length"}}
{"run":8,"commit":"17eb83e","metric":95.578,"metrics":{"spec_sim":0.957,"transient_f1":0.9278,"pitch_p95_cents":0.45,"pitch_max_cents":0.69,"identity_corr":0.9909,"clicks_per_m":0,"underruns":0,"realtime_x":85.1},"status":"keep","description":"XFADE_FRAMES 96→64 (~1.45ms splice fades): transient_f1 0.921→0.928, quality 95.41→95.58. Pitch max 0.53→0.69c (still tiny vs 22c gate).","timestamp":1785759288340,"segment":0,"confidence":42.63452566096421,"asi":{"hypothesis":"shorter fades smear less audio per splice","result":"+0.17 quality; transient_f1 +0.007, spec unchanged, pitch max slightly up (0.53→0.69c, harmless)","next":"try 48 to find the knee; watch clicks_per_m and pitch"}}
{"run":9,"commit":"17eb83e","metric":95.13,"metrics":{"spec_sim":0.9571,"transient_f1":0.9128,"pitch_p95_cents":0.45,"pitch_max_cents":0.69,"identity_corr":0.9909,"clicks_per_m":0,"underruns":0,"realtime_x":85.1},"status":"discard","description":"XFADE_FRAMES 64→48: too short. transient_f1 0.928→0.913. 64 is the knee.","timestamp":1785759395408,"segment":0,"confidence":49.84363636363536,"asi":{"hypothesis":"even shorter fades = even less smear","rollback_reason":"quality 95.58→95.13; 48-frame fades cause spectral splatter that reads as onset timing damage","learning":"XFADE knee is at 64; keep 64","next_action_hint":"different lever: splice correlation window / search shape, or spec_sim at hard ratios"}}
{"run":10,"commit":"17eb83e","metric":95.097,"metrics":{"spec_sim":0.9571,"transient_f1":0.9117,"pitch_p95_cents":0.45,"pitch_max_cents":0.69,"identity_corr":0.9909,"clicks_per_m":0,"underruns":0,"realtime_x":80.8},"status":"discard","description":"TRANSIENT_POSTPONE_RATIO 1.8→1.4: too aggressive, postponed splices get forced bigger. transient_f1 0.928→0.912.","timestamp":1785759502710,"segment":0,"confidence":53.025145067695796,"asi":{"hypothesis":"postpone even more splices near bursts","rollback_reason":"quality 95.58→95.10; over-postponement forces bigger jumps later (same failure mode as onset protection)","learning":"postpone ratio sweet spot is ~1.8; the postpone-vs-forced-jump tradeoff is sharp","next_action_hint":"try SEARCH_RANGE or CORR_WINDOW enlargement for better splice landings"}}
{"run":11,"commit":"17eb83e","metric":95.266,"metrics":{"spec_sim":0.9552,"transient_f1":0.9192,"pitch_p95_cents":0.45,"pitch_max_cents":0.69,"identity_corr":0.9909,"clicks_per_m":0,"underruns":0,"realtime_x":49.8},"status":"discard","description":"SEARCH_RANGE 160→224: worse (spec 0.957→0.955, transient 0.928→0.919) and slower (85x→50x). Wider search parks drift further off nominal.","timestamp":1785759622336,"segment":0,"confidence":65.5837320574153,"asi":{"hypothesis":"wider search finds better-correlated landings","rollback_reason":"quality 95.58→95.27; distant candidates win ties and park drift off-nominal, and cost 40% throughput","learning":"SEARCH_RANGE 160 is right; splice params are all near a local optimum. Parameter tuning on SOLA is exhausted","next_action_hint":"structural: improve varispeed resampler quality, or attach artifact path as an additional benchmark scenario, or low-band handling at hard ratios"}}
{"run":12,"commit":"e40c19b","metric":96.134,"metrics":{"spec_sim":0.957,"transient_f1":0.9463,"pitch_p95_cents":0.45,"pitch_max_cents":0.69,"identity_corr":0.9909,"clicks_per_m":0,"underruns":0,"realtime_x":86},"status":"keep","description":"Harness sensitivity fix: transient detection hop 512→256 (measured ceiling was F1≈0.93 from quantization; now ≈0.99). New effective baseline 96.13. Real F1 headroom now visible: slow2 0.939 / fast2 0.934.","timestamp":1785759829002,"segment":0,"confidence":71.67336683417157,"asi":{"hypothesis":"transient_f1 was at detector-quantization ceiling","finding":"hop 512 self-shift F1=0.92-0.94; hop 256 = 0.98-1.0. Previous SOLA tuning partly fit quantization noise (XFADE 64 keep may need re-validation)","new_baseline":96.134,"levers":"transient_f1 at hard ratios (0.934-0.939), spec_sim slow2 0.916 (low band by design)"}}
{"run":13,"commit":"04bb097","metric":96.262,"metrics":{"spec_sim":0.957,"transient_f1":0.9496,"pitch_p95_cents":0.43,"pitch_max_cents":0.53,"identity_corr":0.9909,"clicks_per_m":0,"underruns":0,"realtime_x":85},"status":"keep","description":"Revert XFADE_FRAMES 64→96: the earlier 64-keep was fitting detector quantization noise. Under fixed metric 96 wins (96.26 vs 96.13), pitch back to 0.43/0.53c.","timestamp":1785759947215,"segment":0,"confidence":76.14285714285428,"asi":{"hypothesis":"XFADE 64 keep was noise-fit; re-test under hop-256 metric","finding":"96-frame fades better: transient_f1 0.9463→0.9496 AND pitch 0.45/0.69→0.43/0.53. Lesson: never trust sub-ceiling metric wins","learning":"all SOLA params now re-anchored at original values except TRANSIENT_POSTPONE_RATIO=1.8 (kept from #3, small)"}}
{"run":14,"commit":"04bb097","metric":96.059,"metrics":{"spec_sim":0.957,"transient_f1":0.9428,"pitch_p95_cents":0.43,"pitch_max_cents":0.53,"identity_corr":0.9909,"clicks_per_m":0,"underruns":0,"realtime_x":85.1},"status":"discard","description":"Re-validate TRANSIENT_POSTPONE_RATIO 3.0 vs kept 1.8: 1.8 confirmed better under fixed metric (96.26 vs 96.06, transient 0.9496 vs 0.9428). Keeping 1.8.","timestamp":1785760054661,"segment":0,"confidence":56.657480314959564,"asi":{"hypothesis":"check whether postpone 1.8 keep was also noise-fit","rollback_reason":"3.0 is worse; 1.8 is genuinely better (+0.007 F1)","learning":"postpone 1.8 validated under trustworthy metric; SOLA params final: DRIFT 192/320, XFADE 96, SEARCH 160, postpone 1.8"}}
{"run":15,"commit":"04bb097","metric":96.012,"metrics":{"spec_sim":0.9569,"transient_f1":0.9429,"pitch_p95_cents":0.46,"pitch_max_cents":0.53,"identity_corr":0.9909,"clicks_per_m":0,"underruns":0,"realtime_x":85.2},"status":"discard","description":"Splice distance penalty 0.02→0.05: worse (F1 0.9496→0.9429). Correlation quality matters more than drift centering.","timestamp":1785760329280,"segment":0,"confidence":46.12500000000037,"asi":{"hypothesis":"stronger pull toward nominal reduces drift timing skew","rollback_reason":"96.26→96.01; worse-correlated landings hurt more than centered drift helps","next_action_hint":"try CORR_WINDOW 448, then move to structural ideas"}}
{"run":16,"commit":"04bb097","metric":94.338,"metrics":{"spec_sim":0.9537,"transient_f1":0.9511,"pitch_p95_cents":1.46,"pitch_max_cents":2.78,"identity_corr":0.9909,"clicks_per_m":0,"underruns":0,"realtime_x":84.2},"status":"checks_failed","description":"CORR_WINDOW 320→448: F1 up (0.9511) but spec down, pitch p95 0.43→1.46c, and seam-recovery test fails (−6.69 dB parked drift de-phasing). Worse overall anyway.","timestamp":1785760425823,"segment":0,"confidence":35.27205882352931,"asi":{"hypothesis":"longer corr window aligns low-mid content better at splices","rollback_reason":"seam_level_recovers_after_a_nudge fails (-6.69dB); quality 94.34 anyway (spec/pitch degrade)","learning":"CORR_WINDOW interacts with rest-recentering: longer window biases splice landings and parks drift that de-phases the crossover seam. 320 is load-bearing","next_action_hint":"SOLA micro-tuning fully exhausted; go structural (low-band at hard ratios, or varispeed resampler)"}}
{"run":17,"commit":"7e51414","metric":96.387,"metrics":{"spec_sim":0.9569,"transient_f1":0.9538,"pitch_p95_cents":0.43,"pitch_max_cents":0.53,"identity_corr":0.9909,"clicks_per_m":0,"underruns":0,"realtime_x":81.5},"status":"keep","description":"Quiet-gap opportunistic splicing (drift>96 + both spans <0.6x avg energy → splice early): quality 96.26→96.39, transient_f1 0.9496→0.9538, pitch unchanged.","timestamp":1785760578115,"segment":0,"confidence":28.801587301587034,"asi":{"hypothesis":"splice early in quiet gaps so fewer splices are forced near attacks","result":"+0.13 quality via F1 +0.004; first structural win. Placement > protection confirmed","next":"tune QUIET_SPLICE_RATIO (0.5? 0.75?) and/or lower the quiet-splice drift threshold"}}
{"run":18,"commit":"7e51414","metric":95.961,"metrics":{"spec_sim":0.9568,"transient_f1":0.9397,"pitch_p95_cents":0.43,"pitch_max_cents":0.53,"identity_corr":0.9909,"clicks_per_m":0,"underruns":0,"realtime_x":76.6},"status":"discard","description":"QUIET_SPLICE_RATIO 0.6→0.75: too permissive, splices in medium-energy audio. F1 0.9538→0.9397.","timestamp":1785760686116,"segment":0,"confidence":24.213511259382866,"asi":{"hypothesis":"more quiet-gap splices = fewer forced ones","rollback_reason":"96.39→95.96; 0.75x avg is not actually quiet in dense EDM","next_action_hint":"try 0.45–0.5 (stricter)"}}
{"run":19,"commit":"7e51414","metric":96,"metrics":{"spec_sim":0.957,"transient_f1":0.9409,"pitch_p95_cents":0.43,"pitch_max_cents":0.53,"identity_corr":0.9909,"clicks_per_m":0,"underruns":0,"realtime_x":80.4},"status":"discard","description":"QUIET_SPLICE_RATIO 0.6→0.5: also worse (F1 0.9538→0.9409). 0.6 is the sweet spot.","timestamp":1785760795684,"segment":0,"confidence":23.337620578778147,"asi":{"hypothesis":"stricter quiet gate","rollback_reason":"96.39→96.00; non-monotone response — 0.5 misses useful gaps AND changes which splices happen (chaotic re-timing)","learning":"QUIET_SPLICE_RATIO=0.6 locally optimal; note metric responds chaotically to splice-timing changes (±0.01 F1), treat small deltas skeptically","next_action_hint":"lower OPPORTUNISTIC_DRIFT for quiet splicing (e.g. 64) so corrections are even smaller, or move on to identity/spec levers"}}
{"run":20,"commit":"e340f68","metric":95.057,"metrics":{"spec_sim":0.9587,"transient_f1":0.9077,"pitch_p95_cents":0.43,"pitch_max_cents":0.53,"identity_corr":0.9909,"clicks_per_m":0,"underruns":0,"realtime_x":81.2},"status":"keep","description":"Harness: add 2nd scored track (Hot Stuff, disco-house 120bpm) — overfit guard. New effective baseline 95.06; track B transient_f1 is much worse (0.82-0.91), real headroom found.","timestamp":1785760978817,"segment":0,"confidence":24.213511259382866,"asi":{"hypothesis":"single-track score risks overfitting to splice timing","finding":"Hot Stuff F1: slow 0.906 fast 0.861 slow2 0.861 fast2 0.819 — far worse than track A; speedups worst. Spec similar between tracks","new_baseline":95.057,"levers":"track B transient_f1 fast2=0.819 is the biggest target now"}}
{"run":21,"commit":"cf3b204","metric":95.077,"metrics":{"spec_sim":0.9587,"transient_f1":0.9084,"pitch_p95_cents":0.43,"pitch_max_cents":0.53,"identity_corr":0.9909,"clicks_per_m":0,"underruns":0,"realtime_x":79.6},"status":"keep","description":"Revert TRANSIENT_POSTPONE_RATIO 1.8→3.0 (original): on the 2-track metric 3.0 is slightly better (95.08 vs 95.06). The 1.8 keep was track-A overfit.","timestamp":1785761102860,"segment":0,"confidence":28.801587301587034,"asi":{"hypothesis":"re-validate 1.8 postpone on 2-track metric","finding":"1.8 was track-A overfit; 3.0 marginally better overall and is the original value. Also need to re-validate quiet-gap splicing (kept on 1-track metric)","learning":"every single-track-tuned param must be re-checked; deltas <0.1 quality are suspect"}}
{"run":22,"commit":"cf3b204","metric":94.671,"metrics":{"spec_sim":0.9588,"transient_f1":0.8948,"pitch_p95_cents":0.43,"pitch_max_cents":0.53,"identity_corr":0.9909,"clicks_per_m":0,"underruns":0,"realtime_x":82.6},"status":"discard","description":"Ablation: remove quiet-gap splicing → 95.08→94.67, F1 0.9084→0.8948. Confirms quiet-gap placement is a real cross-track win. Restored.","timestamp":1785761151717,"segment":0,"confidence":27.675881792183244,"asi":{"hypothesis":"ablate quiet-gap splicing to validate on 2-track metric","finding":"quiet-gap is worth +0.41 quality / +0.014 F1 across both tracks — the one validated DSP win so far","next_action_hint":"investigate track B specifics: why is fast2 F1 0.819? maybe drift timing skew on sparser material; try lowering quiet-gap drift threshold 96→64"}}
{"run":23,"commit":"cf3b204","metric":94.786,"metrics":{"spec_sim":0.9587,"transient_f1":0.8987,"pitch_p95_cents":0.43,"pitch_max_cents":0.53,"identity_corr":0.9909,"clicks_per_m":0,"underruns":0,"realtime_x":75.7},"status":"discard","description":"Quiet-gap drift threshold 96→64: worse (F1 0.908→0.899). More small splices ≠ better; 96 stands.","timestamp":1785761268620,"segment":0,"confidence":31.973568281938793,"asi":{"hypothesis":"correct drift even earlier in quiet gaps","rollback_reason":"95.08→94.79; every extra splice costs, even in quiet audio (sinc-read phase scramble at each fade)","learning":"splice count minimization matters as much as placement; drift threshold 96 confirmed","next_action_hint":"study track B failure mode directly: dump splice positions vs missed onsets, or check if B's segment has quieter/sparser gaps"}}
{"run":24,"commit":"cf3b204","metric":94.884,"metrics":{"spec_sim":0.9586,"transient_f1":0.9021,"pitch_p95_cents":0.43,"pitch_max_cents":0.53,"identity_corr":0.9909,"clicks_per_m":0,"underruns":0,"realtime_x":81.3},"status":"discard","description":"Skip-span attack protection for forward splices (both variants: postpone-only and forced-cap): identical 94.88, worse than 95.08. Fast-render F1 dropped despite protecting exactly the hypothesized deletion mechanism.","timestamp":1785762192613,"segment":0,"confidence":35.57843137254893,"asi":{"hypothesis":"forward splices delete attacks in the skipped span; cap jumps before bursts","rollback_reason":"94.88 vs 95.08; A-slow renders improved but both fast renders worsened","learning":"revised failure theory: missing onsets at speedup are regularly spaced (every 2 beats = snare/clap class) — likely NOT individual deletions but the output ODF noise floor rising from dense splice flux (~every 38ms at +13%), drowning the 2nd-loudest onset class in median+MAD thresholding. Protection can't fix that; need fewer/cleaner splices at fast rates","next_action_hint":"re-test DRIFT 256/HARD 384 on the 2-track metric (prev test was track-A only); or improve splice correlation quality at small transpositions"}}
{"run":25,"commit":"cf3b204","metric":95.025,"metrics":{"spec_sim":0.9588,"transient_f1":0.9066,"pitch_p95_cents":0.43,"pitch_max_cents":0.53,"identity_corr":0.9909,"clicks_per_m":0,"underruns":0,"realtime_x":80.2},"status":"checks_failed","description":"XFADE 96→128 on 2-track metric: worse (95.03 vs 95.08) and checks timed out (suspect a sola test degenerates with long fades). 96 confirmed again.","timestamp":1785762921097,"segment":0,"confidence":39.445652173913594,"asi":{"hypothesis":"longer fades reduce per-splice flux","rollback_reason":"95.03 < 95.08; more fade time = more dual-pitch overlap","learning":"XFADE tested 48/64/96/128 across metrics: 96 optimal. transient_f1 asymptote ~0.91 is aggregate splice-flux noise (attacks verified present with equal contrast); reducing splice count/damage at |T-1|>10% is the only remaining F1 lever and all cheap knobs are exhausted","next_action_hint":"consider architectural: dual-window SOLA (long fades in steady content, short near attacks), or accept F1 and work the pitch score (0.43c → <0.2c) or identity (0.9909)"}}
{"run":26,"commit":"acb6183","metric":95.038,"metrics":{"spec_sim":0.9587,"transient_f1":0.9071,"pitch_p95_cents":0.43,"pitch_max_cents":0.53,"identity_corr":0.9909,"clicks_per_m":0,"underruns":0,"realtime_x":79.8},"status":"discard","description":"Adaptive fade (48 frames when either region hot ≥1.5x avg): 95.04 < 95.08. Short fades near hits splatter more than they localize.","timestamp":1785764230462,"segment":0,"confidence":42.756995581739524,"asi":{"hypothesis":"shorter fades near energetic regions localize splice damage","rollback_reason":"95.04 < 95.08, F1 0.9084→0.9071","learning":"fade-length adaptation in either direction fails; the fade itself is not the damage — the JUMP (phase discontinuity across all non-matched frequencies) is","next_action_hint":"pitch lever: chase p95 0.43c→0.2c? or investigate ride pitch wobble sources; or call SOLA done and examine the varispeed/crossover for identity gains"}}
