{"run":27,"commit":"37142bb","metric":95.036,"metrics":{"spec_sim":0.9587,"transient_f1":0.907,"pitch_p95_cents":0.43,"pitch_max_cents":0.53,"identity_corr":0.9909,"clicks_per_m":0,"underruns":0,"realtime_x":78.4},"status":"discard","description":"FINE_SEARCH_STEPS 4→8: pitch unchanged (0.43c), F1 slightly worse (chaos). Sub-sample refinement already converged; parabolic vertex does the work.","timestamp":1785764453766,"segment":0,"confidence":46.67524115755736,"asi":{"hypothesis":"finer fractional splice grid reduces residual pitch wobble","rollback_reason":"pitch identical, quality 95.04<95.08 via F1 chaos","learning":"p95=0.43c is not limited by splice sub-sample error; it is the fades themselves + estimation windows straddling them. Pitch polish exhausted at this architecture","next_action_hint":"state of play: all micro-levers exhausted; remaining scored losses are architectural (low band by design, splice flux inherent to time-domain correction). Consider widening the benchmark (ride scoring) or declaring plateau"}}
{"run":28,"commit":"37142bb","metric":95.054,"metrics":{"spec_sim":0.9587,"transient_f1":0.9076,"pitch_p95_cents":0.43,"pitch_max_cents":0.53,"identity_corr":0.9909,"clicks_per_m":0,"underruns":0,"realtime_x":81.7},"status":"discard","description":"Correlation-adaptive fade power normalization: 95.05 vs 95.08 — no win. Splice correlations are evidently high enough that the −3 dB dip rarely occurs.","timestamp":1785764630895,"segment":0,"confidence":46.9014539579968,"asi":{"hypothesis":"unity-power fade normalization removes mid-fade level dips on low-corr splices","rollback_reason":"−0.02 vs best; correlation-matched search keeps ρ high so the dip is rare; residual delta is splice-timing chaos","learning":"fade LAW is not the bottleneck either. SOLA is at its architectural quality ceiling on every axis measured","next_action_hint":"declare SOLA plateau; final options: benchmark ride scoring, or verify plateau and write summary"}}
{"run":29,"commit":"37142bb","metric":95.078,"metrics":{"spec_sim":0.9587,"transient_f1":0.9083,"pitch_p95_cents":0.43,"pitch_max_cents":0.53,"identity_corr":0.9909,"clicks_per_m":0,"underruns":0,"realtime_x":82.8},"status":"discard","description":"STREAM_SINC_CUTOFF_SCALE 0.85→0.90: within a hair of best (95.078 vs 95.077), no measurable spec gain. Keep original design value (safer stopband).","timestamp":1785764782816,"segment":0,"confidence":49.71232876712303,"asi":{"hypothesis":"less conservative AA cutoff keeps top octave at speedups","rollback_reason":"identical metric (+0.001 = tie); mean-spectrum sim insensitive to >16kHz on this material; original 0.85 has safer stopband — simpler/safer wins on a tie","learning":"varispeed AA is not a scored bottleneck"}}
{"run":30,"commit":"64e5aab","metric":94.912,"metrics":{"spec_sim":0.9587,"transient_f1":0.9028,"pitch_p95_cents":0.43,"pitch_max_cents":0.53,"identity_corr":0.9909,"clicks_per_m":0,"underruns":0,"realtime_x":81.8},"status":"discard","description":"Preemptive pre-attack splicing (detect at write head, splice while attack is still 13ms from playing): 94.91 < 95.08. F1 0.9084→0.9028.","timestamp":1785764986996,"segment":0,"confidence":52.49909584086827,"asi":{"hypothesis":"clear drift right before each attack arrives so no splice is owed near it","rollback_reason":"94.91 < 95.08; extra splices (one per detected attack, ~2/s) cost more than their placement saves — same lesson as quiet-drift-64: minimize splice COUNT","learning":"every scheme that ADDS splices loses; every scheme that DELAYS splices loses; only the quiet-gap scheme (which RELOCATES with no count change) won. SOLA verdict final","next_action_hint":"SOLA is done. Widen benchmark (ride scoring / third track) or examine non-SOLA stages for real bugs"}}
{"run":31,"commit":"64e5aab","metric":94.979,"metrics":{"spec_sim":0.9589,"transient_f1":0.9005,"pitch_p95_cents":0.36,"pitch_max_cents":0.57,"identity_corr":0.9909,"clicks_per_m":0,"underruns":0,"realtime_x":83.9},"status":"discard","description":"Splice overshoot +96 (fewer, bigger jumps): 94.98 < 95.08. Pitch improved (0.36c p95!) but F1 0.9084→0.9005 — per-splice damage grows superlinearly with jump size.","timestamp":1785765165501,"segment":0,"confidence":55.40458015267168,"asi":{"hypothesis":"overshoot jumps trade fewer splices for bigger ones","rollback_reason":"94.98 < 95.08; F1 loss from bigger jumps exceeds cadence gain (jump-size damage superlinear); interesting: pitch p95 improved 0.43→0.36 from fewer fades","learning":"splice size/count tradeoff curve fully mapped: 192-frame jumps at natural cadence is the optimum. SOLA definitively closed","next_action_hint":"benchmark widening or non-SOLA exploration"}}
{"run":32,"commit":"60bbb28","metric":95.126,"metrics":{"spec_sim":0.96,"transient_f1":0.9083,"pitch_p95_cents":0.41,"pitch_max_cents":0.51,"identity_corr":0.9885,"clicks_per_m":0,"underruns":0,"realtime_x":81.8},"status":"keep","description":"KEYLOCK_CROSSOVER_HZ 150→120: quality 95.08→95.13. More band corrected (120-150Hz), spec 0.9587→0.9600, pitch 0.43→0.41c, identity −0.002 (more LR8 group delay). Seam test passes.","timestamp":1785765341338,"segment":0,"confidence":63.80659340659367,"asi":{"hypothesis":"lower crossover corrects more of the bass line","result":"+0.05 net; spec gain systematic (less pitch-following content), F1 unaffected despite CORR_WINDOW < period at 120Hz band bottom","caveat":"fights the corpus-settled 150Hz tuning; owner should listening-check bass at tempo gestures before shipping","next":"probe 100Hz for trend"}}
{"run":33,"commit":"2017e77","metric":94.844,"metrics":{"spec_sim":0.9603,"transient_f1":0.8991,"pitch_p95_cents":0.41,"pitch_max_cents":0.53,"identity_corr":0.9868,"clicks_per_m":0,"underruns":0,"realtime_x":80.8},"status":"discard","description":"Crossover 120→100 Hz: worse (94.84). F1 drops 0.9083→0.8991 — splices now chop 100-120Hz periods (441 frames >> CORR_WINDOW). 120 Hz is the sweet spot.","timestamp":1785765522470,"segment":0,"confidence":62.300429184548285,"asi":{"hypothesis":"continue crossover trend below 120","rollback_reason":"spec kept rising (0.9603) but F1 broke (0.899) — corr window can't align 100-120Hz periods; identity also down (group delay)","learning":"crossover optimum ~120Hz given CORR_WINDOW=320; going lower requires longer corr window which broke the seam test earlier. 120 final","next_action_hint":"note 1Password gpg signing intermittently fails — verify every keep commit landed"}}
{"run":34,"commit":"2017e77","metric":95.001,"metrics":{"spec_sim":0.9595,"transient_f1":0.9048,"pitch_p95_cents":0.42,"pitch_max_cents":0.52,"identity_corr":0.9897,"clicks_per_m":0,"underruns":0,"realtime_x":82.1},"status":"discard","description":"Crossover 135 Hz: 95.00 — non-monotone dip between 120 (95.13) and 150 (95.08). 120 confirmed best; curve is noisy at ±0.1 scale but 120's spec gain is systematic.","timestamp":1785765678254,"segment":0,"confidence":68.79620853080388,"asi":{"hypothesis":"map crossover response curve","rollback_reason":"135 sits in a dip; F1 chaos dominates ±0.005 while spec trend is smooth (0.9587@150, 0.9595@135, 0.9600@120, 0.9603@100)","learning":"spec rises smoothly as crossover falls; F1 collapses below ~110 (corr window). 120 balances","next_action_hint":"keep 120; consider CORR_WINDOW+crossover joint move later if seam test can be satisfied"}}
{"run":35,"commit":"2017e77","metric":94.813,"metrics":{"spec_sim":0.96,"transient_f1":0.9046,"pitch_p95_cents":0.51,"pitch_max_cents":0.97,"identity_corr":0.9876,"clicks_per_m":0,"underruns":0,"realtime_x":80},"status":"checks_failed","description":"Crossover 110 + CORR_WINDOW 384: 94.81 (worse) and pitch-drift regression test fails (220Hz→216.5Hz at ratio 1.25). Longer corr window biases landings into real pitch error. Direction closed.","timestamp":1785765823347,"segment":0,"confidence":64.2300884955755,"asi":{"hypothesis":"longer corr window unlocks lower crossover","rollback_reason":"quality worse AND real pitch drift (27 cents flat at ratio 1.25 on a 220Hz sine — the corr window biases splices onto the wrong period grid)","learning":"CORR_WINDOW is hard-constrained by pitch accuracy, not just the seam test; crossover 120 + CORR 320 is the final operating point","next_action_hint":"crossover/SOLA fully closed; whole engine parameter space exhausted. Widen benchmark or finalize"}}
{"run":36,"commit":"2017e77","metric":95.11,"metrics":{"spec_sim":0.96,"transient_f1":0.9083,"pitch_p95_cents":0.42,"pitch_max_cents":0.59,"identity_corr":0.9885,"clicks_per_m":0,"underruns":0,"realtime_x":81.9},"status":"checks_failed","description":"One-pole rate smoothing before varispeed: breaks sample-exact timestamped retargets (contract tests) and pitch didn't improve (0.42c) — staircase is NOT the wobble source. Discarded.","timestamp":1785766044699,"segment":0,"confidence":68.79620853080388,"asi":{"hypothesis":"C1-continuous embedded rate improves keylock slope-tracking during rides","rollback_reason":"engine_latency retarget contract tests fail (smoothing delays the exact landing); pitch unchanged — delay-matched inversion already cancels the staircase exactly","learning":"residual 0.41c wobble is from splice fades (confirmed by overshoot exp: fewer fades → 0.36c). Ride pitch is at its architectural floor","next_action_hint":"add 3rd track, re-validate the two kept wins for generality"}}
{"run":37,"commit":"f44830a","metric":95.502,"metrics":{"spec_sim":0.9646,"transient_f1":0.9162,"pitch_p95_cents":0.41,"pitch_max_cents":0.51,"identity_corr":0.9885,"clicks_per_m":0,"underruns":0,"realtime_x":77.9},"status":"keep","description":"Harness: add 3rd scored track (Cold Heart, pop-dance 116bpm). New effective baseline 95.50 on the 3-track metric. Track B remains the weakest (F1 0.836-0.892).","timestamp":1785766300124,"segment":0,"confidence":62.300429184548285,"asi":{"hypothesis":"3rd track broadens material coverage before final validation","finding":"C (Cold Heart) scores between A and B; B (Hot Stuff) still worst on F1. Note: A's per-rate F1 shifted vs 2-track runs — crossover-120 splice chaos, same avg","new_baseline":95.502,"next":"re-validate crossover 150→120 keep on the 3-track metric (it contradicts corpus-settled tuning; must not be 2-track overfit)"}}
{"run":38,"commit":"f44830a","metric":95.337,"metrics":{"spec_sim":0.9624,"transient_f1":0.9134,"pitch_p95_cents":0.43,"pitch_max_cents":0.53,"identity_corr":0.9909,"clicks_per_m":0,"underruns":0,"realtime_x":77.2},"status":"discard","description":"Re-validate crossover on 3-track metric: 150 Hz scores 95.34 vs 120 Hz's 95.50. The 150→120 change generalizes across all three tracks (spec +0.0022, F1 +0.003, pitch better). 120 confirmed.","timestamp":1785766444706,"segment":0,"confidence":58.88843813387316,"asi":{"hypothesis":"check crossover-120 keep wasn't 2-track overfit","rollback_reason":"150 is worse on the 3-track metric too; revert restores 120","finding":"crossover 120 win is general: spec gain systematic on every track, F1 neutral-positive, pitch 0.41 vs 0.43. Remaining caveat is purely perceptual (owner listening check on 120-150Hz bass under splices)","next_action_hint":"re-validate quiet-gap splicing ablation on 3-track metric, then update prompt and continue exploring"}}
{"run":39,"commit":"f44830a","metric":95.167,"metrics":{"spec_sim":0.9645,"transient_f1":0.9052,"pitch_p95_cents":0.41,"pitch_max_cents":0.51,"identity_corr":0.9885,"clicks_per_m":0,"underruns":0,"realtime_x":85},"status":"discard","description":"Ablation on 3-track metric: quiet-gap splicing disabled → 95.17 vs 95.50 (F1 0.9162→0.9052). Both kept DSP wins now validated on 3 tracks. Restored.","timestamp":1785766589049,"segment":0,"confidence":62.0341880341857,"asi":{"hypothesis":"validate quiet-gap win generality via ablation on 3 tracks","rollback_reason":"ablation worse by −0.34 (F1 −0.011 across tracks) — quiet-gap win is general; revert restores it","finding":"final validated state: quiet-gap splicing (+0.34) + crossover 120 (+0.17) over the original engine on the 3-track metric","next_action_hint":"update prompt.md summary; then explore remaining: per-track B weakness (disco high-band density) or accept plateau and keep monitoring"}}
{"run":40,"commit":"1c76fe5","metric":95.491,"metrics":{"spec_sim":0.9645,"transient_f1":0.9159,"pitch_p95_cents":0.41,"pitch_max_cents":0.51,"identity_corr":0.9885,"clicks_per_m":0,"underruns":0,"realtime_x":77.2},"status":"discard","description":"Landing-energy penalty (0.02×relative RMS) in splice candidate scoring: 95.49 vs 95.50 — statistical tie, slightly negative. Correlation term already implicitly avoids bad landings.","timestamp":1785766766428,"segment":0,"confidence":58.88843813387316,"asi":{"hypothesis":"bias all splice landings toward quieter audio via per-candidate energy penalty","rollback_reason":"tie/−0.01 — no benefit, added complexity; normalized correlation is scale-blind but the quiet-gap trigger already captures the placement gain","learning":"candidate scoring is saturated; correlation + small distance penalty is the right objective","next_action_hint":"few untried levers remain; consider testing stereo width preservation or accept steady state"}}
{"run":41,"commit":"1c76fe5","metric":95.394,"metrics":{"spec_sim":0.9643,"transient_f1":0.9129,"pitch_p95_cents":0.41,"pitch_max_cents":0.51,"identity_corr":0.9885,"clicks_per_m":0,"underruns":0,"realtime_x":79},"status":"discard","description":"SEARCH_RANGE 160→128: 95.39 < 95.50 (F1 −0.003). 160 confirmed optimal from both directions on the 3-track metric.","timestamp":1785766914616,"segment":0,"confidence":59.98347107437909,"asi":{"hypothesis":"smaller search range converges drift tighter with less period-grid wandering","rollback_reason":"worse — narrower search misses better-correlated landings","learning":"SEARCH_RANGE 160 optimal bidirectionally. Full SOLA parameter space now mapped on the 3-track metric","next_action_hint":"steady state reached at 95.50; write session summary, then continue low-intensity exploration or await user direction"}}
{"run":42,"commit":"cf2b3c8","metric":95.502,"metrics":{"spec_sim":0.9646,"transient_f1":0.9162,"pitch_p95_cents":0.41,"pitch_max_cents":0.51,"identity_corr":0.9885,"clicks_per_m":0,"underruns":0,"realtime_x":77.8},"status":"discard","description":"HARD_TRIGGER 320→384 (alone): bit-identical output (95.502, every secondary identical) — the hard-force path never fires on these renders; postpones always resolve below 320. Revert to original constant.","timestamp":1785767183744,"segment":0,"confidence":58.650505050504535,"asi":{"hypothesis":"more runway before forced splices lets postpones find better spots","rollback_reason":"no-op: identical output proves HARD forcing never triggers on real music at DJ rates — splice damage all comes from the regular DRIFT/quiet-gap path","learning":"also confirmed this iteration: side-channel quality good (spec 0.95-0.98, image preserved by lockstep splices), output bit-invariant across callback sizes 64-1024. Engine is robust; scored space saturated at 95.50","next_action_hint":"remaining value is perceptual validation (render crossover-120 listening pairs) or new benchmark dimensions; no DSP knob left with an untested direction"}}
{"run":43,"commit":"12adeb6","metric":95.583,"metrics":{"spec_sim":0.9642,"transient_f1":0.9223,"pitch_p95_cents":0.46,"pitch_max_cents":0.68,"identity_corr":0.9885,"clicks_per_m":0,"underruns":0,"realtime_x":64.7},"status":"keep","description":"Graded quiet gate: required landing quietness relaxes 0.6×→1.2× avg as drift grows 96→192, so splices fire at the quietest available moment in their window. 95.50→95.58; F1 +0.006 on all 3 tracks (A/B/C each up).","timestamp":1785767490508,"segment":0,"confidence":54.5714285714275,"asi":{"hypothesis":"graded gate = splice at the quietest moment available, never delayed past the trigger","result":"+0.08 quality; F1 gain general (all tracks); pitch 0.41→0.46c (more splices, sub-JND); rt 78→65x from extra region_rms calls (still 65x realtime)","why_it_worked":"combines the two failed extremes correctly: strict gate at low drift (avoids extra splices) + lenient near trigger (never postpones); unlike fixed 0.75 gate which loosened everywhere","next":"tune the lenient endpoint (1.2): try 1.0 and 1.5; consider caching region_rms to recover throughput"}}
{"run":44,"commit":"b388984","metric":95.083,"metrics":{"spec_sim":0.9634,"transient_f1":0.9154,"pitch_p95_cents":0.6,"pitch_max_cents":0.91,"identity_corr":0.9885,"clicks_per_m":0,"underruns":0,"realtime_x":58.2},"status":"checks_failed","description":"Graded gate endpoint 1.2→1.5: worse (95.08, F1 −0.007, pitch 0.46→0.60c — too many splices in loud audio) and checks timed out. 1.2 endpoint stands.","timestamp":1785768484862,"segment":0,"confidence":58.650505050504535,"asi":{"hypothesis":"even more lenient endpoint near trigger","rollback_reason":"95.08 < 95.58; gate 1.5 admits loud landings early → more, worse splices; also 2nd checks timeout observed under heavy-splice configs (long-running sola/keylock tests?)","learning":"endpoint 1.2 is on the good side; try 1.0 next to bracket from below","next_action_hint":"test endpoint 1.0"}}
{"run":45,"commit":"b388984","metric":95.497,"metrics":{"spec_sim":0.9644,"transient_f1":0.9169,"pitch_p95_cents":0.42,"pitch_max_cents":0.67,"identity_corr":0.9885,"clicks_per_m":0,"underruns":0,"realtime_x":70.2},"status":"discard","description":"Graded gate endpoint 1.2→1.0: worse (95.50 vs 95.58, F1 0.9223→0.9169). Endpoint bracketed: 1.0 too strict, 1.5 too loose, 1.2 optimal.","timestamp":1785768617582,"segment":0,"confidence":54.5714285714275,"asi":{"hypothesis":"bracket graded-gate endpoint from below","rollback_reason":"1.0 endpoint misses useful near-trigger placements; 1.2 confirmed optimal (bracketed both sides)","learning":"graded quiet gate final: 0.6→1.2 over drift 96→192. Session best now 95.58","next_action_hint":"update prompt.md; consider recovering throughput (region_rms called 2x/block during pending drift — could cache) as a perf-neutral cleanup, or continue exploration"}}
{"run":46,"commit":"e60959b","metric":95.487,"metrics":{"spec_sim":0.9643,"transient_f1":0.919,"pitch_p95_cents":0.46,"pitch_max_cents":0.69,"identity_corr":0.9885,"clicks_per_m":0,"underruns":0,"realtime_x":66.5},"status":"discard","description":"Graded-gate window 320→160: worse (95.49 vs 95.58, F1 0.9223→0.9190). The wide window's blur is a feature — it keeps the whole landing neighborhood (search ±160) quiet, not just the fade spot.","timestamp":1785768804213,"segment":0,"confidence":52.785454545453476,"asi":{"hypothesis":"shorter gate window resolves inter-hit gaps more precisely","rollback_reason":"95.49 < 95.58; the 320 window usefully requires the whole candidate neighborhood quiet (search range ±160 means the actual landing can be far from the checked spot — a wide window covers that spread)","learning":"gate window = CORR_WINDOW is right for the same reason the correlation window is 320: candidates spread across ±SEARCH_RANGE","next_action_hint":"graded gate fully tuned. Next: maybe apply graded logic to the outgoing-vs-incoming asymmetry (outgoing span always plays — only landing needs the gate?)"}}
{"run":47,"commit":"e60959b","metric":95.497,"metrics":{"spec_sim":0.964,"transient_f1":0.9183,"pitch_p95_cents":0.44,"pitch_max_cents":0.68,"identity_corr":0.9885,"clicks_per_m":0,"underruns":0,"realtime_x":62.4},"status":"discard","description":"Landing-only graded gate (drop outgoing-span check): 95.50 vs 95.58. The outgoing check matters — fading out mid-hit smears the hit even though it 'plays anyway'.","timestamp":1785768932110,"segment":0,"confidence":52.02867383512615,"asi":{"hypothesis":"only the landing needs to be quiet; outgoing plays regardless","rollback_reason":"95.50 < 95.58; wrong — fading OUT of loud audio replaces its tail with different content, exactly as audible as a bad landing","learning":"symmetric gate confirmed; graded quiet gate is final as kept in #43","next_action_hint":"gate variants exhausted; next frontier would be splice-free correction (architectural) or more corpus breadth"}}
{"run":48,"commit":"e60959b","metric":95.393,"metrics":{"spec_sim":0.9645,"transient_f1":0.9127,"pitch_p95_cents":0.41,"pitch_max_cents":0.51,"identity_corr":0.9885,"clicks_per_m":0,"underruns":0,"realtime_x":75},"status":"discard","description":"Locally-quiet cap on graded gate (min with 0.9× fast local RMS): pitch fully recovered to 0.41/0.51c as predicted, but F1 0.9223→0.9127 — the cap also blocks the productive 1.0-1.2× gate tail on music. Net 95.39 < 95.58.","timestamp":1785769136793,"segment":0,"confidence":53.4659300184156,"asi":{"hypothesis":"quiet must mean locally quiet; uniform content gets no early splices","rollback_reason":"diagnosis was right (sine pitch recovered exactly) but any cap tight enough to block uniform content also clips the 1.0-1.2×avg gate range where a third of the music F1 gain lives (endpoint-1.0 test showed the same −0.005)","learning":"the +0.05c pitch cost of #43 is INHERENT to its F1 win — they trade against each other through the same gate range. #43's balance (F1-weighted 0.30 vs pitch 0.20) is composite-optimal. Also note recent_rms was write-side while gate is read-side (13ms misalignment) — even an aligned version faces the same tradeoff","next_action_hint":"graded gate closed for good; no further gate variants"}}
