{"run":49,"commit":"3475e60","metric":95.4,"metrics":{"spec_sim":0.9644,"transient_f1":0.916,"pitch_p95_cents":0.46,"pitch_max_cents":0.68,"identity_corr":0.9885,"clicks_per_m":0,"underruns":0,"realtime_x":69.3},"status":"discard","description":"Quiet-gap overshoot (+96 banked in strict-quiet gaps): 95.40 < 95.58 (F1 0.9223→0.9160). Even in silence, bigger jumps cost — the overshot landing's later audio decorrelates from what the fade expected.","timestamp":1785769705881,"segment":0,"confidence":53.76296296296095,"asi":{"hypothesis":"bank extra correction in strictly-quiet gaps (silence-for-silence trade)","rollback_reason":"95.40 < 95.58; wrong — a quiet GAP is short: overshooting by 96 frames makes the post-gap audio arrive 96 frames earlier/later than nominal, mistiming the NEXT hit after the gap (timing skew right where hits resume)","learning":"jumps must return the cursor TO nominal; any parked offset mistimes subsequent attacks vs the exact low band. This also explains why the distance-penalty increase (#15) failed in the other direction — landing choice wants freedom, but the TARGET must stay nominal","next_action_hint":"splice system definitively closed. Session at diminishing returns — next iterations should either widen corpus or run confirmation/maintenance"}}
{"run":50,"commit":"e874c1e","metric":95.508,"metrics":{"spec_sim":0.9603,"transient_f1":0.9237,"pitch_p95_cents":0.46,"pitch_max_cents":0.68,"identity_corr":0.9885,"clicks_per_m":0,"underruns":0,"realtime_x":64.8},"status":"keep","description":"Harness: 4th scored track (Somebody To Love, vocal funky house). New effective baseline 95.51 on the 4-track metric. D scores in-family (F1 0.928, spec 0.949) — kept DSP wins generalize to a 4th texture; no overfit signal.","timestamp":1785769910006,"segment":0,"confidence":55.72360844529744,"asi":{"hypothesis":"4th track (vocals) as overfit guard for the session's kept wins","finding":"D consistent with A-C: F1 0.928 avg, spec slow2 0.8786 (worst spec anywhere — bass-heavy content amplifies the design-intentional low-band pitch-follow at -16%). No anomaly → wins are general","new_baseline":95.508,"next_action_hint":"optionally ablate graded gate on 4-track metric for final validation; otherwise session is in maintenance mode"}}
{"run":51,"commit":"6ab28fe","metric":95.52,"metrics":{"spec_sim":0.9608,"transient_f1":0.9206,"pitch_p95_cents":0.41,"pitch_max_cents":0.51,"identity_corr":0.9885,"clicks_per_m":0,"underruns":0,"realtime_x":77.6},"status":"keep","description":"Ablation verdict: fixed 0.6 quiet gate BEATS the graded gate on the 4-track metric (95.52 vs 95.51; pitch 0.41 vs 0.46, spec +0.0005, F1 −0.003). The #43 graded-gate win was 3-track-specific. Keeping the simpler fixed gate.","timestamp":1785770061436,"segment":0,"confidence":51.29328621908106,"asi":{"hypothesis":"validate graded gate on 4-track metric via ablation","finding":"graded gate does NOT generalize: on 4 tracks it's a net wash (F1 +0.003 vs pitch −0.05c and spec −0.0005). The corpus-widening guard worked exactly as intended — caught a 3-track overfit before it shipped","decision":"keep the simpler fixed 0.6 gate (pre-#43); quiet-gap splicing itself remains validated (ablated separately at #39/#22)","cleanup_note":"code retains a vestigial `let _ = t` ablation marker — clean up next iteration","next_action_hint":"clean the ablation marker into proper final code; session then in maintenance mode at 95.52"}}
{"run":52,"commit":"2f7052a","metric":95.192,"metrics":{"spec_sim":0.9573,"transient_f1":0.9137,"pitch_p95_cents":0.43,"pitch_max_cents":0.53,"identity_corr":0.9909,"clicks_per_m":0,"underruns":0,"realtime_x":76.9},"status":"discard","description":"4-track re-validation: crossover 150 scores 95.19 vs 120's 95.52. Unlike the graded gate, the 120 Hz win GROWS with corpus width (+0.33 on 4 tracks vs +0.17 on 3): spec +0.0035, F1 +0.007, pitch 0.41 vs 0.43. Robustly confirmed; revert restores 120.","timestamp":1785770371322,"segment":0,"confidence":51.56660746003793,"asi":{"hypothesis":"crossover-120 must survive the same 4-track test that killed the graded gate","rollback_reason":"150 clearly worse; discard restores 120","finding":"the 120 win STRENGTHENS with corpus width — bass-heavy vocal house (D) gains most because its 120-150Hz bass fundamentals get corrected instead of pitch-following. Every surviving DSP change is now validated on the full 4-track corpus","next_action_hint":"both keeps fully validated; session is at a clean stable optimum (95.52). Remaining items are perceptual (listening pairs) only"}}
{"run":53,"commit":"2f7052a","metric":95.311,"metrics":{"spec_sim":0.9606,"transient_f1":0.9138,"pitch_p95_cents":0.41,"pitch_max_cents":0.51,"identity_corr":0.9885,"clicks_per_m":0,"underruns":0,"realtime_x":79.4},"status":"discard","description":"OPPORTUNISTIC_DRIFT 96→128 (later quiet-gap splices): 95.31 < 95.52, F1 0.9206→0.9138. 96 now bracketed both directions (64 and 128 both worse) on the widest corpus.","timestamp":1785770536294,"segment":0,"confidence":51.842857142859586,"asi":{"hypothesis":"raising the quiet-splice drift floor cuts marginal early splices","rollback_reason":"waiting until 128 lets more drift accrue to the arbitrary 192 trigger — fewer splices get quiet placement (F1 −0.007)","learning":"OPPORTUNISTIC_DRIFT=96 bracketed bidirectionally on the 4-track corpus; the quiet-gap window 96-192 is as wide as is productive. Every constant in the splice system is now bracketed on the final corpus","next_action_hint":"parameter space fully closed on the widest corpus; only perceptual deliverables remain"}}
{"run":54,"commit":"2f7052a","metric":95.52,"metrics":{"spec_sim":0.9608,"transient_f1":0.9206,"pitch_p95_cents":0.41,"pitch_max_cents":0.51,"identity_corr":0.9885,"clicks_per_m":0,"underruns":0,"realtime_x":77},"status":"discard","description":"Steady-state confirmation on clean tree: 95.520 bit-exact reproduction of the #51 best after all const-flipping and manual git ops. No code changes; also delivered 16 crossover A/B listening pairs (benchmarks/audio/output/listening/) for owner sign-off.","timestamp":1785770735802,"segment":0,"confidence":50.93333333333269,"asi":{"hypothesis":"verify the validated optimum reproduces exactly on a clean tree","result":"bit-exact 95.520 — tree is consistent with #51; nothing to revert (discard = no change, correct status for an unchanged metric)","deliverable":"16 listening WAVs: {msbwy,stl}_{minus8,plus8,minus16,plus16}_xover{120,150}.wav for the crossover perceptual sign-off","session_status":"COMPLETE at 95.52: all params bracketed on the 4-track corpus, both DSP wins ablation-validated, perceptual deliverables rendered. Future iterations: corpus growth or new objectives only","next_action_hint":"if continuing: consider finalize skill to prepare branches for review"}}
{"run":55,"commit":"05bd5eb","metric":95.52,"metrics":{"spec_sim":0.9608,"transient_f1":0.9206,"pitch_p95_cents":0.41,"pitch_max_cents":0.51,"identity_corr":0.9885,"clicks_per_m":0,"underruns":0,"realtime_x":77.2,"ride_spec":0.9974},"status":"discard","description":"Instrumentation probe: score the DJ tempo-ride render's timbre (timing-invariant spec sim). ride_spec=0.9974 — rides are essentially transparent; last unscored scenario confirmed clean. Composite unchanged (95.52); instrumentation committed separately.","timestamp":1785770819971,"segment":0,"confidence":52.785454545453476,"asi":{"hypothesis":"the unscored ride scenario might hide timbre damage under modulation","finding":"ride_spec 0.9974 — better than any constant-rate render (±8% ride averages near unity; splice cadence low). The engine's weakest scored scenario remains hard slowdown spec (low-band by design). No new optimization target exists in the benchmark's coverage","session_status":"fully converged; benchmark now covers constant rates, rides, identity, pitch, clicks, underruns across 4 tracks + sine","next_action_hint":"loop continues only with corpus growth, finalize, or user-directed objectives"}}
{"run":56,"commit":"aea5aee","metric":95.52,"metrics":{"spec_sim":0.9608,"transient_f1":0.9206,"pitch_p95_cents":0.41,"pitch_max_cents":0.51,"identity_corr":0.9885,"clicks_per_m":0,"underruns":0,"realtime_x":77.7,"ride_spec":0.9974},"status":"discard","description":"Held-out-rate generalization audit (±3%, ±10%, never used in tuning): all in-family — spec interpolates smoothly with |rate−1|, F1 stays in each track's band. No scored-rate overfitting; track B's F1 gap is material-inherent (0.831 even at +3%). No code change; steady state 95.52 re-confirmed.","timestamp":1785770934489,"segment":0,"confidence":56.70312499999997,"asi":{"hypothesis":"splice cadence might resonate with beat spacing at exactly the 4 scored rates (rate-axis overfit)","finding":"held-out rates 0.97/1.03/0.90/1.10 on tracks A+B: spec {A: 0.9932/0.9959/0.9629/0.9685, B: 0.9949/0.9968/0.9673/0.9723} and F1 {A: 0.979/0.973/0.971/0.962, B: 0.867/0.831/0.901/0.853} — smooth in |rate−1|, in-family with scored rates. Tuning generalizes across the rate axis","b_insight":"B's F1 floor exists even at +3% → dense-disco detector interaction, not splice damage scaling","session_status":"every generalization axis now audited: tracks (4), rates (held-out), callback sizes (bit-exact), stereo side, rides. Optimum at 95.52 is fully characterized","next_action_hint":"genuinely nothing left to measure; finalize or new objectives"}}
{"run":57,"commit":"92e6a53","metric":95.52,"metrics":{"spec_sim":0.9608,"transient_f1":0.9206,"pitch_p95_cents":0.41,"pitch_max_cents":0.51,"identity_corr":0.9885,"clicks_per_m":0,"underruns":0,"realtime_x":77.8,"ride_spec":0.9974},"status":"discard","description":"Tape-profile fidelity audit: streaming varispeed vs ideal offline 32-lobe sinc resample = 0.9992-0.9994 frame-wise spectral sim at ±8%/±16%. The 16-half-tap streaming kernel is spectrally transparent on real material. Both engine profiles now audited; no code change, steady state 95.52.","timestamp":1785771504826,"segment":0,"confidence":61.50847457627382,"asi":{"hypothesis":"the un-benchmarked Tape profile might hide resampler droop/aliasing vs an ideal resampler","finding":"spec_sim 0.9992-0.9994 vs ideal at every rate — the streaming kernel's theoretical 1.5dB top-octave droop is invisible on real material; waveform corr 0.72-0.75 is a benign fractional cursor-phase offset between time maps","session_status":"coverage closed: both profiles, 4 tracks, held-out rates, callback sizes, stereo side, rides, identity, pitch. 57 experiments; optimum 95.52 fully characterized and audited","next_action_hint":"objective exhausted — recommend finalize or a new objective from the user"}}
{"run":58,"commit":"a4e4950","metric":95.52,"metrics":{"spec_sim":0.9608,"transient_f1":0.9206,"pitch_p95_cents":0.41,"pitch_max_cents":0.51,"identity_corr":0.9885,"clicks_per_m":0,"underruns":0,"realtime_x":77.6,"ride_spec":0.9974},"status":"keep","description":"Underrun declick: fade real tail into dropout silence + declick fade-in on resume (both profiles). Boundary step 4.3×→1.0× signal slew — audible dropout click eliminated. Regression test added. Scored composite unchanged (95.52, boundaries outside scored renders); checks green.","timestamp":1785771989936,"segment":0,"confidence":62.70410367170712,"asi":{"hypothesis":"underrun boundaries (unscored scenario) hide audible clicks","finding":"confirmed defect: starve/resume stepped 4.1-4.3× signal slew on BOTH profiles — declick only covered warm-start priming. Fixed with symmetric tail-fade + resume-ramp (DECLICK_FRAMES=64, ~1.5ms); verified 1.0× slew after","keep_justification":"primary metric unchanged BUT this is a real audible-quality fix in the session's objective (streaming quality) outside composite coverage, locked by a new regression test, zero cost to any scored metric","next_action_hint":"check seek/set_track_position boundaries for the same defect class next"}}
{"run":59,"commit":"afd78e8","metric":95.52,"metrics":{"spec_sim":0.9608,"transient_f1":0.9206,"pitch_p95_cents":0.41,"pitch_max_cents":0.51,"identity_corr":0.9885,"clicks_per_m":0,"underruns":0,"realtime_x":75.5,"ride_spec":0.9974},"status":"keep","description":"Seek declick: post-reset release ramp (last emitted frame bleeds to zero, also over priming silence). Seek-boundary step 11.7×→1.0× slew on Keylock, 3.3×→1.0× on Tape. Regression test added; warm-start steady-level test's onset locator adapted to skip the intentional ramp (assertion unchanged). Scored composite unchanged; all checks green.","timestamp":1785798501508,"segment":0,"confidence":63.66666666666428,"asi":{"hypothesis":"seek boundaries carry the same click defect class as underruns","finding":"worse: Keylock stepped 11.7× slew (0.44 jump) at every warm-start seek — the priming path's early return bypassed render_chunk, so the cut edge was a hard mid-waveform→silence step. Fixed with a held-last-frame release ramp applied in BOTH the render and priming paths","test_note":"warm_start_resumes_at_steady_level test initially failed because its first-sound locator caught the intentional ramp; adapted locator to start past DECLICK_FRAMES — core steady-level assertion untouched","keep_justification":"audible-quality fix in objective scope, outside composite coverage, locked by regression test, zero scored-metric cost","next_action_hint":"boundary defect class now covered: underruns + seeks both declicked. Check keylock TOGGLE and end-of-stream edges if continuing this vein"}}
{"run":60,"commit":"d7a973e","metric":95.52,"metrics":{"spec_sim":0.9608,"transient_f1":0.9206,"pitch_p95_cents":0.41,"pitch_max_cents":0.51,"identity_corr":0.9885,"clicks_per_m":0,"underruns":0,"realtime_x":73,"ride_spec":0.9974},"status":"discard","description":"Boundary-class closure audit: forced callback-aligned dropout (exact N×256 media at unity, Tape) and natural drain both measure 1.0× slew. The hypothesized aligned-boundary hole is structurally unreachable (sinc lookahead always lands terminal audio in a shortfall callback where the tail-fade applies). No change; steady state 95.52.","timestamp":1785798643911,"segment":0,"confidence":62.03418803418382,"asi":{"hypothesis":"tail-fade misses dropouts aligned exactly to callback boundaries (popped==0 with fully-real previous callback)","finding":"unreachable: the resampler's STREAM_SINC lookahead (≥16 frames) always holds back terminal media, so the last real audio necessarily arrives in a shortfall callback and gets tail-faded. Verified by forced exact-N×256 unity-tape feed (worst step 1.0× slew, final fed sample plays as 0.0 = faded) and natural drain on both profiles","session_status":"boundary defect class fully closed with structural proof: underruns, seeks, end-of-stream, aligned dropouts all 1.0× slew. Defensive code for the unreachable case deliberately NOT added (simplicity)","next_action_hint":"streaming quality objective now exhausted across scored, unscored, and edge scenarios; finalize recommended"}}
{"run":61,"commit":"6a41b31","metric":95.52,"metrics":{"spec_sim":0.9608,"transient_f1":0.9206,"pitch_p95_cents":0.41,"pitch_max_cents":0.51,"identity_corr":0.9885,"clicks_per_m":0,"underruns":0,"realtime_x":70.4,"ride_spec":0.9974},"status":"discard","description":"Sample-rate robustness audit: ride pitch stability at 48k/96k matches 44.1k (p95 0.40-0.46c, max 0.51-0.67c). Frame-based SOLA constants do NOT degrade pitch at higher rates. Initial max spikes were a diagnostic tail-window artifact. No change; steady state 95.52.","timestamp":1785798794533,"segment":0,"confidence":60.48333333333106,"asi":{"hypothesis":"frame-based SOLA constants (windows/triggers halve in ms at 96k) degrade quality at non-44.1k rates","finding":"ride p95: 0.41c@44.1k, 0.46c@48k, 0.40c@96k — no degradation; elastic-drift mechanics scale with transposition, not absolute time","residual_risk":"seam/bass behavior at 96k on REAL music untested (no hi-rate corpus; CORR_WINDOW=320 frames covers only 0.4 periods of the 120Hz band bottom at 96k). Documented, not measurable without hi-rate material","gotcha":"first diagnostic run showed max=900c — tail estimation window over the (new) end-of-stream fade; always exclude ~300ms tail when zero-crossing-tracking a finite render","next_action_hint":"hi-rate corpus material would close the last residual; otherwise objective complete"}}
{"run":62,"commit":"d94222c","metric":95.52,"metrics":{"spec_sim":0.9608,"transient_f1":0.9206,"pitch_p95_cents":0.41,"pitch_max_cents":0.51,"identity_corr":0.9885,"clicks_per_m":0,"underruns":0,"realtime_x":76.7,"ride_spec":0.9974},"status":"keep","description":"Rest-recenter limit-cycle fix: bounded rest splices (residual < REST_SPLICE_DRIFT) end a degenerate mode where periodic content let the zero-jump candidate win — ~500 no-op fades/s forever with the seam de-phased (−2.4 dB permanent, reproduced at 48k). Now +0.00 dB recovery at 44.1/48/96k, 68 splices vs ~3200. Regression test added. Scored composite bit-identical; checks green.","timestamp":1785799251197,"segment":0,"confidence":62.034188034187586,"asi":{"hypothesis":"the hi-rate seam residual is measurable synthetically","finding":"found a GENERAL defect, not rate-specific: rest-recenter splices on periodic content pick the jump≈0 candidate (perfect correlation — same audio), freezing parked drift in a limit cycle: 500 no-op fades/s, seam −2.4 dB forever, fine-refinement snap cancelling the rest trim. 44.1k unit test passed only by parked-drift luck (drift < threshold there)","fix":"plan_splice gains max_residual bound; rest path requires residual < REST_SPLICE_DRIFT, else skip and let the trim bleed (87 frames → 0 in ~2.3s)","keep_justification":"audible defect fix (permanent bass thinning + fade storm after any nudge on sustained content), zero scored-metric cost, deterministic regression test at 48k","next_action_hint":"hi-rate residual closed; this was the last open quality item"}}
{"run":63,"commit":"3d33fb2","metric":95.52,"metrics":{"spec_sim":0.9608,"transient_f1":0.9206,"pitch_p95_cents":0.41,"pitch_max_cents":0.51,"identity_corr":0.9885,"clicks_per_m":0,"underruns":0,"realtime_x":76.3,"ride_spec":0.9974},"status":"discard","description":"Final pre-PR confirmation: clean tree reproduces 95.520 with all checks green. Session concluding; opening PR from autoresearch/streaming-quality-2026-02.","timestamp":1785799336662,"segment":0,"confidence":63.38864628820985,"asi":{"hypothesis":"pre-PR steady-state verification","result":"bit-exact 95.520, checks green — branch ready for review","session_final":"62 experiments: composite 81.87→95.52 (calibrated 4-track metric); DSP wins: quiet-gap splicing, crossover 150→120Hz; defect fixes: underrun declick, seek declick, rest-recenter limit cycle — each with regression tests; benchmark harness + listening pairs delivered"}}
{"run":64,"commit":"3d33fb2","metric":95.52,"metrics":{"spec_sim":0.9608,"transient_f1":0.9206,"pitch_p95_cents":0.41,"pitch_max_cents":0.51,"identity_corr":0.9885,"clicks_per_m":0,"underruns":0,"realtime_x":76.1,"ride_spec":0.9974},"status":"discard","description":"Post-#62 audit: does the small-jump degeneracy also afflict the main DRIFT path on periodic content? No — sustained-rate splice cadence is at/below the expected accrual/192 on both two-tone and 13-partial fixtures (8.8-12.1/s vs 13-20 expected). Degeneracy was rest-path-only (jump=0 only enters the search when nominal_jump < SEARCH_RANGE). No change; 95.52 steady.","timestamp":1785799586381,"segment":0,"confidence":64.08830022075016,"asi":{"hypothesis":"small-jump correlation wins could elevate splice cadence in the main DRIFT path on periodic content","finding":"healthy: cadence 8.8-12.1/s vs 13-20 expected (jumps average ≥192, search finds LARGER well-correlated jumps). Structural reason: lo = drift−160 ≥ 32 keeps no-op candidates out of range; only the rest path (small nominal jump) admitted them — #62's bound fully closes the class","session_status":"PR #32 open; splice degeneracy class closed with structural argument + measurement","next_action_hint":"await PR review/listening feedback; loop in maintenance"}}
{"run":65,"commit":"7217b8c","metric":95.52,"metrics":{"spec_sim":0.9608,"transient_f1":0.9206,"pitch_p95_cents":0.41,"pitch_max_cents":0.51,"identity_corr":0.9885,"clicks_per_m":0,"underruns":0,"realtime_x":75.9,"ride_spec":0.9974},"status":"discard","description":"30-minute soak audit (looped music, continuous ±6% ride + nudge every 47s, 85x realtime): 0 underruns, 0 NaN, RMS stable to 0.2% (m1 0.2511 vs m29 0.2506) — no accumulator drift, level decay, or leaks. Peak/step observations attributed to looped-source discontinuity + LR8 allpass overshoot, not engine artifacts. No change; 95.52 steady.","timestamp":1785799723715,"segment":0,"confidence":64.2300884955755,"asi":{"hypothesis":"long-run streaming may hide slow accumulator/drift/level bugs that 40s renders cannot show","finding":"30min soak clean: underruns=0 nan=0, per-minute RMS m1..m29 within 0.2%, wall 21s (85x). worst_step 0.65 and peak 1.36 are the looped source's own hard cut every ~40s + normal allpass overshoot — verified non-engine (clicks_per_m=0 on all non-looped scored renders)","session_status":"stability axis closed; every audit axis in the ledger now green. PR #32 awaiting review","next_action_hint":"maintenance only; fold in PR/listening feedback when it arrives"}}
